评论ID,电影名称,上映年份,用户昵称,用户评分,评论内容,评论时间,点赞数
2732479215,人潮汹涌,2021,豆瓣路人己,2,有多难让人相信这故事，就是上海女人咋可能会看上这样的男人呢,2021-02-10 11:56:21,4387
2748962678,人潮汹涌,2021,lovewei,5,挺好玩的，感觉比唐探和李焕英有意思,2021-02-17 13:32:39,707
2734719135,人潮汹涌,2021,天马星,3,一流的表演（除了万茜），二流的笑点，三流的剧本。同样是拍荒诞喜剧，饶晓志和宁浩最大的区别就是悬浮（即自以为是的接地气），其对喜剧的理解大概就是硬挠胳肢窝让人尬笑的东西，一如既往地要演员救场，至于万皇的表演，只能说您之前不火真的没毛病。,2021-02-12 10:39:52,6233
2739525107,人潮汹涌,2021,一文,3,短短一个月，华仔失忆两次。,2021-02-14 14:32:15,5469
2734934315,人潮汹涌,2021,阿年,5,人潮汹涌这部影片输在了名字上！！这名字我真看不出来是喜剧，还以为是犯罪悬疑片。完成度很好但是排片太虐了，看了导演之前的直播，因为预售不理想有点悲观和焦虑。看完只有一个感觉，华仔不愧是华仔！！,2021-02-12 13:49:54,478
2747362723,人潮汹涌,2021,尹子,4,自律的人，在什么样的环境下，都能把生活过得很好。,2021-02-16 22:32:09,3782
2735608295,人潮汹涌,2021,小爷们er,3,三星半吧，刘德华是真帅，肖央是真油腻，万茜是真一般，黄小蕾是真遗珠,2021-02-12 20:01:14,3006
2741503452,人潮汹涌,2021,高哥729,3,如果没有万茜这条感情线至少可以再加一分,2021-02-15 10:49:40,2776
2740603843,人潮汹涌,2021,馆馆,3,万茜和刘德华为何能如此没有cp感,2021-02-14 22:41:52,2484
2739506171,人潮汹涌,2021,烟花易冷,4,晖姐真的太倒霉了,2021-02-14 14:21:42,3724
2753077647,人潮汹涌,2021,illeverglow,5,这才是我心中的春节档No. 1,2021-02-18 22:14:26,455
2765752266,人潮汹涌,2021,不知道的事儿,4,唯一的感受：自律的人啊 在逆境和顺境都是一样的。,2021-02-25 22:13:14,2305
2734525734,人潮汹涌,2021,奈斯Biu,3,中国拍电影的地方就剩上海重庆了吗😅,2021-02-14 13:29:01,1145
2753268106,人潮汹涌,2021,杉爷,3,此片应改名叫《被坑骗的晖姐的一生》。他妈的晖姐又招谁惹谁了呢🙂 三星半吧，三星全给华仔，还是很帅很蛊。半星给四川话，自带喜感没办法。,2021-02-18 22:58:48,1047
2729873858,人潮汹涌,2021,椿的小鱼干,3,万茜真好看！其他就那样了。,2021-02-12 13:37:01,1000
2711745413,人潮汹涌,2021,是！憨🎱🐢明白,3,饶晓志真把刘德华给辜负了,2021-02-13 12:20:28,519
2623231977,人潮汹涌,2021,都柏林人,4,以前华仔摩托车后面载的是白衣飘飘的吴倩莲，30年后只能带带傻乎乎的肖央。,2021-02-13 01:24:01,1828
2734678831,人潮汹涌,2021,你张大爷,5,真正喜欢你的人，是不会给你打分,2021-02-12 09:39:24,531
2747872112,人潮汹涌,2021,樱桃小橘子,3,没看懂影片想表达的内容？以及感情线真的多余冗长，后期万茜一出现就想让人按快进键… 最出彩的角色当属黄小蕾的晖姐，她演得很好！,2021-02-17 00:36:49,434
2743709868,人潮汹涌,2021,Alue,3,To 所有的电影，不要随随便便在电影里添加爱情元素！不要随随便便在电影里添加爱情元素！不要随随便便在电影里添加爱情元素！重要的事情说三遍！（“这个就是爱情”“我爱你妈麻花情”）,2021-02-16 00:34:17,355
2725071308,人潮汹涌,2021,榜上有名猫,4,翻拍日本电影《盗钥匙的方法》，交换身份后的人生重启，后半部分做了本土化修改，笑点比槽点多，能看（PS：粤语点映场次，还是建议看普通话版吧）,2021-02-08 23:56:10,1179
2739472667,人潮汹涌,2021,138****1144,3,本以为会是《这个杀手不太冷》，哪知拍成了熊出没之喜羊羊智斗红太狼 隔着20多岁的父女恋怎么看都觉得出戏啊[尴尬] 所以资本是残酷的，有华仔又怎样，3%不到的排片1亿不到的票房说明了愿意进电影院的并不买账,2021-02-14 14:00:57,122
2734723746,人潮汹涌,2021,Pe4ch,2,很一般，感情戏又臭又长，仅仅是推动剧情作用。。片中三个女性，恨嫁女莫名其妙爱上德华，狐狸精骗钱跑路，反派女老大被男人和小三耍的团团转，刻板形象的塑造就像春晚小品,2021-02-12 10:45:42,805
2735280182,人潮汹涌,2021,大聪,3,3.5，没看过原版，就这部来说角色和剧情都能做到自圆其说完整收尾，但角色互换的主线互动上有些涣散，导致好几场戏与戏时间衔接出现断裂感，中段肖央和小九，刘德华和万茜这两对CP，磨了好长时间的感情戏，对于我来说并没有觉得是能成为角色转变的必要存在，因为肖央和刘德华所饰演的角色真正的逆转，是在于他们之间认清真相后的至关重要的几场戏上，结尾要收紧进行大对决时，更显得节奏把握的些许失控，只能用巧合，意外等处理手法去拉回到主线结局上。 影片的笑点也没有特别尬的地方，总体来说设置合理不会绕开角色设定刻意逗笑，华仔魅力依旧，继续喜欢华仔+0.5星。春节想跟大家长们一起看家长，华仔必须是知名度最高的，简单剧情也通杀全年龄。,2021-02-12 17:24:40,104
2742729297,人潮汹涌,2021,小影加油,5,这部电影，简直是华仔写给演员这个职业的温柔坚韧又浪漫情书~也埋了很多彩蛋对港片致敬，仿佛一夕置身那段黄金时代~肖央的故意做作和认真，华仔的呆萌和严肃，都是对份热爱的注脚~ 虽然喜剧的成分不重，但反差的喜感，又轻松又自然，又不SNP的低俗，就很舒服~ 人潮汹涌，不是你没有意义。 人潮汹涌，是多幸运遇见你。 在我心中，质量可排春节档第二了，但不知道为什么，全上海都是排片量非常少，希望网络的口碑发酵可以挽救这可怜的排片量~ 没看过原作，所以对剧情的重要转折还挺满意的[旺柴]愿所遇见的人，底色都是善良~,2021-02-15 22:17:41,310
2731800631,人潮汹涌,2021,小A,4,本地化做得不错，很克制的喜剧。导演把故事背景放在上海，是因为它必须是一个有电影产业的城市，而不是影视城那种剧组环境，这个想法很好。原作印象比较深的是香川照之教堺雅人演戏，最后一场堺雅人演技大为改观的部分，本片换成刘德华和肖央，肖央的表演很好，他演出了角色前后的反差，他是个编导演挺全面的电影人，有灵性，不知什么时候能再看他导戏。,2021-02-09 22:28:38,937
2735126453,人潮汹涌,2021,jj73浅之,3,想说以后跨国翻拍还是要谨慎，由于众所周知的原因，善恶对立与阶级对立是人家故事的核心戏剧冲突，本土化却一再被要求改编掉这些，所以哪怕再努力圆回来都像是在开玩笑，这才是最黑色幽默的地方。以及那个还以为很厉害的假孕女孩，演着演着就消失了？万茜可以的，刘爸第一帅！肖央的表演还是一样只有表没有里，看到最后还是觉得这个人物又怂又懒又蠢，和一开始没有任何差别,2021-02-12 15:59:31,87
2739479695,人潮汹涌,2021,陀螺凡达可,2,天呐怎么会如此无聊老土，以至于连吐槽都毫无兴趣。打从一开始改编的接地气层面就已经失败，笑料和爱情戏太尴尬生硬只能用淘宝抖音塑料配乐来烘托，两条叙事线感觉每一场戏都在比拼谁更无聊（无聊=盯着大银幕走神并疑惑怎么还没结束）（以及春节档三部喜剧无一例外都包含了呕吐/放屁以及男性角色女性化/易装的“笑料”,2021-02-14 14:05:20,404
2737414421,人潮汹涌,2021,嘟嘟熊之父,1,一群南腔北调的演员在丑陋的打光调色置景中互不打扰地扮演着完全不在同一次元的生旦净丑。导演对爱情的想象贫瘠到荒谬，女主的功能只剩时刻保持端庄的仪态和优雅的微笑，以及在必要时刻没来由地送温暖或扮柔弱。看来，公益广告是我国这帮中生代导演对现实主义电影唯一的想象，而且他们热衷于在一切题材中加入此种极尽虚假的现实关照，只为了拔高他们眼中的英雄男人。,2021-02-13 16:32:51,647
2735141932,人潮汹涌,2021,松井格纸,2,说实话，还蛮生气的，照着抄都好看的电影居然能拍的这么烂……加了很多无聊的细节，主角人设除了杀手都改的特别无聊，尤其女主原版那么可爱的性格居然改成这样，万茜演得也很差。刘德华火锅店那场戏拍的还蛮有意思的，但绝大部分笑点加的都是又尴尬又无聊。最后再吐槽一下这个电影名，和电影有半毛钱的关系吗。最最后，如果不能还原原版电影最精华的部分，建议不要翻拍，谢谢。,2021-02-12 16:08:38,359
2734694030,人潮汹涌,2021,废话队长,2,电影人潮汹涌，推广曲汹涌人潮，从俩名字就能看出来这次的改编有多不走心。前提“万物即大爱”，完全是初中生式的稚嫩笔法，杀人也能大爱，盗窃也能大爱，绑架也能大爱，他强由他强，我自“大爱”拂山岗。配角进场却不知退场，半吊着口气念白，无关痛痒。密密麻麻的剧作漏洞居然出自话剧界大拿饶晓志之手，这点我也是很惊讶。说明要么他根本没认真，要么就是他距离正规的影像创作还隔着十万八千里,2021-02-12 10:06:20,308
2734781654,人潮汹涌,2021,桃小谷,2,融梗太多，配乐大尬，不伦不类,2021-02-12 11:47:32,280
2779309314,人潮汹涌,2021,Molly白,3,万茜的感情线少半个小时就完美多了,2021-03-07 15:41:37,68
2750053362,人潮汹涌,2021,伊杭,5,我的天！！！这才是今年春节档最好的片子！没有之一。虽为翻拍，但拍得一点不失水准。非常标准的剧中剧套戏中戏结构，对影视圈及其他圈的暗讽与反思表现得如此顺畅与自然，笑点雅痞但绝不低俗，华仔真的是我们该致敬的演员，他顺便给大家上堂课。人生海海，你的财富必然与你的德行匹配；人潮汹涌，你的剧本再烂也要有能把它演好的本事！我太服导演饶晓志了，与上一部《无名之辈》一样让人拍案叫绝，大量致敬的桥段太过瘾了！,2021-02-17 21:17:41,173
2739116390,人潮汹涌,2021,LOOK,2,影像能力不行，对荒诞剧理解太肤浅，选角失败，一点都不想迎合广大普通群众的低级趣味，以为光靠一个刘特首就能打下春节档就真的是坐井观天。商业片导演还祈求排片和要饭的有什么区别。,2021-02-14 10:18:58,87
2737910422,人潮汹涌,2021,小枫,2,观影体验极差，真给我气得够呛，万茜会演戏吗？她连本能反应都做不出来，木头也不至于这样吧？基本上每一处表演都不及格！真想在电影院打她 >< 最后刘德华倒地响起了一段bgm，听出是奶茶唱的，当时脑海里浮现出了《天下无贼》的画面回闪，仿佛《人潮汹涌》的女主是刘若英，然后她和刘德华又要生离死别了……能想象这种荒谬的错位吗？万茜就差到这种程度！在她女主的电影里，让观众想起了别人的脸！太尴尬了……,2021-02-13 20:24:23,109
2734909753,人潮汹涌,2021,丑橘,2,节奏失控，全程灾难。原封不动照着原版去拍，都不会拉垮成这样。剧情逻辑bug多到懒得吐槽，真是抄都不会抄。,2021-02-12 13:33:46,242
2751710213,人潮汹涌,2021,Sunnypoldi,4,周全让我想起了莫斯科绅士，不管生活在什么样的环境里，自律的人总是能掌控自己和生活,2021-02-18 15:09:22,223
2513604554,人潮汹涌,2021,阿喵,5,我最喜欢的结局，是长夜将尽云破日出，是千帆过尽风浪初定，是坎坷历尽坦途在前，是每一个简单、善良又努力的人，在跋涉过千山万水之后，一抬头，星河璀璨，光芒万丈。知己希求，所谓的“人潮里，遇见你”，不过是一个平凡的人去寻找另一个平凡的人，一个心怀理想的人去寻找另一个心怀理想的人，一个赤子之心的人去寻找另一个赤子之心的人，是一群对自己对世界仍有所希冀的人，去向电影、向话剧寻找共鸣，寻找慰藉，使自己成为彼此的精神支柱，使自己成为自己的精神支柱。谢谢有态度的导演饶晓志，谢谢有态度的演员刘德华、肖央、万茜，谢谢这部有态度的贺岁片「人潮汹涌」。,2021-02-12 11:35:05,306
2741766911,人潮汹涌,2021,frozenmoon,3,内部对各种电影的戏仿，对电影理论的讨论，结尾废弃剧场墙壁上的贝克特，都能看出导演的戏剧创作欲，他不只是想讲个奇情故事，但最终连奇情故事都没能成立。后半段几乎没了逻辑。,2021-02-15 13:20:37,42
2738836057,人潮汹涌,2021,蒙面加菲猫,5,比起探案李焕英，这是一部看不到宣传听不到声音得不到排片的片子，只因为没有资本的青睐，刘德华们就不配拥有姓名么？,2021-02-14 02:26:25,119
2772694112,人潮汹涌,2021,浮光掠影,5,没想到电影这么好看，刘德华真的敬业了一辈子，值得尊敬。里面幽幽的搞笑氛围让人回味无穷。整个主题创意也很不错，新颖。很适合演员来看。,2021-03-02 22:06:32,87
2735129870,人潮汹涌,2021,Gretaco,1,万茜说话好恶心。和《盗》相比，这片子里人物关系多了不少不必要的情情爱爱，看着既拖沓又乏味。我最爱的玩具枪打弹珠镜头没有给演员全身镜头，喜剧效果直接归零。若有若无的说教意味毁了原作清新紧凑的艺术气息。作为翻拍，很有中国特色，然而日版能让我自己刷or带人刷上数遍，而这版看下来浑身难受。最生气的是，我为什么要为这部烂片这么多字？,2021-02-12 16:01:27,318
2758923199,人潮汹涌,2021,木卫二,1,根本不是这差一点那差一点的问题，这么自我膨胀的导演，拿个舶来剧本还敢凑到春节档自取其辱，妄图十万加票房的野心和自我感觉良好，真的太糟糕啦,2021-02-21 14:46:11,202
2737716287,人潮汹涌,2021,阿暖,2,真的很尴尬。2021年了，还在炒喜剧之王的冷饭，在国内这个“不能犯罪”的语境下，打了一切可能的补丁，描述了一场隔靴搔痒的、自欺欺人的、纯过家家式的犯罪，还想要从中找出一种英雄主义。这是……不可能的。（但肖央还是好可爱噢。）,2021-02-13 18:56:30,97
2742355622,人潮汹涌,2021,谢谢你们的鱼,1,春节档最装逼、最无聊、最做作、最自恋、最拖沓、最莫名其妙、最让人如坐针毡的电影，除了万茜和剪辑，几乎每一个环节都是错的。一个在上海拍摄的电影从头到尾没有任何的现实感，《无名之辈》再平庸至少有烟火气，本片完全是导演在脑中构建的高屋建瓴，整个质感特别像前年的顶级烂片《两只老虎》。没有想到的是，饶晓志的第三部电影居然反而是话剧腔最重的一部，剧本如果说点人话还能给个合格分，但是现在的呈现完全就是负分，一段段又臭又长又拿腔拿调的文戏简直是灾难，结尾的高潮更是把这种感觉推向了极致，而且你他妈买了《盗取钥匙的方式》的版权，最后拍了一个《杀手欧阳盆栽》是几个意思？对于主题的诠释更是又饶又生硬，差一点就比《侍神令》还难看了！,2021-02-15 18:21:55,175
2747784148,人潮汹涌,2021,该摸了,3,不论是浮夸的两层公寓还是莫名其妙的人潮汹涌，让这部影片就像浮在空中，观众够不到，也进不去,2021-02-17 00:12:33,68
2863642495,人潮汹涌,2021,再没人死于心碎,3,前半段不错，悬疑十足演技爆表，差点以为要拍成刘德华的生涯致敬片，后半段血崩，二流商业片的廉价感又出来了。,2021-05-04 09:01:38,42
2743031188,人潮汹涌,2021,哪吒男,1,再被你们的短评欺骗，我就学黄小蕾买凶杀人了！！！！！！！！,2021-02-15 22:03:31,137
2744541821,人潮汹涌,2021,胖得来要戏,5,劳模老刘带着戏骨黄小蕾和肖央给全国年轻演员和表演系学生奉献的沉浸式演技修炼课！,2021-02-16 10:00:02,90
2629848681,人潮汹涌,2021,小鬼家的师公,1,看过日本原版，有对比才有好坏之分~肖央装成傻乎乎，一脸的“傻人有傻福”，难道不该是又衰又丧吗？万茜装成不在乎，这上海话乱入和12岁儿子的添加是为了“黑色幽默”吗？~华仔讲话气若游丝，还不及黄小蕾的中气十足~故事改得也是有气无力，情节硬凑，三观不正~贺岁档喜剧整出个原创剧本就这么难吗？偏偏“抄作业”还能抄出个中日韩三版中的豆瓣评分垫底！,2021-11-11 16:25:41,7
2741362302,人潮汹涌,2021,Black Angel,4,刘德华真的太帅了，除了他，只有他，否则你根本无法相信李想那样的上海女人会爱上他，但因为是刘德华，这一切就变得合理，即使在最逼仄的小房间里穿着最破烂的衣服，但依然掩盖不住他的魅力。巧合在电影里被无限放到，通过这样的故事，让人看到每个人面对生活际遇的无奈。但还好还能有理想，还能有希望，还可以抱团取暖，人潮汹涌，感谢遇见！,2021-02-15 09:00:35,329
2734714125,人潮汹涌,2021,柯诺,2,当饶晓志试图向我们阐述“表演是什么”时，他对“电影是什么”仍知之甚少。提到了《演员的自我修养》和《敞开的门》，建议导演不如翻一翻《我知道你们又来这一套！》，数数自己用了多少烂梗，犯了多少陈词滥调。,2021-02-12 10:33:22,173
2748967888,人潮汹涌,2021,木村的冲浪板,4,刘德华穿上立领袍子，我就觉得下一秒要开口唱“我恭喜你发财”了哈哈哈,2021-02-17 13:35:03,194
2744028683,人潮汹涌,2021,1127½°,4,在我以为刘德华演的角色一定是个牛逼的人物时他被套进了麻袋。20210215 @ 佳映IMAX影院9号厅 6排9座,2021-02-16 02:34:15,174
2735166453,人潮汹涌,2021,木石子,2,日版《盗钥匙的方法》≥ 韩版《幸运钥匙》＞＞＞这版《人潮汹涌》。,2021-02-12 16:22:32,76
2734836026,人潮汹涌,2021,香槟加农炮,2,四平八稳的剧本，执拗又突兀的话剧式表达，不够连贯的剧情衔接，硬凹出来的笑点，如果无名之辈是弄巧成拙打满的鸡血，那人潮汹涌就是乏善可陈的一地鸡毛,2021-02-12 12:37:17,67
2736679334,人潮汹涌,2021,想得美,1,刷好评的都很敬业了，居然能说出那么多好话,2021-02-13 08:35:32,110
2731648364,人潮汹涌,2021,朝阳区妻夫木聪,2,至少在我这里，这个本子即便有无数种改法，但改成爱情片一定是最无聊的一种。悬念感没了，喜剧部分也没有增强多少。除了那些似曾相识的电影桥段的“致敬”部分，以及配角通过“表演”当上“主角”这种设定有点意思以外，剩下的其实都比较普通，甚至无聊。文戏部分的节奏真的不好，很容易走神，最后那场爆发的戏，其实也有点收不住的感觉。（看了一圈友邻评价就我一个两颗星吗，但真的全程冷漠诶……,2021-02-09 21:08:16,127
2736262821,人潮汹涌,2021,怀特金,3,因为有原版故事的基础，加上刘德华的个人魅力，还算hold的住。 但原版实在是太好了，浪漫温柔，真的不知道翻拍的意义是什么，电影本身就是充满偶然的作品，你让原版导演自己来他都未必能再拍那么好。 几乎所有的改动都是减分（除了麻哥飙戏）。尤其是女主角，改的狗血又强硬，哪有孩子被绑架不报警的妈。 还有为什么又有四川话，太多了，大家有个默契，每年给川话角色数量定个额度好吗？真的听腻了。 为审核产生的改动也很大，既然这样直接写个尺度内的故事不好吗，再一次不理解翻拍的意义是啥。 结局也是，本来挺梦幻的世界观，非要给华仔肖央在bgm里一通土味暴打，太憨了。 好在原版的底子还在，没看过的观众还是能享受到剧情带来的愉悦。而且这个版本至少有在往浪漫的方向努力，比韩国版好。,2021-02-13 00:11:29,36
2672959675,人潮汹涌,2021,摊个饼,2,不能说难看，也不能说好看，就是处处都透露着不合理不相信，就算是荒诞喜剧也不相信的程度,2021-02-17 11:53:24,127
2726957176,人潮汹涌,2021,豆豆,4,就像没有看过《两杆大烟枪》而看到了《疯狂的石头》时的那种惊喜体验一样，这部优秀作品的本土化改编影片以及未来其他这样的电影都不应该被天然地被低看一眼，尤其是像疯狂石头和本片这样进行了具有鲜明特色的本土化再创作和创意加工后的作品，毕竟作为大众文化消费品一面的电影，大众有权利以自己更熟悉的故事形式去拥有更优质的电影文化消费体验，并不是所有人，甚至是电影票房的主要贡献者去看外语片。个人真的希望更多好的像前述案例那样的好的本土改编电影未来出现在数量越来越多，硬件也越来越好的中国影院的大银幕上，总比都给别人做了嫁衣裳的好些吧。,2021-02-10 20:37:03,735
2847673084,人潮汹涌,2021,戒泪的鱼,5,那个导演对刘德华说，感谢你对中国电影做出的贡献,2021-04-30 23:16:38,94
2738970452,人潮汹涌,2021,逍遥兽,5,很好看啊，为什么排片那么少那么烂？！玩了很多华仔的电影梗，太好玩了,2021-02-15 21:18:15,73
2857400793,人潮汹涌,2021,宇光同尘,4,自律的人终究自律，不会应该改变身份而改变,2021-04-29 14:07:05,58
2783505326,人潮汹涌,2021,【糖】,5,觉得比什么焕英唐3好看多了，也很感动。,2021-03-10 18:54:11,69
2763203232,人潮汹涌,2021,theemo,2,剧情割裂，类型混搭，配乐乱来，台词生硬，表演浮夸(肖)，主角惹人反感，强行扣题，逻辑混乱，没有价值观，没有主题，人物没一个立的住的，结尾又来无名之辈那一套。票房4亿嫌多。,2021-02-24 00:55:35,56
2758225858,人潮汹涌,2021,B,2,很杂乱的一部不知道到底是什么类型的电影。剧情不剧情，动作也不动作，爱情又不爱情，警匪也不警匪的。总之啥玩意都不是。中间老大一段感情戏看得人好困，这感情戏又不感动也不甜美。四川女这角色有傻又虎，既不像黑帮也不像老大。不知道这片子到底想表达啥。虽然真的不难看，但真的很平庸。基本上就是集所有套路于一身的大杂烩。本来想给3星，但感觉浪费俩小时，票价还不便宜。（最后，刘德华演技可以）,2021-02-21 01:23:10,53
2778906668,人潮汹涌,2021,同志亦凡人中文站,4,“喜剧之王”乱入“盗钥匙的方法”，饶晓志能把这个剧本改到过审也不容易啊。如果说光腚是最大的毒瘤，慧眼兼劳模的刘德华就是中国电影最大的幸运。好想看他边赏耳光边教小鲜肉演戏呀...,2021-03-07 09:48:29,41
2736266506,人潮汹涌,2021,二月鸟语,2,基本上1:1复刻原版《盗钥匙的方法》（2012），想说点什么感觉都是在评价原版，让我说啥好？在家看一遍堺雅人的原版他不香嘛？PS1：这片的元素根本不适合春节档，选个其他档期他不香嘛？PS2:对了，在落地上徒有其枝叶而无根....🤷‍♂️,2021-02-13 00:12:50,39
2735288421,人潮汹涌,2021,回报,5,看看那可怜的排片，想好好看场电影都找不到场次，所有电影院排片都给了唐探，可惜了华仔,2021-02-12 17:28:55,96
2744885103,人潮汹涌,2021,鱿烟,1,这到底踏马的哪好看了？无聊至极，看了一小时没有任何爆点，笑点也是挠痒痒，我冲着身份反转各种冲突来看的，结果你让我看刘德华和万茜谈恋爱？就这还有7分多合理怀疑刷分了，真难看得一批rnm退钱。这题材给宁浩拍，能给你整个大闹剧出来，这导演什么毛病啊拍个爱情片？0分不能再多了，rnm退钱啊,2021-02-16 11:27:26,77
2759015771,人潮汹涌,2021,蜉蝣,2,万茜的演技怎么变得这么油腻又小品化。,2021-02-21 15:46:03,46
2740971397,人潮汹涌,2021,乐欧巴可爱多,4,全靠同行衬托。,2021-02-15 00:44:36,89
2736839523,人潮汹涌,2021,邓梧桐（发财中,5,片子剧情很不错，刘德华肖央演的太好了，尤其是刘德华好几个画面我都想哭，肖央有一个片段致敬周星驰的我养你啊好搞笑。,2021-02-13 10:50:25,77
2739313940,人潮汹涌,2021,哥布林鲨不努力,3,过誉了其实，春节档票房垫底不冤，喜剧效果中规中矩，中间拍得跟爱情片一样，结尾搞得过于复杂(就报警不一样?)。最后是悬疑，喜剧都一般，爱情线还减分,2021-02-14 12:25:54,56
