评论ID,电影名称,上映年份,用户昵称,用户评分,评论内容,评论时间,点赞数
2757504131,人潮汹涌,2021,麻绳,2,很失望。非常吃力不讨好的翻拍，为了回避杀手身份，把人物逻辑和现实逻辑都牺牲掉了，原片中很多因身份反差而产生的有趣的东西也不见了，增加了无趣拖沓的情感线。其实开始几分钟就觉得要崩，细节处理太糙，高潮戏都是什么玩意儿。,2021-02-20 19:54:28,11
2843998686,人潮汹涌,2021,HarperYug,1,从头到尾的尴尬，看着真让人受不了。,2021-04-18 11:11:57,6
2856776988,人潮汹涌,2021,Summers,3,本土化不理想，牵强，后半段极其混乱,2021-04-28 22:04:29,11
2910447145,人潮汹涌,2021,吞云吐雾狮子兔,4,1.单就翻拍而言，跟《盗钥匙的方法》差的不是一星半点。2.电影致敬梗多到爆，但是很多人都没注意到的是宝马车牌号：2046。3.电影娱乐性很强，自黑也恰到好处，很有意思。4.全片精华台词在这里：导演抱着龙套华仔说：感谢你对中国电影做出的贡献，哈哈哈哈哈哈哈哈哈哈哈！！！！！！,2021-06-11 13:45:07,14
2735843132,人潮汹涌,2021,昭和惊弓鸟,3,对刘德华这个形象的解构其实单摆出来已经足够有趣，特别是由以前饱受演技争议的他来阐述表演的真谛，而消费其经典形象则构成了很特别的喜感，也同时带动了肖央的自嘲能力。不过除此之外好像就没剩什么东西了，非要剩点什么就是本土化做的还行？那种城市的肮脏旮旯很够味儿。,2021-02-12 21:42:34,14
2738012936,人潮汹涌,2021,青丝微绾,3,“长一张老脸，名字叫小萌，想死也是应该的”。,2021-05-06 15:30:22,21
2748738472,人潮汹涌,2021,又又,2,把万茜的所有戏都删掉就可以四颗星了，真的太尬太尬了。即使那么多致敬和彩蛋，但剧情烂就是烂，救不了。什么时候能看到60岁女演员亲30岁男演员呢，期待那一天。,2021-02-17 11:52:14,22
2735204004,人潮汹涌,2021,貓小三的意思其實是如果先生,4,几乎可以算是刘德华的演技个人秀，也像是他对自己四十年演员生涯的盘点和总结。在层层推进的情节中，刘德华的表演融进每次角色转换。粉丝不应错过的一个片。,2021-02-12 16:42:58,33
2734817913,人潮汹涌,2021,宋小君,4,刘德华再一次证明了巨星的魅力，但凡换一个人可能都没有这个效果，想起了当年在录像厅看《天若有情》的时候，感觉华仔在某些时刻已经打败了时间，片中是致敬也是回顾了华仔过往的作品，同时给影片平添了很多笑点和温情时刻。人生如戏，谁不是拼命演出呢。,2021-02-12 12:21:17,28
2761364457,人潮汹涌,2021,比干,3,结尾很不错诶 但是我吃太饱了困得要死 华仔那两句点题的台词真是尬穿地心,2021-02-22 22:09:24,16
2734811416,人潮汹涌,2021,渡口无边,4,刘德华的过往角色让人有太多记忆点了，当这样一位演员被安插在一个逼仄杂乱社会里，饰演角色转换之间，再与他本身的光环映衬起来，就产生了特别的化学反应。未看过原版，但看得出一些本土化的剧设细节，挺精准的。交换身份，没有绝对的坏人，在汹涌人潮中去学习丛林法则，处处人生如戏，时时假戏真做，这些种种情节和事件，都让影片保持着奇妙的叙事张力，而从中透露出来的人性和荒诞，也都发人深省。,2021-02-12 12:15:24,37
2757615661,人潮汹涌,2021,文森特九六,1,懒得说了，无药可救……,2021-02-20 20:54:59,16
2494267259,人潮汹涌,2021,千寻｜Scorpio,4,春节档夹缝中求关注的电影，比期望值高。依然是非常饶晓志舞台剧风格，中间还小cue了自己的《无名之辈》，彩蛋cue了自己。当他依然走自己的路线时，剧本、演员和表达方式一定会有不同的争议。并不是传统的喜剧，主角儿依然是城市里落魄、不堪的小人物，但导演放大了这些人的生活危机，结局是缩小了未来，表达的是美好。ps，刘德华出场，内心os：《无间道》重现啊！好帅啊！（骑摩托车）《再见阿郎》啊！啊啊啊华仔我爱你啊！导演喜欢用特写镜头演员们，但是又有许多心理活动的呈现，比如万茜。这部剧，没有好演员的话，就容易垮。还好还好。,2021-02-12 10:57:34,192
2861212594,人潮汹涌,2021,杨淇羽,2,这个质量不能光赖排片了，唯一的笑点是刘德华总结自己人生那里，唯一的看点也是刘德华的演技，除此之外，感情的发生都很悬浮，高潮戏一定要是惨烈一身伤的，能不能努力跳出这个模板啊。换身份之后的生活应该是剧本最该好好写的，结果肖央那一整条线都了无趣味，除了一身毛病一点闪光点都没有。每次拉观众情绪都用老片音乐致敬，跟蹭流量有何不同？导演还总夹带私货，先把本职工作做好，再想着出名可好。,2021-05-02 16:29:28,15
2746926729,人潮汹涌,2021,樂啊樂,3,你如果忘记它是一部翻拍片，其实还是挺不错的，挺喜欢饶晓志底下的一些配角塑造的，黑色幽默的描写以及构图和跳切的运用也很不错，但是如果你知道它是一部翻拍片，而且看的还是最牛逼的日本原版（个人非常喜欢原版），你才发现几个主角在这部写的差远了，包括一些原作的巧妙的伏笔也没有了，可惜。,2021-02-16 20:53:43,11
2769698215,人潮汹涌,2021,大西瓜,3,7分。翻拍自日本电影《盗钥匙的方法》。 加了很多迷影梗，以及自嘲与调侃。片尾的判刑，黑底白字，一如既往地上演国产犯罪故事黑色幽默。肖央戏份中配乐也太多了点，刘德华短短一个月内失忆两次，好在这次想起来了，哈哈哈哈哈哈，万茜和华仔演情侣真的觉得不搭，拆弹专家2里倪妮和华仔也是这个感觉。 按说原剧本这么优秀，不知是心有余力不足，还是创作环境的原因，拍得有点散乱。毕竟，杀手这个角色在国内注定没有啥能拓展的。翻拍这部电影也是有点意外，肖央的演员职业倒是可以在片场创造好多梗。刘德华在线教演员们怎么做演员，怎么演戏。 人潮啊，汹涌啊。 “真正喜欢你的人，是不会给你打分的。” “或许忘了自己的身份，才能更好的扮演别人吧。” “感谢你为中国电影做出的贡献。”,2021-02-28 17:05:23,14
2765622923,人潮汹涌,2021,🥗,3,盗钥匙的方法原片精巧紧凑而诙谐，翻拍版人潮汹涌臃肿拼凑且割裂。人物动机难以自圆其说，从形象到行为都很不自然，大姐头完全是个强行推进剧情的工具人。节奏差，文戏尿点十足。如果没有最后一场戏的冲突升华，我毫不犹豫就打二星了。给2星半吧，春节档票房垫底不是没原因的，真的挺无聊。,2021-02-25 20:49:46,10
2752132925,人潮汹涌,2021,扭腰客,2,情感没立起来，极致的人物有了，极致的人物关系没了。华仔敬业归敬业，到底缺少一丢丢天赋，硬扛演技还是差那么一点意思,2021-02-18 17:56:13,24
2734377017,人潮汹涌,2021,西楼尘,2,有的人塑造宇航员父亲的外形，有的人念出对前任祝福的台词，有的人被肥皂清洗掉记忆，有的人因吊绳开启了新生。从不说假话是丢失记忆后的馈赠，预订他人姓名是开启新生的仪式。曾经把雇主当观众表演虚假的交易，如今怀抱真实的梦想在剧组穿过枪林弹雨，太多人把戏当人生过度投入，在表演中忘记了真实。,2021-02-11 21:46:15,11
2841820677,人潮汹涌,2021,卤化银AgX,2,不能说节奏差吧，是一点节奏都没有。,2021-04-16 18:25:56,13
2734678927,人潮汹涌,2021,✨李千万,1,太糟糕了👎，一星给刘德华,2021-02-12 09:39:34,36
2738666206,人潮汹涌,2021,发条橙,3,去年十一月份看过一次粗剪版，记得当时看完的唯一结论是，档期放在春节档，必死无疑。如今看来，一语成谶！,2021-02-14 00:46:05,16
2735249284,人潮汹涌,2021,盲忙,4,一直好奇为何会叫“人潮汹涌”，看过之后才发现，其实讲得不是汹涌，而是这汹涌的人潮背后，那一个个寂寥却又执着的灵魂。我们总是在失去后，才会开始慢慢去寻找自己，而认识“我究竟是谁”或许是需要穷其一生去找寻的答案。幽默中透着温暖，有致敬又不乏新意，除了定海神针般存在的刘德华之外，经过《误杀》和《人潮汹涌》的连番洗礼，肖央已经完全树立起只属于自己的“小人物悲喜剧”标签。,2021-02-12 17:07:53,43
2752263209,人潮汹涌,2021,momo,2,无名之辈的时候就觉得饶晓志导的不行，人潮汹涌进一步印证我的想法。本来这就是个假定性极强的故事，必须靠强人设和错置情境不断升级矛盾才能勾着观众看下去，结果节奏稀乱，硬加的大段感情戏又不断泄劲儿，本来这故事就不好改，我国怎么会有杀手，为了过审把人物消解又消解，几个主角人物表现的都假的一批，唯一能立住的人物居然是黄小蕾？第三段整个崩坏，放歌➕慢镜头的时候，我只想求黄小蕾拿个火箭筒把他们都轰了。就这还敢上春节档，想什么呢。。。。,2021-02-18 18:38:49,8
2734747399,人潮汹涌,2021,慕容复,5,作为一部翻拍电影，本作的本土化做的相当厉害了。尤其是刘德华在这一部的表现真是炸裂，他和万茜的情感戏也可以称得上春节档最佳cp了。另外，片中有大量刘德华过往作品的致敬，能看到《无间道》、《天若有情》等经典影片的桥段，回忆马上就浮现了，又惊喜又感动。,2021-02-12 11:13:06,38
2720216922,人潮汹涌,2021,我不爱学习,5,好看。 故事完整，人物性格分明，搞笑的地方真的搞笑，没有觉得有特别明显的煽情成分，可能是我太投入了，他做的太成功了。 在刘德华套上头盔的那一幕，个人英雄的味道很浓，但是他真的真的好帅！！ 有一句话印象很深刻。刘德华看你天花板上的绳子说：“再不堪，那也是我啊。” 最近发生的事情有点多，接受不堪的生活吧，毕竟是自己的。,2021-02-17 11:00:50,30
2766267038,人潮汹涌,2021,思郁,3,饶晓志的几部电影，能够在小段落上做的出彩，但是整体的故事线最后都会崩掉，全局叙事的掌控上差了不少。,2021-02-26 09:46:03,10
2766107460,人潮汹涌,2021,脱脱不迷失,3,说喜剧吧，也不够逗，说犯罪吧，也不够凶，没有疯狂的石头那种又逗又见血的感觉，不上不下，可惜了刘天王和肖央的表演，饶晓志上次无名之辈就这样，不上不下，那次不是春节档啊，别的片也不行，口碑就有了，这次唐探李焕英刺杀从三个不同的方面和它竞争了一下，就发现它并不能打(虽然这仨能不能说很强有待商榷),2021-02-26 03:14:09,14
2775699580,人潮汹涌,2021,Kaito,4,万欠的车牌是2046,2021-03-04 21:36:50,9
2878105446,人潮汹涌,2021,海豚,3,所以啊，人生啊一定要干干净净的。——20210515,2021-05-15 18:29:02,6
2734586152,人潮汹涌,2021,呼噜娃,2,剧情好散好拖沓，中间一大段恋爱戏完全没必要，要好笑不好笑感动不感动只有一大段的尴尬和无聊，想一口吃个大包子结果啥也没做好。但比小姐好看,2021-02-13 01:30:40,68
2734654634,人潮汹涌,2021,Schiesm,3,改得自作聪明。堺雅人全方位拉踩肖央，刘德华好帅艹可以对标香川照之。,2021-02-12 20:01:11,19
2638440450,人潮汹涌,2021,Lemon 丶,5,这部电影给我最大的感受不是在于他的喜剧部分，当然喜剧部分也是非常突出的一个特点，让我感受最深的是刘德华饰演的周全和肖央饰演的陈小萌在互换人生之后所表现出来的特质——优秀的人即使你把他放到再怎么恶劣的环境下他依然能够闪闪发光，那些嘴里喊着世界欠他一个机会的“无能者”即使某一天有机会把他放在非常耀眼的舞台也会满满的黯淡，因为德不配位，自然也就无法守住这一切。所以不过不按照后面的剧情来走，如果这一切都没有揭开的话，我想“变成”周全的陈小萌依然会慢慢的变成曾经的陈小萌，而变成陈小萌的周全也会在某一天依然会是周全。整个电影，陈小萌自始至终没有演好自己的那场戏，光靠所谓的善良在电影的最后一部分闪耀着人性的光辉，不愧是主角。如果抛开这一切，陈小萌不是一个好人，而是一个彻头彻尾的失败者，懦弱、自私、从骨子里,2021-03-27 23:50:29,31
2719056154,人潮汹涌,2021,UsKy:D,4,《演员的自我修养》,2021-02-17 11:11:14,23
2743554398,人潮汹涌,2021,Shaun,2,好难看啊。,2021-02-15 23:58:47,28
2734904966,人潮汹涌,2021,三部曲,5,再一次感受到了肖央的演技！作为一个专业演员在片中演一个不会演戏的烂演员，不得不说肖央在很多细节处理上非常巧妙，很有代入感。另外这次春节不能回家过年，看完之后还是被故事治愈了，即使独自一个看这部电影，也会觉得心里暖暖的。,2021-02-12 13:30:29,44
2748960205,人潮汹涌,2021,猫,4,真的好看啊！这么好看的片子排片却这么少是为毛？一直就想“该怎么收科”，但收科真的又合理、又合情又合制度。华仔你这个年纪还这么好看太没天理了！,2021-02-17 13:31:32,31
2730006509,人潮汹涌,2021,毒鸡汤,4,今晚终于把春节档的人潮汹涌给看了，我是推荐的，有bug但故事是完整的，华仔那条线很完整，火锅店老板略夸张了...可能我没看过原版《盗钥匙的人》，所以故事对我来说是新鲜的，抛开我浪姐一对万茜恶感，影片里她没让我觉得油腻还行，演她儿子的小演员是董洁儿子么？总感觉有点像😅,2021-03-10 21:56:48,9
2859878040,人潮汹涌,2021,不留痕迹,2,基本是全程的倒退，不管是改编还是演员，中国观众真的太包容了，就这都能票房逆袭,2021-05-01 17:40:06,12
2742875802,人潮汹涌,2021,Vermouth,5,故事还是很流畅，笑死这个笑点低的我了。华仔疯狂打脸“演员们”。,2021-02-21 16:17:42,25
2740936763,人潮汹涌,2021,momo,4,3.5，超出预期。打四星是因为评分太低 刘德华真帅啊！爱情线有点尴尬了，女主还是黄小蕾吧。,2021-02-15 00:31:32,20
2708440008,人潮汹涌,2021,桃梨.キララ,3,前半段还挺好看，后面实在不行,2021-04-29 22:32:48,10
2733981779,人潮汹涌,2021,斯德哥尔猫,4,这排片和票房是真心疼啊,2021-02-19 14:40:05,18
2746186730,人潮汹涌,2021,顗礼,2,洪常秀看了都得直呼内行的尴尬美学+间离效果（屁咧），干瘪到令人无语；你说它是“戏剧电影”吧，情节和人物全都是垮塌的；你说它是玩“解构主义”吧，看起来更像是因电影技法生疏过头而产生的谜之实验感；演员们的集体表现不差，但这种表演（而非角色状态）的“好”最多算是遮羞布，就仿佛导演在说，“你们看，我找的演员都这么好，你总不能给我低分吧？” 总之，虽然整体观感并不像“唐探3”那般令人恶心，但饶晓志导演也真的不要再拍电影了吧...,2021-02-16 17:22:55,17
2762697650,人潮汹涌,2021,三_z_Q_l,4,卧槽 有一说一这是我看到现在觉得最好看的贺岁片…小说家很一般 唐探给我感觉脑子瓦特了 朋友说李焕英其实很平淡 那我觉得人潮汹涌没毛病啊…除了部分剧情我觉得有点慢ˊ_>ˋ而且我好喜欢肖央阿 我觉得他好可爱好帅ˊ_>ˋ华仔就是真的 很带感 而且这部电影很适合一家人看阿…票房确实有点低了,2021-02-23 19:56:38,19
2732023223,人潮汹涌,2021,大奇特(Grinch),3,翻拍《盗钥匙的方法》，仍然是基于身份互换与欺骗，对中年危机、孤独到身份进行探索。戏剧派导演饶晓志用贝克特的技巧在交换身份的假设中找到了角色丢失的真实自我，套用了《终局》探究自身身份即“我是谁”的问题。并且利用了刘德华的演员身份和大众辨识的迷影元素，为角色赋予更多值得玩味的空间。不过，导演有时还是会过份沉溺于电影舞台化的表达中，从而会破坏电影现实的严谨性，这依然是他今后要改善的地方。片中藏有不少雷尼·马格利特的画作，最有趣的是改良自《戴黑帽的男人》的《终局》海报。,2021-02-10 00:18:44,8
2738188037,人潮汹涌,2021,呆逼,4,日本原版很早就看过，并且就是因此get了香川叔的美貌（大雾？这部由刘德华来演这个高度自律的“杀手”再合适不过了，不过比起原版，人潮汹涌里好像加了更多感情线，陈小萌也变成一个比原版那个窝囊废更让人讨厌、角色不那么成立的版本，不知是不是为了赶贺岁档，黑色幽默里还要来点治愈温情，夹了不少迷影致敬梗，分开看还行但气质整体有点碎。不过刘德华这么老帅老帅的，加半颗星，感谢他对中国电影作出的贡献好吗！都给我去看！,2021-02-13 22:07:16,20
2761871970,人潮汹涌,2021,grape,1,看完我闺蜜：“这个电影讲了个啥？”…笑点尴尬，感情线莫名其妙，人设崩塌，剧情太散，剧情也不好……影院的鸭脖比较好吃。,2021-02-23 08:28:36,25
2839989325,人潮汹涌,2021,酥牧奇,4,改编可圈可点，不要太苛刻啦，片尾总是有落网字幕也算是中国特色了。。,2021-04-15 01:02:45,17
2777797253,人潮汹涌,2021,慕思萧萧,3,有两个让我感觉不舒服的点，小萌毫无愧疚替代周全的身份，周全一个居然是个伪杀手，为了结局完满而强行给人洗白的转折太过生硬了！,2021-03-06 15:28:42,14
2734701951,人潮汹涌,2021,华盛顿樱桃树,4,非常导演思维和导演趣味，带着导演之前作品的审美和脉络。翻拍作品来说完成度不低了。肖央现在不得了，稳健之余逐渐有了个人魅力。,2021-02-12 10:17:48,72
2734930625,人潮汹涌,2021,啊哦,5,反正最后 警察是得来的 局是得进的,2021-02-12 13:47:32,51
2733981784,人潮汹涌,2021,誓言＿瞬间,3,翻拍本土化做的不错，但是影片节奏和原作相差太多，出现了一种明显的割裂感和不真实感。,2021-02-12 19:13:28,16
2840230247,人潮汹涌,2021,KevinX,3,非常不接地气的一部电影 看不到落地的烟火气 只看到一个又一个工具人为双男主工作 情感勉强、动机古怪 好在导演的镜头语言还算流畅 忽略掉配角的奇奇怪怪还是能看的 （另外如此纯正的黑色幽默核心也没必要非得扯什么人潮汹涌幸好遇到了你这种爱情语言了）,2021-04-15 10:42:08,6
2672235518,人潮汹涌,2021,青衫旧我,5,刘德华万茜刘若英。好想去看呀。 2.12 看完啦。,2021-02-12 13:00:53,1
2742705991,人潮汹涌,2021,ShelleyR,5,这电影 不给排片 还有心？ 自来水拉起来,2021-02-15 20:46:39,39
2753229373,人潮汹涌,2021,浅浅,4,人潮汹涌无疑是一部合格的喜剧片，它以一种新的喜剧方式，通过已有的，由刘德华自身所塑造和代表的电影符号和早已充斥在周围的场外信息，为电影量身定做了结构性的喜剧元素。,2021-02-18 22:49:53,19
2842025550,人潮汹涌,2021,William H D Lee,2,我看过日本的那个 盗钥匙的方法 有比较 就。。。,2021-04-16 21:41:01,5
2804643420,人潮汹涌,2021,大头绿豆,2,这部片子用一些东拼西凑的桥段、拿枪指着我的头都不会相信的逻辑、华而不实的场景，编造了一段毫无根基、令人尴尬的故事。它比那些显然粗制滥造的电影更糟的地方在于，这样会浪费更多钱。以及：华仔无论在什麽样的屏幕上，跑步的样子都是他自己；万茜之前不红是有道理的。,2021-03-23 17:42:58,11
2750740857,人潮汹涌,2021,我只想睡觉,5,“我怎么会爱上你，你怎么会甘愿陪我玩人生游戏” 不看不是中国人！！！好看好看好看！！超多梗，致敬了很多经典港片，但又不是胡乱拼凑，以及肖央的演技有点惊到我。 刘德华yyds这句话即使我已经说了N遍还是要再说第N+N遍！！太tm帅了吧，演技真的绝了，跟肖央搭得也很好～ 周全戴上头盔再一次骑上当年那辆烈火战车本田NSR250的时候放了《天若有情》的前奏变调，惊了两秒以后在电影院发出一声“卧槽”，救命！！！太犯规了？！？我的华dee！！！华dee回来了[流泪][流泪]太好哭了吧！！大小姐爱上小混混/上海女郎爱上落魄群演甘于跟他亡命天涯，谁不愿意啊！！！！ 青春无悔不死，永远的爱人！ 《天若有情》yyds！华dee yyds！刘德华yyds！ 人潮汹涌，感谢遇见你。,2021-02-18 01:09:14,24
2844246360,人潮汹涌,2021,心生,4,趣味性做得还是挺好的,2021-04-18 14:47:18,2
2701592269,人潮汹涌,2021,闲人,1,因为评分还可以没想到可以烂到这个程度，编导完全不懂喜剧，不懂这个故事的爽点是什么。讲道理，导演洋洋得意的山寨小剧场话剧这套东西，不是应该在戏剧学院二年级就扬弃了吗？,2021-03-18 19:07:38,6
2752693082,人潮汹涌,2021,叩歌,4,1、拿一个多次翻拍的好故事，饶晓志大玩迷影致敬梗，以及本土化的黑色尝试，整体蛮惊喜的；2、相比春节档其他几部电影，这部更纯粹质朴地去讲故事，电影沉浸感更强；3、最大的彩蛋是向刘德华致敬，“感谢你为中国电影做出的贡献”。,2021-02-18 20:44:04,8
2755735303,人潮汹涌,2021,桃气乌龙青团,5,很有趣，比李焕英好看多了，这排片太虐了,2021-02-19 22:24:13,22
2736501949,人潮汹涌,2021,polk,3,整体看来无功无过甚至有些无聊,2021-02-13 02:07:24,27
2739951136,人潮汹涌,2021,早日退休瑾朵朵,4,一个月在电影院见证刘德华失忆两次，恢复记忆后剧情犹如泄洪现场整段垮掉拦不住,2021-02-14 18:19:08,12
2734772351,人潮汹涌,2021,lyy,2,2.5，好像泪点很多，但真情实感不多的，都是套路设置，音乐起音乐降的、没多大意思…,2021-02-13 15:19:19,22
2737681251,人潮汹涌,2021,momo,4,排片也太虐了，找了好多家，不是凌晨就是大清早，要不就特别远，还好最后还有一家影院中午吃饭的时间安排了一场，自从之前看了误杀真的超喜欢肖央，演戏很棒，未来可期！,2021-02-14 16:00:23,11
2734974638,人潮汹涌,2021,豪/ty久不见,4,大年初一第二场，居然是我包场看得！还不错得电影，中规中矩，达到了我想象得程度。遗憾的是没能超越大陆电影的底线！不够过瘾！,2021-02-12 14:17:18,28
2785122841,人潮汹涌,2021,一口一碗饭,1,我就没看过这么难看的电影。（金刚川至少还有四分之一的真料）,2021-03-11 22:51:24,19
2733594942,人潮汹涌,2021,浪呀浪,4,好不容易选了个好点的时间段看了，总的来说还可以，有笑点。说实话个人觉得这电影宣传方向搞错了，单单看宣传我还以为是文艺片，提不起兴趣，没想到不是。这部翻拍来说不功不过，还行。没有万茜就好了。,2021-02-16 23:24:31,4
2755899479,人潮汹涌,2021,ANTISOCIAL,4,故事挺有趣的，戏剧性很强，电影中出现的所有演员表演都很棒（尤其是晖姐，爱了爱了）。导演前作是《无名之辈》，如果你喜欢这部电影的话，那《人潮汹涌》也会合你胃口。7.5分！,2021-02-19 23:18:28,12
2734706942,人潮汹涌,2021,色令昏昏,5,无名之辈导演➕刘德华！ 特别有喜剧之王黑色幽默的感觉～ “感谢你对中国电影的贡献！你是个好演员！”不愧是华仔！,2021-02-12 10:24:34,93
2737142855,人潮汹涌,2021,seamouse,3,5分(10分制）。除了因为老艺术家刘德华的自黑桥段，其他笑料都很尬或者至少不是我的点。表演戏剧知识点生搬硬套，贝克特《终局》的舞台拿来主义尤其生硬，成了编导和演员自娱自乐的游戏场。个人私利和盘算，也远不能让两条爱情线自圆其说。,2021-02-13 14:06:18,9
2728236813,人潮汹涌,2021,HESCATE+,4,翻拍出了新的感觉 被低估的肖央 一如既往在线的刘德华 反倒是万茜有点可有可无,2021-02-12 23:36:17,23
2719776357,人潮汹涌,2021,云霄飞车手,4,我华仔可爱的，茜茜也可以，肖央赖赖的，一如既往，感受到了一些宇宙渗透,2021-02-12 13:56:32,39
2725443225,人潮汹涌,2021,Pluto,3,基本复刻了原版，削弱了黑色幽默部分，果然演技撑不住，就凸显导演天分不如宁浩。,2021-02-13 01:30:11,12
2735362709,人潮汹涌,2021,乍暖,4,翻拍自《盗钥匙的方法》，几年前看过原作，里面的日式笑点当时很难get到，这次陪家人看《人潮汹涌》，本土化的演绎和笑话让人倍感亲切。三个主角又蠢又萌，冷幽默方式想到《喜剧之王》。刘德华的个人魅力非常强，26年后再度骑上烈火战车，他依旧是当年意气风发的男人。每个人都是自己人生中的演员，置换剧本不如提升演技，找出最适合自己的活法。人潮汹涌，却独自孤独，珍惜每一次的相遇吧～,2021-02-12 18:06:20,27
2737716968,人潮汹涌,2021,珍妮查理梅,3,最后20分钟的剧情直呼有事儿吗,2021-02-13 18:56:50,22
