评论ID,电影名称,上映年份,用户昵称,用户评分,评论内容,评论时间,点赞数
2117807005,人潮汹涌,2021,方枪枪,4,作为一部翻拍，虽然有珠玉在前，但不可否认的是，《人潮汹涌》翻拍的十分巧妙，皂滑弄人、人生互换的大框架之下，是各种本土化的设定与改编：万茜饰演的为阅读量焦虑的新媒体总监；黄小蕾饰演的火锅店女大姐大晖姐... ... 同时，这还是一部处处充满彩蛋需要仔细发掘的迷影电影，从无名之辈到流浪星球，再到刺杀剧作家，饶导、郭导、路导纷纷登场，同时这里还有很多刘德华曾经电影和角色元素，从天若有情到无间道，刘天王致敬自己太有意思。当然，看完电影让人印象深刻还是：优秀的人不管在什么境遇下都优秀！,2021-02-12 23:08:07,73
2563428056,人潮汹涌,2021,王别樹,3,也就还好，没笑几声，更大问题是那两段情感戏压根就不可信，本土化改造之后违法必究的结局那自然也是毫无悬念；影评人列表里清一色四星五星好评，让人联想到片中小孩演讲完毕德华登场，底下听众齐刷刷起立鼓掌的情景……大家伙是认真的么？不禁要跟误闯火锅局的麻sir一样疾声高呼：“恰饭咋不找我，我演技也是很好哒！”另外晖姐越看越像符龙飞，是有啥亲戚关系吗？,2021-02-13 20:38:05,56
2855383323,人潮汹涌,2021,干煸鸡丁,2,饶导，饶了我吧。太尬了，节奏奇差，不成熟的地方特多，音乐用得更迷了，趣味还是没进步，自己觉得接地气，但是实则不然。,2021-04-27 17:29:00,36
2762598154,人潮汹涌,2021,min,2,看完就知道，票房不行跟排片没啥关系，观众都是客观的，翻拍没问题，但是翻拍的节奏跟白开水一样，万茜刘德华的感情戏漂浮在云上一样不真实，票房不行是有原因的。,2021-02-23 18:39:14,39
2809275804,人潮汹涌,2021,Castiel,2,导演是怎么做到拍得那么普通却又那么自信,2021-03-26 13:12:44,28
2763962923,人潮汹涌,2021,我想大声告诉你,4,很不错 被春节档的片儿掩盖了。从电影的角度来说比李焕英真的强太多了，但这可怜的排片有点让人心疼失忆的华仔。万茜姐也没有评论的那么差啊。片子里的各个点也很精彩，致敬港片的感觉让人心头一热。,2021-02-24 17:19:56,80
2739638620,人潮汹涌,2021,子戈,2,作为一部翻拍片，拍成这样是不合格的。 高概念、大框架都是原片提供的，本来原创性就不足。而仅有的几点改动，在我看来，都不是加分项。 万茜人设，改为为爱痴狂的女强人；反派由黑道大哥改为痴情大姐；杀手所“杀”之人背后的腹黑故事，被彻底隐去；肖央和女老大闺蜜之间的暧昧戏，极其生硬；外加上打手和孩子间的温情戏码……每处改动就像一个个砝码，把原片的荒诞黑色气质，向温情、鸡汤倾斜。 高潮戏改为街头乱斗，堪称灾难，导致高潮根本顶不上去。且观看过程，始终像隔着毛玻璃，没有任何一个人物能让观众与之共情。 从《你好，疯子！》到《无名之辈》再到《人潮汹涌》，饶晓志真的退步了；况且在我看来，《无名之辈》原本就严重过誉。 在我看来，翻拍片应该是难拍的，在翻拍中建立原创性才是正道，而不该沦为一种“盗钥匙的方法”。,2021-02-14 15:38:22,44
2735186048,人潮汹涌,2021,基瑞尔,4,在喜剧、亲情以及全然专注营造“大片感”之外，档期里还惦记着爱情这个主题的，大概以这部最紧密。延续原版精神出发的改编，依然把刘德华和万茜各自饰演的男女主所产生的爱情作为戏剧化故事和反转之外、贯穿全片的主线；那个没有打开的车门却加注了飞奔转身的寻找。情到了，缘就不会散。而落点相对有趣，主要还在于能根据实际语境设计更具玩味的梗与小“彩蛋”。晖姐叫卖鸭血的火锅一看便知是谭鸭血，雷大头出镜巧妙联动同档《刺杀小说家》，刘若英片尾曲“魂穿”两人合作的《天下无贼》，还有片内片外的“饶导”...皆为观影时的小惊喜和轻松无害的调侃。刘华真的太好看了，继《拆弹2》后交出了另一个同样出色的“大贺岁档”功课。,2021-02-12 16:33:23,72
2875437588,人潮汹涌,2021,豁然开郎,3,开头很好，设计很新颖，但演到后面，就感觉有点扯远了，趋于平淡和庸俗,2021-05-13 13:10:21,29
2749842092,人潮汹涌,2021,三石一声,4,是目前我看到2021贺岁档整体最优秀的一部，欢乐气氛、悬疑设置、角色饱满度、故事逻辑性，导演都做到了非常平衡的掌控。差点误判万茜是个花瓶角色，后发现很重要；差点以为黄小蕾是个角色之间的润滑剂，后发现很狠很有戏！多处致敬港片的小彩蛋都是惊喜！,2021-02-17 19:58:55,46
2736355745,人潮汹涌,2021,晚不安,1,饶晓志一直在拍这种“乍一看挺对、细究全是错”的电影。《你好，疯子》吃表演，《无名之辈》吃结构，长板理论还在发挥作用；而到了《人潮汹涌》，他对这两件事的理解都已经走火入魔了。很疑惑这么重视戏剧的导演，是怎么让这个离谱的故事说服自己的，要完成身份的互换和成全，实在还缺乏太多细节的支撑。他完全不如自己提携的徐磊可爱，《寻找刘德华》那支宣传短片也果然要比正片好看。对港片元素乃至刘德华这个文化符号的剥削也是惊为天人（别拿情怀和致敬的遮羞布去掩饰消费的事实），比徐峥《港囧》有过之而无不及。最后的剧场戏硬把我看愣了，被《蓝色列车》支配的恐惧卷土重来。,2021-02-13 00:47:31,112
2742132081,人潮汹涌,2021,瘟疫青年,3,可能是为了过审？前面还好，后面改编得不伦不类，就隔靴搔痒的感觉。前面铺垫好好的“杀手”，看到最后原来是个高级演员，就很迷。有一段尴尬得我忍不住摸手机搜影评的程度…,2021-02-15 16:36:39,46
2734938868,人潮汹涌,2021,阿德,4,黑色荒诞温情喜剧，华仔亮点多，各种对港片的致敬与反致敬，值得一看。,2021-02-12 13:52:59,51
2762774044,人潮汹涌,2021,短短夏天,4,在影院里听到刘若英的时候，突然记忆回到了《天下无贼》。看人潮汹涌的意义在于，想起了刘德华几十年如一日的一丝不苟的努力，想起了，曾经那么多走投无路的人遇见他，得以重生，想起了岁月里他给我们的很多很多。写的时候，还想起了《与龙共舞》，我小时候最喜欢的电影。人潮汹涌，幸得你如日不落。,2021-02-23 20:48:07,35
2768602283,人潮汹涌,2021,charles·彧,4,天王真是倒霉透了，一个月失忆两次,2021-02-27 22:10:29,40
2722582235,人潮汹涌,2021,阙如,1,无聊死了 春节档重灾区 让我想想这些年春节档看过像样电影么,2021-02-12 14:43:04,45
2735402772,人潮汹涌,2021,喻鸣,4,原作《盗钥匙的方法》底子好，堺雅人+香川照之也是绝配，翻拍刘德华搭肖央看似怪异，但另有一番况味。尤其是在刘天王本生已经成为流行符号和象征标签的情况下，先让他本色出演高大上杀手，再颠倒人生走向底层穷困，戏里戏外奇妙反差，这段互换人生也是一次“重塑刘德华”的历程。黑色喜剧，迷影梗很多，饶晓志在荒诞幽默中注入了不少温情，钢筋水泥城内，人潮汹涌中，光降临在相信的人身上。宜全家跨年，宜情人携手，正合适春节档。哈哈喜欢它和《刺杀小说家》《流浪地球》梦幻联动，春节档演员挺串戏呐。,2021-02-12 18:25:54,61
2735273841,人潮汹涌,2021,谋杀游戏机,4,排片有点可怜……故事源于《盗钥匙的方法》，多年前看过，笑得不行，我认为不会有人能超越堺雅人+香川照之了，没想到刘德华和肖央完成得非常好。华仔自带认真努力的老实人buff，肖央在《误杀》后好像真的变成一个很有质感的好演员了。饶晓志是资深戏剧导演，张弛节奏拿捏得精当，尤其前半段看得很舒服，还植入了很多文化人/艺术家的小细节梗。路阳和郭帆的戏中戏太好笑了，最具春节档气质的搞笑段落：“感谢你对中国电影做出的贡献！”几位导演的关系真好啊。,2021-02-12 17:21:20,56
2740996049,人潮汹涌,2021,宋倩文,1,坐如针毡两小时，烂梗叠加蒙太奇强行推进，充满了低级趣味和陈词滥调，故事核心是刘德华本人，靠消耗观众对演员本人的好感度来给让烂梗们成立。导演非常爱自己，植入了前作还把自己放在最后作为彩蛋了，先把电影拍好再这么搞行吗？不，也别拍了，您真的没有才华。,2021-02-15 00:54:06,49
2777951626,人潮汹涌,2021,甯以昔,4,这电影是演员鼓励片吧？刘德华真的老了，但演技是真好，切切实实感受到了。,2021-03-06 17:26:05,30
2734746329,人潮汹涌,2021,闵思嘉,4,这是个必须要刘德华来演才成立的故事，他的大众度国民度在剧情之外，营造了更多只有中国观众才懂的喜剧意味，也算是本土化改编的一种思路。大姐大的改编在运用方言城市喜剧的同时，又用刻板印象的方式增加了笑点。但部分地方可能因为要做更落地的喜剧，有点冲淡类型感。最喜欢的是整体上放大了原版中演员/演技/剧场生态的部分，有戏中戏和骗中骗的交融，尤其是最后一场剧场的戏，其实有点《你逃我也逃》的感觉，那些关于“演”的探讨是心酸的，也是打动人的。,2021-02-12 11:11:51,95
2762901723,人潮汹涌,2021,是小鱼啊,4,三星半，其实在唐探3的对比下更想给它4星,2021-02-23 22:03:13,34
2745921291,人潮汹涌,2021,十一月的雨,4,春节档最被低估的电影。翻拍国外的荒诞喜剧最难的一个是本土化，一个是如何让人相信戏假情真。这两点饶晓志导演都做的很好。而且在原著打底之下，戏剧的节奏和完整度已经超过了半部好戏的《无名之辈》。万茜和刘德华都太好看了，有他们在一切都成立。黄小蕾本来是个非常符号化的角色，但却被生生演出了逼真的江湖气，实在惊艳。并没有感觉到刘德华被消费，致敬桥段也是非常的巧妙和合理。看着老将还在荧幕上谈情说爱，年轻一辈的导演们有爱的各自串场，真心感觉到一切都在变化，但有些东西又好像永远不变。,2021-02-16 16:06:10,69
2731610671,人潮汹涌,2021,内有恶犬,2,1/2的无聊爱情片和1/2的“大家快来找彩蛋”。双男主设定名存实亡，肖央的存在就是为了给刘德华万茜的爱情当观众吧。,2021-02-09 20:44:56,60
2735149869,人潮汹涌,2021,ZEE,4,可能是春节档最好看的电影/节奏把握得很好，没有多余的情节，几位演员也都贡献了不错的表演，刘天王尤为出色。,2021-02-12 16:13:22,57
2670477078,人潮汹涌,2021,小川叔,1,因为看过原版，也看过韩国翻拍版，所以还以为已经这么强的本子，直接翻拍不会出什么大问题，但万万没想到，能难看到这个程度！！魔改到无语，强行创造矛盾，原本里的笑点几乎没剩多少，夸大了毫无CP感的感情戏，还都放在没告白的部分，感情递进几乎没有，接吻那一刻，我尴尬的扣出一栋楼！各种稀碎的经典复刻致敬，看出了导演的毫无底气，最后黑白白字的宣判结果，真的是回归到十年前的刑侦戏时代，导演最后还给自己加戏露脸，还以为这很幽默？？这种一屁股坐碎路人肩膀的做法，真的不觉得羞耻么？我一开始还觉得排片少，一定要去支持一下，看完后我郑重告诉你，大可不必，大家真的可以把韩国版再看一遍，真的，别浪费钱,2021-02-16 15:15:07,26
2764198797,人潮汹涌,2021,空山,1,这么好玩的设定为什么能拍成这样？类型、叙事、情感十分混乱，见女老板吃火锅前，是荒诞喜剧，吃着吃着就变成了弱智、尴尬、无聊、冗长。万茜这个角色职场困境不成立、情感困境不成立，跟两个主角和整部电影可以说是毫无关系。你们一群干电影的真不知道自媒体人是啥德行？十分浪费刘德华和肖央。,2021-02-24 20:36:18,16
2776890870,人潮汹涌,2021,Echo,3,我终于懂了我妈年轻的时候为什么喜欢刘德华，不过万茜这个角色感觉完全多余啊……有她没她并不影响故事线。。,2021-03-05 21:44:10,36
2783749587,人潮汹涌,2021,了了,4,过年那会儿我们这拍片低没看上，前几天终于看了，我觉得比唐3好看,2021-03-10 22:05:39,20
2755671397,人潮汹涌,2021,贡丸猩猩,2,为什么《盗钥匙》那么好玩的设定和故事能改成如此无聊拖沓的“中年失忆杀手土味爱情故事”…,2021-02-19 22:03:05,53
2748832816,人潮汹涌,2021,居无定所的茶茶,2,《人潮汹涌》，6.5分。 因为前两天导演惨上热搜，所以我抱着路见不平掏钱相助的想法进了电影院。但是，对不起，我真的有一个小时左右的时间断断续续的打起了瞌睡，甚至有一次好像真的睡过去了半分钟。 剧情散乱、情感牵强、人物面目模糊。一头一尾加中间黄小蕾饰演的晖总那条线看得出是奔着黑色喜剧走的，但是除了这个呈“工”字形的框架以外，其余部分填塞的都是不知从何而起的一往情深。 说实话，两条感情线都相当生硬且尴尬，唯一让人印象深刻的只有黄小蕾的角色，其余的都在拖后腿，又或者说，只有晖总是在认认真真奔着票房去的，其他都是在及格线以下摸索。 我只能说，这个排片量并没有委屈它。,2021-02-17 12:33:48,33
2734856084,人潮汹涌,2021,梦里诗书,4,《人潮汹涌》并不是一次对《盗钥匙的方法》简单的套搬，相反这是一部让人颇感意外的惊喜之作，导演饶晓志虽然用同样的方式展开了这场交换人生的意外，但其在电影中透过细腻的情感铺垫，以及个性化的影像风格，既为电影成功嫁接起了让人能为之忍俊不禁的本土地气，也塑造出了能打动人心的小人物。,2021-02-12 12:53:49,195
2735257799,人潮汹涌,2021,巴伐利亞酒神,4,相比原作《盗钥匙的方法》，国产翻拍不但合格甚至还有惊喜。这是一部向电影演员致敬的电影，刘德华和肖央都以自身擅长的方式诠释“演员的自我修养”。四川黑帮+上海弄堂+车墩影视基地的组合非常有趣，接地气又玩梗儿，笑料不断。刘德华继《拆弹专家2》后再次失忆，但这次他证明了不管钻进陈小萌还是张小萌的身体，他依然能再次活成那个刘德华，天王气质尽显。结尾弹簧刀的处理也很黑色幽默，饶晓志团队再次证明了他们是中国电影业一支重要的生力军。,2021-02-12 17:12:40,40
2860863957,人潮汹涌,2021,浮一白,3,感情戏尴尬，节奏感不好，故事讲的也不好,2021-05-02 11:04:44,18
2847583553,人潮汹涌,2021,江南狷介,2,导演的能力实在撑不起他的野心,2021-04-21 03:03:33,19
2739148285,人潮汹涌,2021,木头,3,演技在线剧情迷惑🙃,2021-02-14 10:42:16,47
2735226151,人潮汹涌,2021,钱钱⁹猫头嘤,3,比起刘德华比较古早的表演方式我觉得肖央让我更入戏些～万茜，emmmm，不知道为什么就让我太出戏了，而且这个人物刻画太单薄了，根本就是个工具人～,2021-02-12 16:54:53,41
2862532883,人潮汹涌,2021,老天奶,1,话剧导演用迷影梗取悦文青跟直男导演用低俗软色情取悦下沉市场的观众有啥区别，何况这个电影还是个翻拍，在人家的故事里加上自己的人脉，自己的梗，有种小狗撒尿式的创作自恋，到处盖章呢。上部给了两星，因为视觉太丑了，简直就是快手大电影，这部有钱了还是那么丑，所以不是钱的问题，只能一星了。,2021-05-03 15:05:14,15
2769829780,人潮汹涌,2021,绿妖,4,就想看一看刘德华，很多年过去了，世界好像天翻地覆地改变过，但是他还在银幕上，稳定地勤勉，稳定地敬业，这种稳定让人觉得踏实又温暖。,2021-02-28 18:48:19,11
2726945161,人潮汹涌,2021,海岸线,3,并非一般的喜剧，开头戏剧张力很足，中期偏离了展现人潮汹涌的主题的道路，反而专攻爱情线和欺诈线，后期越拍越离谱，借航天服那段完全不能理解导演想表达什么。结局并不意外。,2021-02-27 18:25:22,3
2749124760,人潮汹涌,2021,吃块姜冷静一下,3,十分一般，很犹豫给二星还是三星，但想了想我唐探给了二星，觉得这个电影罪不至此，所以还是三星吧，刚开始我以为是个带着荒诞的犯罪喜剧，后来我以为是个披着互换喜剧外壳的爱情剧，最后我知道了，这是个什么玩意都有什么玩意都不行的乱片，互换身份的梗虽然老套，但是好好做依然有趣，可惜电影并未过多刻画这个部分，应该更多承担滑稽的肖央在中途已经成为了爱情故事的背景板，然后二人很快换了回来，开始进入搅和着爱情和犯罪和动作和什么乱七八糟矫情演员追求的收尾部分，不知所云，沦为俗套，刘德华很帅，肖央演技不错，除此之外全部无聊,2021-02-17 14:46:33,35
2742553807,人潮汹涌,2021,总裁小发,1,太差了………………………真的太差了…………………………烂得不可思议。导演拙劣的模仿让人摸不着头脑，只有晖姐一人演出了一点荒诞感，主角完全不投入，肖央太呆，刘德华感觉始终没入戏，万茜令人大失所望。,2021-02-15 19:52:04,35
2748605614,人潮汹涌,2021,Mike Law,5,我也要加入呼吁增加排片的行列！！！非常好看，连续几天都买不到票，终于在昨天从角落里硬生生的挤进去一张票。觉得很值得！！！人潮汹涌成为了我心目中春节档top1，李焕英top2。其他一些垃圾片，跪求你们不要再混票房了。高质量电影不应被埋没！理性上可能就四星，感性上我要打5星,2021-02-17 10:54:07,52
2734776354,人潮汹涌,2021,柯里昂,4,三个演员间的化学反应竟然出奇地好，最令人激动的还是对港片桥段和元素的活学活用，感觉作为监制的刘德华在剧本上应该也出了不少力，以及这么多年刘天王坚持用真声出演这点不得不让人佩服。如果不是特意加入了贴合春节气氛的喜剧元素，效果应该还会更好，预计会在春节档所有电影里口碑领跑，也应该是近年改编电影中本土化最成功的一部。,2021-02-12 11:42:30,76
2838862070,人潮汹涌,2021,胤祥,2,演员选错了谁也救不了，何况改得这么糊……洒狗血和挠观众倒是技巧炉火纯青。,2021-04-14 02:56:01,14
2763192066,人潮汹涌,2021,小金,5,2021春节档最被低估的电影！2021春节档最不应该错过的喜剧片！导演处处设梗，巧妙地将各种笑料包含在或致敬或恶搞之中，华仔、肖义进和茜茜子以及各位友情客串的咖哥咖姐们保证了全片演技在线，节奏不急不缓恰到好处、配乐时而温情时而动感抓人内心，反派角色也能流露出温柔一面，让观众在忍俊不禁之余慢慢陷入深深的感动之中，去体味换个人生换个活法的深刻主题。重新认识一下自己，说不定就能找到人生的意义！（无脑选华仔，准没错！,2021-02-24 00:46:44,40
2737510345,人潮汹涌,2021,僵尸太疲惫,2,浪费了刘德华，肖央好尴尬,2021-02-13 17:19:19,44
2740686897,人潮汹涌,2021,蓝猫淘气三千踢,4,剧情有点儿意思。属于乍一看：害！怎么又是巧合之间换了人生失了忆。但就在这个很传统的故事大框架下，很多细节比其他同类型电影来的合乎逻辑、黑色幽默。排片太少了。,2021-02-14 23:08:41,36
2765678463,人潮汹涌,2021,吃蠢,2,所有的梗都是导演的小聪明，捡都捡不过来，节制点吧。,2021-02-25 21:27:31,25
2760285082,人潮汹涌,2021,纸船君,4,春节档最佳,2021-02-22 08:22:15,39
2781346737,人潮汹涌,2021,BIG Z,3,（黄小蕾真的可以的，这次给人留下的印象实在太深了）终于《盗钥匙的方法》中国版的翻拍出现了，对于没有看过原作的观众或许尚可，但我总是在观影过程中不断浮现日版的处理方式。虽然一定程度上赋予了本土化黑色幽默的气质，但也难免有几处节奏错乱。最叫人如坐针毡的当属失忆后刘德华与万茜的情感对手戏，这一方面源自俩演员就是不来电，另一方面源自李想这个人物的平庸，当然还有万茜在表现人物上的不达标，平庸人物+不契合的演员+不契合的表演，非常拉低好感。此外，感情线加强之后，原本故事想要凸显的“掌控人生、性格决定人生”的主题又被冲淡了，变成了一场滑稽但又在电视剧中司空见惯的都市情感大杂烩。,2021-03-09 01:27:08,13
2737292663,人潮汹涌,2021,玛卡巴卡,4,1、很多跳切，爱了 2、戏剧式电影，但矛盾冲突不单线，几个小高潮和大高潮也设计得得比较舒服。“戏剧式”上比《一秒钟》好。 3、爱情戏好甜，吻戏那段爱了爱了，但刘德华那段没咋接住万茜的戏，然而整体还是好爱！是我喜欢的爱情戏没错了 此外的叨叨： 有一说一万茜好美！刘德华好帅！他俩好搭！ 好喜欢看主角是演员的片子。听到斯坦尼和布鲁克好亲切。 以后去看饶晓志的话剧。,2021-02-13 15:28:56,51
2736816803,人潮汹涌,2021,樓小贱,5,黑马！可惜了排片。你能看到致敬影片有《天若有情》《旺角卡门》《上海滩》《功夫》《八佰》《喜剧之王》《无名之辈》……的影子，并且友情的给《刺杀小说家》埋了一个彩蛋陆阳导演还打了酱油，史航老师那颜值就算侧脸打酱油也逃不过我的火眼，最后赤裸裸致敬卓别林狂赞。,2021-02-13 10:34:35,49
2735142719,人潮汹涌,2021,居无间,4,还是饶晓志擅长的荒诞喜剧风。影片最突出的优点有两处：1.市井生活的营造，包括方言与上海弄堂风情的展现；2.戏与人生的互动关系，导演加入了很多迷影设计，致敬了很多经典港片，最动人的是《喜剧之王》和《天若有情》，前者说的是刘德华在电影里和现实中的拼搏之路，有很强的互文性；后者是想升华片中周全与李想之间都市童话般的爱情。影片最好的一场戏是周全在片场冲锋，只为给心上人的孩子演一回爸爸，令人泪目，也打通了影片的两个主题：人生和表演。,2021-02-12 16:09:09,71
2709559843,人潮汹涌,2021,今天早睡了吗,4,事实证明，无论出生地选在哪，华仔都是人生赢家,2021-02-21 18:13:01,28
2849742270,人潮汹涌,2021,林溪,5,5❤给这部电影的所有演员，演得不错。 还有一句，晖姐也太惨了，这一辈子都遭骗子手里了。😂😂😂,2021-04-22 23:10:12,44
2757381526,人潮汹涌,2021,Mr. Infamous,3,情怀排得密密麻麻的，突然就好像不那么情怀了。但近来重新悦纳华仔后，看他跳出舒适圈后各种排列组合的卖力就真有点佩服的加持了。不过全片最亮眼的角色还是晖总，四川话那味道，被扑棱扑棱的火锅煮得沸腾，嘴未吃，心先辣上一口，真爽。这人潮汹涌的，谁遇得到谁，可不都不容易嘛。（突然想起看片时的疑问，是肖央也有裸戏了么？如果不是，就要问，是肖央也有裸替了么？）两星半。,2021-02-20 18:43:15,8
2735709459,人潮汹涌,2021,老袁,2,剧本问题挺大的,2021-02-12 20:47:07,21
2736452547,人潮汹涌,2021,themo,1,有点纠结1星还是2星，毕竟下午还因为过年给唐探3加了1星。 但是如此的尴尬我真的好久没在电影院里体验过了，尴尬到不敢置信。没想到居然是无名之辈导演的作品。 尴尬主要来自两个方面： 1、你敢信这是个发生在上海的故事？还有一堆人说本土化做得好，不是居委会大妈说了句你是什么垃圾就叫做本土化做得好，国际刑警、重案组咖啡，这些词在一个以上海为背景的故事里不是尬出天际？ 2、4个戏份比较重的角色完全没法评价演得好不好，4个人好像在演4部电影。 玩玩情怀，玩玩梗是加分项，不是主餐。整个剧本就像半成品，制作其实还是可以的，画面风格不知为什么让我联想起摆渡人绝世高手等一众烂片。,2021-02-13 01:35:28,44
2749526712,人潮汹涌,2021,工口工口工厂长,3,刘德华给你上表演课哈哈哈，但是显然万茜学得并不好,2021-02-17 17:43:25,25
2880467229,人潮汹涌,2021,有有生,4,精英就是精英，落魄了也能活出精英的感觉。,2021-05-17 12:23:08,12
2734887383,人潮汹涌,2021,次等水货,4,命运的阴差阳错让演员和杀手这两个原本毫无交集的人物互换身份，这在影视剧作中是两种非常典型的叙事脉络，但《人潮汹涌》这部电影通过肖央的诙谐、刘德华的正经，且又因本土化落地过程中得益于导演饶晓志独特的讲述故事的能力，让这种经典故事的剧本多了许多可信度与感染力。,2021-02-12 13:18:26,43
2736732794,人潮汹涌,2021,57,3,贺岁档听到彼得·布鲁克的名字也是活久见了。,2021-02-13 09:29:31,13
