评论ID,电影名称,上映年份,用户昵称,用户评分,评论内容,评论时间,点赞数
4430964358,哪吒之魔童闹海,2025,想毀掉你的心,3,我宝贵的两小时就这么浪费在看男宝随地特写撒尿镜头里🆘特效好看剧情俗套，更有踩烂仙女裙，女的觉得这桌菜不错再看桌上有女的,2025-02-01 00:38:59,681
4434951177,哪吒之魔童闹海,2025,林朝露,3,作画们辛辛苦苦地打磨出的画面，组成了这样一个故事，未尝不是一种地狱笑话,2025-02-03 19:36:42,505
4445730146,哪吒之魔童闹海,2025,一粒麦子,3,很无感。这种从愤怒中汲取力量的进路，几乎是我们耳熟能详且唯一熟悉的力量获取方式。因为我愤怒，我就有力量打败伤害我的势力，这基本是种巨婴心理，给人一种浅薄虚假的快感。唯一触动我的是东海龙王的两处台词：我们一直在退，然而其实已经无路可退了。以及，当海怪们决定拼了，但又眼见同伴们一个一个死去时，明显动摇露怯，龙王吼道：坚持住，不要退！ 这才是众生的真实处境。我们只能选择战还是退，无论敌人多么强悍，实力多么悬殊。不少人觉得南海仙翁隐喻的是美国。其实在中国社会中，真正的偶像和迷障是位高权重、垄断一切话语权的人和组织。而我们中绝大部分人，是在权力面前伏低做小，敢怒不敢言，只想着如何讨好南海仙翁以求得自身安稳和前途的人。,2025-02-11 23:19:10,248
4448935500,哪吒之魔童闹海,2025,Usual琳,3,越看越生气，这就是当今百亿票房的片子，电影行业真的是够了。,2025-02-14 23:13:27,350
4533505458,哪吒之魔童闹海,2025,薄荷豆腐脑,1,补标，这么烂的电影怎么会有人喜欢的，因为这句话跟朋友吵了一架 审美好莱坞化，传统文化符号化，剧情低幼化。无现代精神，无民族文化，无社会责任，只知道迎合去责任化的流行性伪自由主义。火成这样，令人悲观,2025-05-16 23:47:45,295
4463352367,哪吒之魔童闹海,2025,momo,1,疑似起点男频幻想爽文,2025-02-27 13:42:32,439
4414908880,哪吒之魔童闹海,2025,伊夏,2,技术是没问题，但一切都太割裂了。屎尿屁等低俗笑话居然比陈思诚还多，这部分当然可以逗笑学龄前儿童，但火烧陈塘关和鼎内炼狱，恐怖程度又直逼成年人底线。哪吒的成长完全不感人，只感受到了太多不必要的牺牲。千万别有续集，求求了。,2025-02-14 08:54:28,379
4440018412,哪吒之魔童闹海,2025,馈赠波光,4,"美术技术已达国际水平，剧本还没冲出亚洲。前半部分为了反转压得太平，一些笑点太浅不属于""幽默""，哭点有效是因为还是走膝跳反应而不是来自编剧技术。人物形象不够，典型化问题比较明显。电影行业别被这个票房引入歧途，还是要回到故事本身，之所以卖得好同行太菜+春节老家实在没别的事干。",2025-02-07 08:22:33,177
4412516640,哪吒之魔童闹海,2025,等糖,5,五年前“人心中的成见是一座大山” 五年后，我以为屠城的是申公豹,2025-02-09 09:51:52,200
4430238032,哪吒之魔童闹海,2025,小猫小狗流浪家,3,导演一定觉得他的段子幽默极了,2025-01-31 17:38:19,765
4429132010,哪吒之魔童闹海,2025,哲燊。,4,森林冰火人大战巨型格鲁特。,2025-01-30 21:43:52,248
4430496211,哪吒之魔童闹海,2025,山那边，还是山,5,五年前申公豹说“人心的成见是一座大山”，可是五年后我却依然认为他是反派，屠了整个陈塘关……,2025-01-31 20:35:50,244
4430343665,哪吒之魔童闹海,2025,п，功德变现流,4,主体完成度很高，但局部调料过足，用力过猛。好比“陈塘关庞贝式写实场景”和彩蛋里面的“搞笑式恶人互殴”，就不搭。另外，哪吒为什么被穿心咒撕碎了也不要紧？因为他是藕粉水凝胶做的，天然具有自修复的性能！,2025-01-31 18:57:02,105
4462139967,哪吒之魔童闹海,2025,🐖,4,过誉了。真的。 不用动脑子是好看的，熬光好帅，但现在好像绑上了什么爱国情怀、冲上了全球动画票房第一，就都变得尴尬了起来……,2025-02-26 11:47:39,103
4421020516,哪吒之魔童闹海,2025,饿霸地煮,4,画面相当精致震撼，但有意思的是细节。像长城围起来的陈塘关、像五角大楼的玉虚宫、邪恶宫殿最大的特点是白、欺骗反抗者将其练成灵丹、一切为了阐教的霸权、自诩照世明灯，实则欺世盗名…明喻的目的很明显了。其实现在的哪吒已经从单一的人的反抗，变成了革命的化身，我才不做神仙，我就是魔！我命由我不由天。而敖丙本身龙的属性，意味着指向一种传统的国族文化精神，两个人是革命和传统的联盟，共同面对天界霸权势力的挑战。,2025-01-29 14:32:27,540
4442275396,哪吒之魔童闹海,2025,乔生,4,石机娘娘自己宅家里玩挺开心 结果还天降横祸 招谁惹谁了 宅女代了啊,2025-02-09 00:06:38,192
4431971417,哪吒之魔童闹海,2025,已注销,4,如果能减少一些屎尿屁笑话我会打满分！！！,2025-02-01 20:00:09,157
4449218168,哪吒之魔童闹海,2025,大糕,3,买票看的，有点失望，敖光敖闰人物形象也太像游戏皮肤了，讲话表情AI感严重，屎尿屁梗太多，最重要的是剧情，太闹着玩了，一会无脑打架一会又无脑合作，全片智商加起来不超过250的样子，内核空洞，上价值上得尴尬，强硬煽情。在电影院无比怀念《疯狂动物城》,2025-02-15 07:13:53,291
4449151355,哪吒之魔童闹海,2025,风声空,2,笑死了，当年《深海》上映的时候，想靠世界顶尖水平的美术和特效吸引观众，所有人就像瞎子，只知道嚷嚷“剧情剧情”，铺天盖地全是贬低，仅用剧情一点就把《深海》贬得一文不值，各种博主大V纷纷锐评。现在《哪吒》又如何呢？还不是一样靠美术和特效吸引观众，剧情烂就算了，内涵肤浅人设单薄，台词尴尬笑点恶俗，缺点不比深海多吗？然后现在就成了国漫top1，哪个博主敢说它一点不好啊？稍微有一点不喜欢的声音都要被喊打喊杀的，没见过这么极致的双标。想象一下深海团队痛定思痛决心深造剧本，结果到今天才终于明白原来是双标恰烂钱，笑一下算了。建议以后也走男频爽文生死兄弟情的爆米花路线吧，火了就没人敢喷了。,2025-02-15 02:37:52,376
4464788403,哪吒之魔童闹海,2025,迷迷,2,特效堆砌，从头炸到位，审美低俗，沦为政治工具，强行自信,2025-02-28 22:19:23,236
4434183256,哪吒之魔童闹海,2025,Pincent,2,2.5 情绪煽动方式接近于表态时喜欢把音量开到最大，有点像在戛纳大影厅里大喊中文“NB”。几乎看不到什么情感和羁绊，感受不到人物理解世界、认知现实的方式，都只看到强设定和情绪输出，主线中掺杂了太多网络短视频式桥段，天庭那个大肚“灵宝”真人其实是导演本人的化身，很会熔屎尿屁抖音段子。最不喜欢的还是视觉过于紊乱，不太喜欢杂乱无章的美术风格。,2025-02-03 02:31:14,316
4462786707,哪吒之魔童闹海,2025,徐达,3,最后还是靠口号式、符号式的撕心裂肺的叫喊，就能爆pow打败上面的boss。 而现在中，个个人却都是怂蛋而已。 言过其实的一部电影，和《黑悟空》一样，全是群象全是集体主义跟风。国人真好骗。,2025-02-26 22:40:07,137
4434387978,哪吒之魔童闹海,2025,嗯…,1,评论区打五分的人指责打低分的人刻薄，而你不仅自大还没品。剧情魔改不讲逻辑，需要靠误会推动剧情，主角刻画得很难评（比如哪吒从杀龙王到救龙王是因为误会，显得冲动狂躁毫无判断力）。画面和特效确实不错，而剧情难看，加上把原来哪吒故事里最核心的反抗父权精神抹灭，靠喊话式抒情，我在电影院坐如针毡。,2025-02-03 10:55:23,842
4449340326,哪吒之魔童闹海,2025,xhaii,1,国人的审美越来越完蛋,2025-02-15 11:13:36,563
4434843149,哪吒之魔童闹海,2025,mumudancing,0,密集和巨大物堆砌的打斗画面，其实人物已经被削平了，只有道长立得住。主要靠插科打诨充时间，剩下的就是狂轰乱炸。当然本片显示了中国电影工业化的高度（和其他春节档一样）。甚至立意也是一样的，与父亲和解，保卫家园。但想象力并没有超越太多，古典中那个简洁留白依然犀利的哪吒毕竟远去了。,2025-02-03 18:11:49,111
4461821701,哪吒之魔童闹海,2025,未知星球,3,讨厌屎尿屁笑话,2025-02-25 23:51:35,136
4436058898,哪吒之魔童闹海,2025,知更鸟,3,我都不想说他剧情太俗套这个问题了，剧情约等于0，一直在打架，一直在喊口号，一直在煽情，一直在燃。是一个低龄向的很动画片的动画片，越看越困，导致最后那几句中二口号都尬不到我了。,2025-02-04 12:04:53,349
4431638230,哪吒之魔童闹海,2025,bear.07,4,神仙打架还得看哪吒。有几个让我不舒服的点，踩仙女裙子、石矶娘娘尤其是唯独让母亲牺牲，扣分。,2025-02-01 16:10:02,183
4440931749,哪吒之魔童闹海,2025,归舟,3,所以哪吒反抗了什么呢、一律无脑冲、自己全身而退、这个故事只能上大荧幕、失去画面的加持效果、用视频软件看就真的普普通通了 哪咤喊口号的时候吵的耳朵疼、双手插兜流里流气言行举止像个小混混、最讨厌的是又是那种无数配角牺牲为了主角的成长铺路、尤其陈塘关全城百姓 动画设计方面、发财树很有创意有点惊艳、但是所有角色脸部非常光滑、鹿童仙鹤是蛇精脸、是真的挺假的、宫崎骏很多动画也才八点多分、这个可能比较燃、一些口号能点到年轻人吧,2025-02-07 23:05:27,332
4433377825,哪吒之魔童闹海,2025,小凛未郁,4,3分给顶级制作，1分给国漫鼓励。剧情真的一坨。金扎木扎出场了，我才反应过来李夫人喊哪吒的那句咤儿怪异在哪里…三个孩子公用一个小名？人家都要血洗陈塘关了，李靖和夫人直接把百姓丢了直奔哪吒？父母是这个设定的话，孩子第一季为什么要遭那么多罪？第一季的主旨，消灭成见，在这一集直接放弃了，变成大家打倒传统意义上大反派的爽片。只有申公豹这个人设立了起来，在小镇做题家当了一辈子牛马，却还要看到家里的第二个大学生问他要内推的时候，那种欲言又止的心酸感刻画的很好。,2025-02-02 18:19:01,191
4445853620,哪吒之魔童闹海,2025,:P,3,中国人还是多啊,2025-02-12 00:53:28,265
4434470300,哪吒之魔童闹海,2025,中散,4,陈塘关百姓还真就无了，什么仙啊魔的，还是当人最惨,2025-02-03 12:31:39,216
4484670152,哪吒之魔童闹海,2025,月恋花,1,好难看，中国人都疯了吗,2025-03-19 21:34:27,240
4454562733,哪吒之魔童闹海,2025,蓦然不回首,1,一个健康的社会不应该只有一种声音。,2025-02-19 18:20:47,369
4630316140,哪吒之魔童闹海,2025,Annuus.Y,2,150亿，悲哀。。,2025-08-31 23:15:58,150
4442400982,哪吒之魔童闹海,2025,momo,4,申公豹才更我命由我不由天一些，寻找同伴，制定计划，对抗强权。 哪吒的每一步都是他的被动反击，觉得龙族杀父母，就把龙族关进去。觉得龙族没做错，就又转头拼命救龙族。没有一点主动性。,2025-02-09 01:55:55,137
4429065025,哪吒之魔童闹海,2025,Peter Cat,5,以赤子之心，完成对整个权力系统的质疑和瓦解。让最污秽和最纯洁完全反转。颠覆这个虚伪的制度系统。,2025-01-30 21:06:15,122
4437892213,哪吒之魔童闹海,2025,流泪猫猫头,4,我其实有点心疼陈塘关百姓。,2025-02-05 17:04:16,149
4432217878,哪吒之魔童闹海,2025,没有个性ID,3,又一次，母爱成了英雄叙事的注脚,2025-02-01 22:14:46,402
4434811145,哪吒之魔童闹海,2025,驚 情,3,所以主旨哪吒到底在反什么？屠城了，百姓有人在意吗？,2025-02-03 17:47:10,349
4605420687,哪吒之魔童闹海,2025,盘丝大仙,2,就这150亿？第一部最起码人能看进去，第二部光听他们喊来喊去，打来打去，不知道到底在燃什么？,2025-08-04 18:28:59,102
4429646877,哪吒之魔童闹海,2025,伯樵·阿苏勒,3,给你收编进体制，你就从妖成仙，不仅可以霍霍以前的妖胞，而且还开枝散叶当螺丝钉继续压迫。哪怕临到死了，还想着我看你是个人才，要不给你个编制吸收进队伍，咱也不用仙务员考试了，直接发证，破格录用。目标是远大滴，行动是正义滴，只不过执行上出了一点小小的问题，但阐教的事业是不容置疑滴。可惜啊，十年不见老仙翁，被揍得龙蛇飞动。神魔大战烧鼎煮锅，正派魔教孰善孰恶，海底生物毁天灭地：大师我悟了，合着《哪吒》才是真封神演义，真金庸笑傲，真蛟龙行动，真雄出没。,2025-02-02 08:00:31,115
4445840253,哪吒之魔童闹海,2025,3x,1,打个1星吧，致可悲的观众，可悲的市场。,2025-02-12 00:40:56,550
4378511169,哪吒之魔童闹海,2025,我变成了小狗,4,特效很赞，但剧情还是缺乏新意，更不用说那些低俗的笑点、隐含的厌女以及最后大战中强行给反派降低的战力。只能说片子本身的质量虽然不算差，但肯定配不上如此惊人的票房成绩。,2025-02-12 01:56:41,111
4464831236,哪吒之魔童闹海,2025,Tilda Li,3,勉强三星。优点全给造型设计。我只觉得这部电影是为心智为“小于15岁东亚男性”的人量身定做的爽片，听风就是雨，赞美中二，自我感动。除此之外的受众真的很难从中感受到真正的智识愉悦感。再者就是太吵了啊！能不能不所有台词都用喊得啊啊啊啊啊！！！最后画风突然日漫了怎么回事。,2025-02-28 22:49:05,104
4454092072,哪吒之魔童闹海,2025,L'humanité,3,料堆很足，场面大，鼎大，嗓门大，什么都大，比大更大，故事上“不走心，只走嘴”，角色设计除哪吒外，全员共享一张医美过度整容脸，搞笑时刻全靠肛欲期小娃，热血时刻啊啊啊我要干翻天地，煽情时刻又拿亲妈来开刀，诚然是精确计算过的商业大制作，但总有种吃饱这一顿，未来一年都要闹饥荒的错觉。,2025-02-19 09:30:32,167
4531175236,哪吒之魔童闹海,2025,斑秃野人,1,不献祭母亲不踩裙子不玩屎尿屁烂梗就写不出来故事了是吗？这烂片简直就是饺子献给他爹的情书，充斥着嗲子文学的矫情味，唯一的可取之处也就是特效了，够了我心疼陈塘关的百姓。,2025-05-14 00:12:25,261
4439958202,哪吒之魔童闹海,2025,Summersalt,3,加一星给特效， 陈塘关无辜被杀的百姓，安居乐业修仙问道却被炼丹的小妖们，为男主开大牺牲的母亲，结尾居然没有任何男主惋惜或要为其申冤报仇的剧情，真工具人， 不加屎尿屁剧情，不加鹤童被踩烂裙子露腿情节，不加鹤童被喷男主尿的情节，就不会写搞笑情节么， “因为我们还年轻，不知天高地厚”，男主邪魅一笑喊口号，这真的太油腻了，如芒刺背，如坐针毡,2025-02-08 17:24:38,250
4442417498,哪吒之魔童闹海,2025,一季風歸雲,3,就非得加那个屎尿屁呕吐物和踩别人裙子当笑点吗。哪吒一到高潮必须喊口号顶气氛吗。最后老美全责。,2025-02-09 02:22:12,281
4455734490,哪吒之魔童闹海,2025,羊肉串多放孜然,4,我心里综合7.6吧，但是起码是给了我放松的两个小时。 早上看到b站一个up的分享，越长大越没办法代入主角光环，更能共情的是老百姓，跟着申公豹的爹修仙的小妖，喝汤的土拨鼠，以及申小豹，因为觉得他们招谁惹谁了，努力生活却因为神仙打架卷入争斗失去生命。 所谓神仙，生活里的掌权人，不都是通过榨干普通人来得到的美好生活。,2025-02-20 19:36:09,81
4456548815,哪吒之魔童闹海,2025,引心,1,三观不正，毒害小孩，人物还丑……,2025-02-21 14:58:43,363
4628547712,哪吒之魔童闹海,2025,Automne,2,低俗的超雄,2025-08-29 22:52:56,141
4420577184,哪吒之魔童闹海,2025,江边一只梨,5,正邪终于不和样貌挂钩了，如果人们心中的成见是一座大山，那我们要决心翻越。,2025-01-31 18:28:50,189
4556267211,哪吒之魔童闹海,2025,Lane,2,实在看不下去，哪吒像是有精神病的npd,2025-06-12 17:26:09,125
4603865842,哪吒之魔童闹海,2025,作案,2,大量的口号说教意味的台词，天宫踩断仙女的裙子，喝尿，土拨鼠的叫声，最后漫威式的双方大战，这种烂俗梗和毫无新意的情节，叹息,2025-08-03 09:42:27,114
4451623047,哪吒之魔童闹海,2025,枪击三上,3,所有人仙妖魔都在没事找事👐🏿结尾小登哪吒每句台词都能被热血初中生抄进QQ空间个性签名里经久传唱，太咯噔了。,2025-02-17 01:15:08,160
4435299880,哪吒之魔童闹海,2025,鲜藕大王,2,谁伤我爹妈，我灭他全家，打架王哪吒到此一游。 单挑，群殴，其他没别的事儿了。 （笑点挺没劲，非把裙子踩掉干嘛？离呕吐物和排泄物远一点吧）,2025-02-03 22:12:08,398
4439912569,哪吒之魔童闹海,2025,此刻心情忐忑,3,笑点很幼稚，煽情很生硬，卖腐很用力，不知道是不是上一部太成功了，想的太多，变得太谄媚和迎合观众口味；不该复刻的地方通通摘抄，不该增加的桥段样样不落，各方面甚至真诚度我都觉得不如第一部。,2025-02-07 01:46:00,221
4448603989,哪吒之魔童闹海,2025,周子舒心上钉,4,别的都不错，就是有没有人在意一下哪吒他妈和陈塘关百姓的死活，感觉主要作用是在刷新主角技能cd...,2025-02-14 18:26:49,79
4435518843,哪吒之魔童闹海,2025,矛木,3,画面12分，剧情只有5.5分，可以说剧情和画面比是不及格的。 整个剧情都充斥着一种为了炫技而填塞了一些故事的感觉😅 希望剧本可以更用心，颠覆传统不应该是白的说成黑的，黑的颠倒成白的，经典可以深挖，可以改变视角去解读，而不是偷梁换柱，让本该敌对的二人成为好朋友麦麸😅 另，全片的夫人，龙姑姑，鹤，石矶娘娘也太工具人了吧😅陈塘关全体百姓和将士死了就死了，就只有李靖和他的儿子活的好好的啦？ 动画不是单纯炫技，也该传递正确的三观，希望未来中国动画越来越好！,2025-02-03 23:45:35,240
4603313036,哪吒之魔童闹海,2025,Priscilla,1,屎尿屁的玩意儿100亿票房，也就这么点出息,2025-08-02 20:23:02,196
4452062921,哪吒之魔童闹海,2025,摸三,3,抛却一切成见，心平气和观看本片，仍是难看和土的,2025-02-17 14:50:15,121
4444548188,哪吒之魔童闹海,2025,Macneill,3,不至于影史票房第一，总之还是现在的人太有钱了又爱凑热闹……,2025-02-10 22:23:56,195
4451465021,哪吒之魔童闹海,2025,快快乐乐,4,当我真的以为是申公豹屠城的时候，我才明白，人心中的成见是一座大山,2025-02-16 23:11:54,85
4450175695,哪吒之魔童闹海,2025,废话一罗筐,3,依然延续了第一部的叙事逻辑，第一部笑点停留在屎尿屁，第二部更是屎尿屁的升级版。鹿童和鹤童明明是同等级，最后打斗两个人能力差不多，为什么鹤童还要给他们盛露水，鹿童却可以坐着享受了？鹤童不仅要服侍，还要承担被踩裙子，被喷尿的笑点。这不好笑！,2025-02-15 23:09:34,165
4470347981,哪吒之魔童闹海,2025,热爱生活,1,这个魔童就是导演本人吧，只能说他写的压根不是哪吒，而是小布尔乔亚的无病呻吟，有这种货色票房冲顶，国产动画算是彻底死了,2025-03-05 21:40:56,323
4432642181,哪吒之魔童闹海,2025,就爱冰可乐,3,跟黄子韬一样爱燃的电影,2025-02-02 02:52:02,310
4448294389,哪吒之魔童闹海,2025,一只桃子,1,能不能别在大银幕上尿尿了,2025-02-14 12:24:39,441
4454358422,哪吒之魔童闹海,2025,迷路的太空人,3,感觉剧情一般，不知道在讲什么，就讲了哪吒很牛。陈塘关百姓死绝就为了让主角发光发亮，结果哪吒爹妈没死，然后又让哪吒妈死了。。。,2025-02-19 14:37:41,125
4438696168,哪吒之魔童闹海,2025,,3,2005年的无厘头屎尿屁+2015年的春晚全程嘶吼风格+2025年的饱满民间情绪=100亿神话，导演这次赚了这么多钱，希望以后能花钱雇几个稍微有水平一点的编剧，自己就专心做动画就好。再接再厉，加油。,2025-02-06 04:23:19,216
4435139216,哪吒之魔童闹海,2025,王祖贤,1,低俗低级…哪吒团队忘记哪吒这个故事为世人称道的原因了吗？反父权在哪里？通篇是父辈崇拜兄长崇拜…每一对父子都是那样相爱，每一位父亲都是那样强大正义善良，每一个儿子都在寻求父辈的认可，每一个弟弟都崇拜哥哥…父权崇拜的本质暴露无遗。很无聊很恶心。,2025-02-03 21:05:24,662
4450122882,哪吒之魔童闹海,2025,小呀么小二郎,4,觉得还可以，但没那么好，支持国产电影还是打个四星，就是现在已经变成一场狂欢了，很无语。剧情有点尬，好人变坏人坏人变好人挺俗套，人物塑造不太行，靠特效、煽情和简单搞笑撑着，基本没有好的文戏，一部中规中矩的商业片而已。,2025-02-15 22:40:11,92
4439398641,哪吒之魔童闹海,2025,豆友214640572,3,这里有没有人在意我们普通人的我请问呢,2025-02-06 19:32:48,259
4604696778,哪吒之魔童闹海,2025,丹枫宿雪,3,能不能讲点道理，不要这么超雄，能不能不要这么多下三路屎尿屁……,2025-08-03 23:19:09,93
4451029012,哪吒之魔童闹海,2025,nearown,1,啥玩意啊 俗套的剧情和对话 就喜欢搞特效大场面 空洞的内核 台词全是毒鸡汤式的廉价热血 这电影能进全球票房前十我都丢人,2025-02-16 17:47:55,454
4448774831,哪吒之魔童闹海,2025,Day,1,老百姓全死了，然后你说这是喜剧，结局还合家欢。,2025-02-14 21:19:15,470
4431553823,哪吒之魔童闹海,2025,跳水海岛,2,原创性太差了，全片观感：抄完火影抄电锯人2，抄完Re0抄指环王。另外，银幕上这猥琐宅男哥到底是谁啊，还我剔骨还父、血溅莲池的哪吒行不？中国动画的思想高度、编剧水准、艺术审美真就全面断崖了吗，除了几个网游大场面可圈可点，我找不到任何看点。,2025-02-01 15:01:22,364
4604644034,哪吒之魔童闹海,2025,lost-special,1,哪吒父慈子孝，敖丙父慈子孝，连申公豹也父慈子孝？？？创作者在爹味作品之外创造了一个新类型——儿子味作品。服了。,2025-08-03 22:41:36,156
4480189046,哪吒之魔童闹海,2025,YC,1,真不愧恶趣味直男电影，中国电影完了,2025-03-15 11:54:49,311
4427708352,哪吒之魔童闹海,2025,皇帝陛下的玉米,5,这才叫优秀的续集！这才叫会讲故事！这才叫高潮迭起的大战！这才叫伟大又催人泪下的煽情！这才叫恰到好处的CP感！这才叫把封神拍出史诗感！这才叫让人看了还想看！骂的就是你，战火西岐！,2025-01-29 22:37:18,314
4450690395,哪吒之魔童闹海,2025,栏停叙,1,please，让这个电影的讨论从我的世界消失吧。我已经被烦死了。,2025-02-16 12:12:41,445
4603310296,哪吒之魔童闹海,2025,忧伤的兔子,2,故事都讲不好，人物设定好空洞，笑点好刻意…特效再好也是浪费…到底是谁在吹啊…,2025-08-02 20:20:35,103
4433680755,哪吒之魔童闹海,2025,岛上的夏奈,4,扣一星吧，女性角色真的非死必反，顺直表现母爱的方式真的不如女导演。,2025-02-12 01:29:05,103
4432004638,哪吒之魔童闹海,2025,棉,4,很帅 故事好 但希望多点立体的女性角色 而不是片面的女性裙子坏了赶紧去换 对着镜子非要说自己美 有种刻板印象！！,2025-02-01 20:20:20,119
4429424292,哪吒之魔童闹海,2025,这里没有荠菜,4,很经典的剧情但是观感很好^^ 求第三部别拍屎尿屁/石矶娘娘/踩裙子,2025-01-31 00:12:36,153
4432365725,哪吒之魔童闹海,2025,Endoxa,3,好看的是美术视效、人物动机、政治隐喻，让人坐不住的是屎屁尿梗、过于刻意的口号式台词、老套的卖CP设计、每几分钟就滥用一次的音画煽情。幸亏是出生在电影市场疲软了一年之后的春节档，赶上了天时地利,2025-02-01 23:25:49,228
