评论ID,电影名称,上映年份,用户昵称,用户评分,评论内容,评论时间,点赞数
4777018336,夜王,2026,甘草披萨,4,居然不是一个单纯夜店故事，是又拍了一部九龙城寨啊(bushi)，在一个本该“打打杀杀”、唯利是图、最不可能讲感情、讲义气的地方，居然生长出乡愁般的怀恋与乌托邦一样不可思议的浓浓情意，一种面对衰退、不确定的未来，大家组成一个互帮互助的共同体，拥有共同进退的勇气，而且明显为了公映——看片头就知道本片根本不是临时抓来“救市”的，而是循序渐进的必然的公映，做出了相当大的妥协、隐性处理，本片反而具有了些许超越香港本土地域性的情绪流露(其实这点比本片题材更有审茶上的难度)，毕竟我们身边也有曾风光无限热闹非凡的娱乐场所，如今灯光暗淡乃至隐去，面对忧虑困难和不确定性，咱就别吵了，更别为了一部电影都能吵翻，咱要和他们一样互相帮助啊；当然了我看的这场有人无动于衷有人笑得前仰后合，笑梗接受度看来还是差异很大的,2026-02-22 16:19:01,16
4777862483,夜王,2026,奇爱博士,4,要努力守住自己的地盘,2026-02-23 12:27:51,21
4779834757,夜王,2026,🌵🌵,2,套用《金鸡》一类香港喜剧的叙事策略，通过描绘灰色行业反映社会的低迷，表现片中人物顽强乐观面对为现实打气（情绪上承接了《破地狱》）。只是剧作水平判若云泥，小人物之间的萍水相逢和点滴关怀变成了圣人恩典，性别叙事更是一塌糊涂，主要女性角色都服务于男主角弧光或功能性推动剧情，其他的全是NPC，无趣的三角恋和怀旧（谢君豪角色散发陈腐怀旧滤镜的同时极其顺拐地承担了作局对抗反派的重要环节）戏码一再拖垮节奏致使整体完成度还不如前作《毒舌大状》。,2026-02-25 10:49:24,26
4783526605,夜王,2026,SneakyFlow,3,廖子妤美神降临,2026-03-01 16:08:03,13
4783581970,夜王,2026,🌞娘卷卷🌙,3,这么正能量的吗？太美化了吧。桥段还可以，开头结尾不错，杨伟伦很好笑！感情戏非常封建，不过大家演得不错。我只有在郑秀文的歌出来的时候肾上腺素飙上来，青春回来。香港人在抗衰这一块真是遥遥领先啊！可黄子华身材维持得再紧致也给人感觉他不行，夜王得是老法拉利啊，就很难令人信服，我要是mimi（年少无知移情爱上黄也就罢了）看见谢君豪肯定一秒钟移情别恋啊，怎么会有人说“别叫我姚先生，叫我菲力”也完全不油腻的。摄影剪辑很舒服，有加分。可看。,2026-03-01 17:12:49,4
4775938340,夜王,2026,陈暮迟,5,无论男女都会觉得爽翻了、赢麻了！你是缪斯太子爷，我也是东日CoCo姐！,2026-02-22 17:37:16,40
4788799246,夜王,2026,还没熟的一果子,3,真的很厌倦男性中心叙事了,2026-03-08 11:03:14,15
4782409867,夜王,2026,马泽尔法克尔,5,娱乐效果是黄子华近年电影最强，也可以说是他近几部电影风格的集大成者。香港电影有黄子华这样的主心骨真是一大幸事，一直坚持拍这种有笑有泪、能反映自己生活的这方天地中人们的困境却又不抱怨不矫情、能温暖和感染所有华语电影观众的作品，让香港电影没有像台湾那样，一味追求恐怖猎奇，一条路走到黑。希望黄子华和杨伟伦继续搭档，成为我们这个时代的周星驰和吴孟达。请郑秀文真的超值，演戏还送歌，演到一半我就觉得该有恐龙扛狼，片尾旋律一出终于舒服了。全片所有角色抽烟从头抽到尾，还好没有在电梯里抽的，不然就违背黄子华主打歌的精神了。,2026-02-28 09:17:55,8
4778331905,夜王,2026,蜉蝣,4,纸醉金迷和百无禁忌娱乐精神之外，是悼念过后还要一起东山再起的勇气，非常喜欢这种满是情意和洒脱的态度。群像戏也把握住了每个人物不完美的鲜活精彩，同时高效呈现她们真心真情被发现、被温暖的瞬间。终于看到了可以心满意足离场的贺岁档。（港女不仅几十年如一日的美，声音怎么也都这么好听啊。,2026-02-23 20:41:20,21
4774959290,夜王,2026,发条程程,5,感覺葵芳要火。麗英是天生的喜劇演員。楊偉倫絕了，他演正義迴廊把我噁心死，但這次又把我笑死。,2026-02-20 15:45:45,26
4773717160,夜王,2026,tata,5,我个人春节档最佳，也算是近年来最好的港片之一，好笑又好看，是真香港真喜剧。本来以为是黄子华和郑秀文的双簧戏，但是其他角色也很鲜明，行业众生相展示得很好，剧本非常不错，对白密集，喜剧表壳下还是有针对底层的人情关怀，很感人。香港人做事很灵活，不管做哪一行都是努力又奋进，这个题材在内地院线里很稀缺，院线港片一年有一个这种质量出现，我就觉得香港电影不倒，香江精神仍在。,2026-02-22 22:32:04,28
4775004167,夜王,2026,多看书少发梦,4,本电影的唯一败笔就是Mimi和欢哥的感情线，没必要把Mimi搞得这么惨，把欢哥搞得这么坏。Sammi的形象一直都很斯文，这次演夜场boss却挺自然的，好！,2026-02-20 16:41:24,42
4772406985,夜王,2026,饿霸地煮,4,好久没看这么养眼的电影了，完全被mimi的戏吸引到，好几场美得以为在看《阮玲玉》，角色细节处理上也是很丰富的一个。其实也是某种香港精神的隐喻，既有狮子山精神的拼搏、团结和坚韧。与此同时也是某种五颜六色，却又灰度十足的江湖场域，在资本主义一切向钱看下面，是一个被仁义支配的道德体系，只能看到单向度人的傲慢资本看不到谋生者真正的面孔。黄子华和郑秀文都是这种同时兼有黑白两面的魅力演员。,2026-02-23 19:56:18,12
4780485479,夜王,2026,朝阳区妻夫木聪,3,春节档喜剧元素最强的一部，主旨上还是围绕着对那个逝去的夜场江湖的追忆和怀念，以及那种在大时代面前虽无可奈何但仍要放手一搏的港人精神。如今这个年代，不谈利益张口闭口还在谈义气，就像一个奢侈的童话故事一样，确实也很像，从头到尾都闪着blingbling的霓虹灯光，绚烂夺目，五光十色，宛如一场幻梦。揉揉眼再定睛一看，如今全都熄光了。演员们演得都蛮好的，Sammi王丹妮廖子妤都各有魅力。,2026-02-25 23:12:22,12
4776989010,夜王,2026,李逵艾,4,现在豆瓣上的批评完全走偏了，这部片惊喜的反倒是完全没有“争风吃醋、撕逼”的戏码，呢度冇雌竞，只有女人帮女人。V姐和Mimi明明是情敌，互相试探完，转头就一起对付反派。还有葵芳为父亲的医药费拼，大家也会默默帮忙她。夜场是把女性物化的场所，但电影恰恰拍出了这个场所里，女人之间在艰难环境下的理解和支持，这才是真挚的女性团结的情义与力量。将男人当“可选的鞋子”那场戏，真是写得好聪明！,2026-02-22 15:45:31,371
4780463698,夜王,2026,UglyBerry,0,前半部分还蛮好看的，职场即夜场，也得培养新人、没钱得想怎么留下人、没人了还得到处找外包、被外面挖来的人破坏企业文化式的卷业绩…还是大上海的依萍说的好，我比你们高贵，我是来赚钱的…,2026-02-25 22:53:55,5
4779582305,夜王,2026,对方,5,欢场体面人群像。结尾《眉飞色舞》响起告诉你sammi已经统治欢场20年。和妈妈看贺岁档+1星,2026-02-24 23:59:17,16
4775726257,夜王,2026,王写写,2,能把夜场题材拍的这么健康和谐积极向上，也许是影史上独一份了。删除了所有老板、妈咪、客户、小姐四方之间那些不可避免的剥削、强迫和侵犯的灰色现象，把夜场文化平替成职场江湖，把小姐平替成打工牛马，把老板妈咪小姐平替成励志片里的教练运动员、探案片里的老鸟菜鸟、校园片里的老师学生。剔除掉一切特殊行业里的特殊性，于是就诞生了这么一个正能量励志商战片。所有的一切都是那么团结，那么和谐，甚至客户和小姐搂抱都用绅士手，请问这是夜场还是秀场？反而黄子华倒是能看出睡了不少手下小姐。我只感觉到从头到尾的隐隐不对劲……而且从剧作上来说，黄子华跟郑秀文的前妻线，跟廖子妤的单恋线，全都写的很拖沓平庸。结尾跟头号反派打的商战情报局高潮戏，拍的也没什么张力。总之就是很普通的港片，夜场文化零展现，灰色地带全规避。廖子妤确实美。,2026-02-26 13:19:53,18
4782187856,夜王,2026,顽皮的板儿牙,3,笑贫不笑娼,2026-02-27 23:13:54,8
4778256144,夜王,2026,庄老斜,3,除了粤韵风华，其他乏善可陈。,2026-02-23 19:34:05,18
4776285404,夜王,2026,Kaito,5,春节档里难得能来一部好港片。就像台词说的，世界艰难，我们根本就未容易过，但我们也没怕过。像黄子华说的，拍这部电影，说了三辈子的粗话、吸了十辈子的烟。拍这个特殊题材，真的需要莫大的勇气。夜场是这样的气氛，但电影却并没有把女性角色物化、工具人化，反而留足了每个人的空间。反倒调侃客人是花钱买尊严，她们成了不可或缺的情绪价值支持。期待这出《夜王》的戏，拍成剧或系列电影，大概就能彰显它想说的故事的另一面，以夜王之名的女性群像。《饭戏攻心》里的“嫁俾你老豆之前，我做夜总会㗎咋”，也可以当作列传其一，哈哈。,2026-02-22 21:51:20,37
4788918212,夜王,2026,山下猫,2,看这戏替郑秀文叫屈，她细幼双臂肌肉线条起伏能跑马，但这个角色看不出任何能力。过去夜总会片中女性是主角，如今只能为救风尘的老男人做配。廖子妤拉味十足。也浪费了王丹妮。港女发狠话掀桌到头来还是靠老相好。女人不被坑死也轮不到男的有机会拿三十万演情圣啦。现实中多的是女为男还债。峰少妹妹到底是谁啊？长男妒忌妹妹什么科幻片？本地外援大搞雌竞，那双高跟鞋想到帕姐“两个女人在争一个垃圾”。说做舞小姐“最惨信不了男人”，叹为观止！性别落后是意料之中，没想到连个爽千局都拍不好，最大危机就是对口供，也没有局中局反转。黄代表古典结构利益爹“讲感情”，郑被放在对立面讲KPI，资与父没什么新的解题思路。看到董玮想到武替道里老影人怀念黄金岁月的是能到夜总会挥金如土，没解放女人什么事，说商女不知亡国恨，一代新爹换旧爹罢了,2026-03-08 13:54:11,6
4780503365,夜王,2026,sirius_flower,4,和Anora高下立判。虽然关于夜场 但讲的还是人情与情义，恰恰是看似最重经济利益的场合里才最见情义。另一点是自尊，凭本事、讲义气，不需要“被”别人看得起。其实香港电影的内核 就是它骨子里的反现代，一个最讲求现代管理与资本运作模式的环境中生出的与之对抗的前现代的人的联结，而在此环境之下的情义并不避讳利益的博弈，V姐的出走与回归正是如此。反观Anora 毫无主体性的沉沦与挣扎,2026-02-25 23:28:01,11
4723672616,夜王,2026,五色全味,3,不太喜歡。這個電影其實行動的事件不夠，很多場戲都是幾個人物在不停對話直接拋主題和金句，但吳煒倫這種靠對白打集體情緒的粗暴方法看來依然奏效；整個戲開頭是兩個CEO的職場戲後來是陳慶嘉式愛情戲高潮是老千戲，不可否認偶有亮點，但類型變來變去就是看不到夜場這個核心元素在戲裡存在的真正必要性，反倒用夜場這種性別權力場來隱喻香港確實有不少尷尬之處，至少開頭幾個嘲弄女性外貌的橋段確實令我很不舒服。整個戲節奏也不太好，我是靠著楊偉倫搞笑才撐下來。,2026-03-02 00:35:59,11
4789893717,夜王,2026,童言,3,没想到现如今想一次性看那么多美丽明艳又有个性的女人，竟然还是得回到夜场。我也不知道该哭还是该笑。,2026-03-09 15:15:53,20
4778242325,夜王,2026,黎小黎bOnｎｉｅ在豆瓣大杂院,5,Coco从出场开始就是主动出击型，最后的决定与其说是转身，不如说是确认——她知道自己真正在乎的是什么。,2026-02-23 19:20:19,26
4780016708,夜王,2026,cicity,5,我想看富婆点鸭子版,2026-02-25 14:51:08,17
4773749172,夜王,2026,钙甜心,0,香港春晚还是去看了，黄子华不求上进也不是第一天所有电影演自己本人，然而粤语烂梗还是很好笑，前半部分非常合格的喜剧片后半部分有点节奏问题，还是值得看的，演员人均一个金像奖，现在没有更好的戏演令人难过，本片最大看点就是香港医美，人类文明皇冠上的明珠，主角几个不说了，Coco姐Mimi姐出道这么多年仍然辣成这样，这合理吗，鸡看完只想立刻去搞热玛吉超声刀打针打全套,2026-02-19 11:07:13,15
4776617431,夜王,2026,マクガフィン,4,类型化程度极高的香港赢学大作，可以说是港版《哪吒》了。完全可以理解为什么香港票房大爆，也完全可以预见会在内地遭遇怎样的炎上。风月场的励志故事，激进派骂你男凝，保守派骂你放荡。,2026-02-22 02:39:36,24
4774957225,夜王,2026,卢镒康,1,额 我看一半就评分了 单一场景 没有视听 什么都没有 为什么要拍这样的 可以拍这样的 但未免整部片子都是这样 我不知道我要看什么 是看主角还是看这样的,2026-02-20 15:42:52,47
4771980017,夜王,2026,大祭司爬山中,5,好看诶！！又搞笑又有点剧情，这样完全正正好。我天啊怀念这样恰到好处的老式娱乐片，看得很开心，我笑点不算低吧都一直在笑，那个男配的角色是那种有点丑角样式的 好怀念，以前片子里都有这样的耍宝角色，现在都没有了 每个女演员都好美，黄子华长得一张很善良的脸,2026-02-17 18:19:59,101
4788381157,夜王,2026,木子九,3,虽然，但是……在3.8妇女节组织看这个，真的好吗,2026-03-07 21:47:57,16
4771651850,夜王,2026,啊动不动就上课,5,客观来说4星吧，主观情绪我打到5星，重现当年香港贺岁片荣光的感觉。剧情一开始搞笑为主，中间有段商战稍微紧张刺激，快到结局部分又有几段煽情的文戏。子华神让廖子妤演的角色那么着迷，看颜值不理解，看人格魅力理解了，邓丽英长相和风格像小王菀之。夜场不只有灯红酒绿，也有浓浓的人情味，最后尖东夜总会的衰落转型也有点象征香港这座城市的没落与转型吧。 春节档专门北京来香港看电影，明天去看口碑也不错的《金多宝》，感觉今年香港贺岁档几部比去年的好多了。,2026-02-17 12:29:15,59
4790126424,夜王,2026,女魔头,3,节奏和笑点都把握得不错，但非要上升到什么女性群像这个层面就很尴尬了，吃点好的吧只能说。,2026-03-09 21:01:16,14
4775433107,夜王,2026,vivi,4,夜场就是戏场，黄子华去年演了《香港式离婚》，谢君豪演了《天色》，这么巧Sammi 在澳门对子华说的“先上床再暴露”策略在《天色》里如出一辙。杨伟伦和邓丽英的角色好绝，随时能进能退能屈能伸，散场之后一直在想他俩这种毫不怯场的理直气壮，就是香港人的一种精神吧；想起去年看《半边人》，王正方教许素莹演戏，那是香港电影里少有的害羞，而今天在《夜王》里又看到了许素莹。晚上回家重看《金鸡》，那时候的电影多的是现在没有的自由。,2026-02-20 23:31:59,14
4780321178,夜王,2026,桑妮,3,黄子华的浑然天成，和依旧强大的郑秀文。就是不知道这个电影出现在当下是为了什么。,2026-02-28 20:31:26,6
4776832204,夜王,2026,汽车大师,3,我曾伺候过香港市民,2026-02-22 12:27:21,9
4777145137,夜王,2026,悲辛無盡獨行夜,0,25.8，粤语版，简中改台词且字幕和谐不少更适合大陆宝宝，下海还是上岸，都是出来卖的，谁比谁高贵，粤语梗有些听不懂，一楼一凤倒听出来了，风月无边逢场作戏，夜场老板有情有义心善体恤员工美化得不像话，贺岁喜剧类型决定了主题表达上限，没落就是没落了，男的甭成天怀旧，V姐开的若是牛郎店想必会更有趣，,2026-02-22 18:34:59,7
4772094656,夜王,2026,猛汉世雄,3,娱乐性挺丰富的，确实有古早港味，但是年轻美女痴迷老男人这种事还是太让人烦躁了，哪怕那个老男人是黄子华也不行……不敢相信这个人设是“从事皮肉生意、但是唯爱前妻、又被美少女痴迷”的男主角换个老男人来演会让人多厌恶，我已经很给黄子华面子了……如果把感情戏都删了，只是没心没肺地拍热闹夜场戏，我的观影体验会更强一点……,2026-03-02 18:46:41,13
4777674427,夜王,2026,记不住密码,1,2026世界电影恐怖奇观😅,2026-02-23 03:40:37,18
4779376825,夜王,2026,蓝 田,3,廖子妤也太好看了,2026-02-24 21:23:17,14
4775728160,夜王,2026,尉迟上九,5,没有抱太大的期待去看，这样的题材，尺度把握稍有不慎很容易陷入尴尬和无聊的境地，但结果远超预期，贺岁档最佳无疑，如果春晚能编排成这样，大年三十那天我的上下眼皮还能稍微消停点。好久没看过这么正的港片了，不单单是一个个个性鲜明的角色，还有那种在港片的浸泡中长大的一代人熟悉的味道，更重要的是那份永远不会消逝的港式情义。就像马家辉在采访中说的能看到励志，一种贯穿于港片核心价值观的小强精神，对于底层角色反扑的刻画和描写依旧出彩。片中的女性角色都很有魅力，从小看黄子华影视剧长大的我看完不得不感叹姜还是老的辣。方言的感染力真是难以言喻，够劲啊！,2026-02-22 17:40:38,26
4778466178,夜王,2026,江湖米贩子,4,最紧张的是骗峰少那一段，不过讲夜场职场剧也好看,2026-02-23 22:23:54,23
4775014267,夜王,2026,ZeonGin Sou,5,如此题材，两广限定，绝对奇迹。表写欢场，实质江湖。夜总会皮囊，馅开是谍战。黄子华搭杨伟伦化学反应爆棚，金句不绝，欢乐无限。无数挣扎，都不过是底层人揾两餐。对白中映射对旧香港的怀念，一如夜总会这一意象，正迎接太子峰“后浪”改朝换代的冲击。PS：子妤线的遗憾，恰好呼应了，那个离开的女人，才会让你记得一辈子，何况她还留了一地的耳环。果然，悲剧才会隽永。,2026-02-20 16:53:09,23
4788055712,夜王,2026,李松石Linden,4,说是夜场，又不只是夜场。说到底是在怀念一种人情味。你见过它好的时候，说要放下又怎么能放得下，似乎也是在说香港。黄子华是老好人专业户，郑秀文也是天生的搞事业face。,2026-03-07 15:37:17,11
4778396675,夜王,2026,小溪,4,Mimi真是我心中花魁的样子！夜总会和百晓生适配度满分。,2026-02-23 21:32:29,25
4780873587,夜王,2026,劉咳暝,4,沒想到在鬧哄哄的賀歲片里看到近年香港電影最真摯的一些感情。你們香港人就是這樣，非得在生意里才談得出真情。這是病。,2026-02-26 13:38:45,9
4780637564,夜王,2026,Kotori,5,这不比惊蛰无声好看多了？ 反转一点都不尴尬,2026-02-26 02:37:12,14
4783712680,夜王,2026,2sin,4,默默被那个脸很臭但酒量很好 分分钟把客人喝倒的美丽的姐迷倒,2026-03-01 19:45:42,18
4774917378,夜王,2026,Ysan__,3,一般，还是老一套自顾自怜的香港衰落叙事,2026-02-20 14:48:02,37
4779679208,夜王,2026,二本妹,4,用经济上行拍经济下行,2026-02-25 19:54:10,14
4779151259,夜王,2026,薄荷清柚,3,用欢场的皮套的还是底层小人物反抗大鳄的励志奋斗，佐以夜总会怀旧文化，再加上黄子华招牌的幽默感。只可惜大厦将倾，硬拗不出来纸醉金迷，外面街道冷清，里面灯光黯淡，对比往昔更觉寒酸；年纪大了，看黄偏门讲励志重感情只觉荒谬。根本毫无高潮，最后一场设局，观众等待结果爽一把，居然没拍出来？结果就是boss被骂一顿坐车走了？？在这种不该现实的地方现实，吴导似乎一直有一种“蝼蚁撼大象的勇气但我又知道我们都是蝼蚁”，不知悲喜。看完本片最大的感受是，一直怀念从前只会让人更加感受到不如从前，HK电影早就应该往前看了。,2026-02-24 17:20:39,5
4788621132,夜王,2026,安石榴阿措,5,PP3。前半部全场爆笑没停过，但郑秀文说“全身只得三十七万，还想跟我做命运共同体”时，唯一因政治黑话发出响亮狂笑的就是可悲的内地人。黄生前夫妇（净负债六千万）站在尖东海边，隔着维港望住对面北角巨型公屋群互相勉励“那么多人比我们还惨，都还不放弃坚持活着”太缺德了😂。演员都好好,2026-03-08 01:23:15,10
4778969739,夜王,2026,DX,2,以主創的視點來看，曾經尖東是經濟繁榮、娛樂鼎盛的核心空間，是承載著無上榮光的地標。但夜總會明顯同時是一個高度陽剛的權力劇場，黃子華口中的「買尊嚴」實質是權力透過金錢與身體互相交換，背後是一代香港男人對於男性支配的社交空間的懷念。對於女性處境的忽視是近年文化界吹起「尖東集體回憶」風潮的其中一個原因，另外一個重要原因不言自明，關於公民社會的記憶會直接觸及紅線，而尖東作為消費主義符號成為情緒宣洩的安全出口。揭露聲色犬馬的陰暗並非要否定英屬香港的一切，祇是我不認為這種近乎歌頌的姿態是打開這個空間的正確方式。或許色情經濟的式微反而是香港變得更文明的明證，而這個過程適逢苛政闖入，但時間交叉不代表存在因果關係。KOL們如悼明般哀嘆的風光不再可能隨著那種粗曠的商業模式北上神州而轉移到東莞就已經提前宣告死亡。,2026-02-24 13:46:34,31
4649754371,夜王,2026,壹安²,4,好对味，天台上的“无间道”，夜场里的“大龙凤”，有群像，有真情，有江湖。真的好爱如此这般的港片，华神Sammi能不能每年都摆一出！,2026-02-23 23:08:02,11
4777672668,夜王,2026,陆小鸟,4,真正的春节档。在打打杀杀片里没看到江湖，这里处处江湖情；在谍战片中没看到计谋，这里上演了一出好戏；在全男电影里看不见人物，这里呈现了十几位鲜活的角色。 主题似乎没有变：你看对面万家灯火，总有比我们难的人，总有被迫留下的人，我们得为他们守着这里。 但故事写得好精彩啊，无论是“美股”的计，还是耳环的底，既有新意又有诚意。 （终于全国上映，全城唯一零点场，正好10个观众，不多，但还是有一些默契的笑声。不过，你们遇到过上一场23:59分半才放完的零点场吗？😳,2026-02-23 03:32:48,15
4787642512,夜王,2026,紅豬手黃藤酒,3,通篇都不是我喜欢的调调，黄子华皮囊真的呕，皮都松了还要立被郑秀文和廖子妤两个大美人爱的人设是不是太自恋了。如果男主换成台湾华灯初上里的凤小岳吴慷仁我都不会想吐。尤其得知现实中的太子峰是廖子妤的男友我……大美女咱吃点儿好的行吗？？？王丹妮好美。,2026-03-06 23:45:19,23
4782558597,夜王,2026,Tilda Li,3,期待过高反而觉得执行得有点粗糙，主要是剧情有点过于连续剧，线索混乱，莫名其妙凑到最终大结局。但是有点在于噱头足，对女性群像刻画得比较进步，表演也在线，新港片质感。,2026-02-28 13:42:40,7
4791943501,夜王,2026,羊男,5,拍给成年人的夜场童话，说是还原一个时代，实则与真实大相径庭，但是，我们需要这样的童话故事。整体感觉就是我们熟悉、深爱、惦记的那种香港味。,2026-03-12 11:11:36,14
4786522888,夜王,2026,空山,2,好冗长啊，冲散激情、唏嘘和一切东西,2026-03-05 15:09:29,6
4791378910,夜王,2026,朗姐🌈,3,贺岁片，去影院刷的。黄子华还是做栋笃企吧，他的电影，他的香港隐（明）喻，也就止步于此了。,2026-03-11 16:02:53,6
4800088540,夜王,2026,Fiona,5,我看评论说这部剧有女性凝视，但我个人完全没有这种感受，反而从中看到了许多女性身上的闪光点。V姐的坚强果断、mimi的深情、东日coco姐的飒爽、葵芳的坚韧，都让我感受到女性真实而耀眼的魅力。不能仅仅因为角色的职业，就简单贴上女性凝视的标签。我认为这部剧三观很正，反观现在一些主打女权的作品，反而显得很幼稚，只停留在喊口号，并没有真正塑造出立体、闪光的女性形象。《夜王》里的女性角色，才真正让我看到了她们的力量与光芒。,2026-03-22 14:23:09,25
4795046999,夜王,2026,羊肉小花卷,1,都2026年了，中国女性以为追求权利平等的路越走越宽的时候，香港电影圈又给了我们一记响亮的耳光。别的不说，就说在一个严令禁止性交易的社会主义国家，竟然允许这种歌颂龟公和老鸨的电影上映，太荒唐了真的。把女性彻底物化，把女性的身体彻底商品化，这居然是2026年的贺岁档？,2026-03-16 02:54:58,6
