评论ID,电影名称,上映年份,用户昵称,用户评分,评论内容,评论时间,点赞数
4765847428,夜王,2026,发条辰,4,【-】喜庆的贺岁片，整体回归到了80年代通俗电影巅峰时期。所有博德维尔形容的招徕式电影的碎片化情节在当代被重新诠释（情节的存在只是借口，目的不外乎展览连串吸引人的壮观场面），段子笑点如雨点般袭来但多数完全不尴尬。对时代、义气等主题的展示也完全回归上世纪的拍法，复古感拉满。最后一场戏的调度尽显掌控吧，能把夜总会题材拍成如此有趣且不剥削性别已经尽力了📽️,2026-02-18 11:03:10,160
4778206473,夜王,2026,蔡小马,4,男人只是鞋子，不合适就不要；你是缪斯太子爷，我也是东日coco姐，你瞧不上我，我也不需要你瞧得上；郑秀文一双高跟走出了无数女星一辈子都在营销的飒感，女性群像立体又讨喜，满屏是美女但没有男凝，虽然讲的是灰产，但内核仍然是人情味和共渡难关的市井气。另外港星真的是很扛老啊，65岁的黄子华和53岁的郑秀文谁看得出来？,2026-02-23 18:44:06,53
4775110803,夜王,2026,包居壮,1,真的不喜欢这种擦边题材！！！甚至反感恶俗厌恶恶心 把粗口当玩笑，真的好笑吗？只觉得很low！ 浪费了郑秀文这次宝贵的表演！,2026-02-20 18:44:57,269
4778417160,夜王,2026,林山王1号,4,《夜王》属于复刻港片黄金时代的上乘之作，还是熟悉的又市井，又好笑，又直白，又深刻的现实质感。表面是风月场所那点事，内核却是情与义的江湖，以及笑中带泪的生活真相。我理解不了某些差评中提到此片贬低女性的言论，明明是最真实、最有诚意的女性群像故事，哪怕面对的是一些灰色地带的女性，但镜头语言没有轻视，没有嘲笑，没有可怜，只是真实地记录她们的故事，抛开妖魔化的职业表相，看见一个又一个真实努力的人生，也许不够正能量，但谁又能否认这样极端环境下最坚韧的港女精神呢？最难得的是明明是灰色地带小人物的惨淡人生，但影片整体风格是非常轻松幽默的，这才是港片独有的气质，不需要贩卖苦难，也不需要任何伪饰，摸到怎样的牌都是自己的牌，好好打就是！一群小人物的故事，每一个梗，每一个笑点都是无法伪装的赤裸人性。,2026-02-23 21:47:51,38
4778284137,夜王,2026,光明王后,5,俗题材拍出了大格局！没有居高临下，只有对小人物拼搏求存的致敬，这部逆袭爽片我给满分,2026-02-23 19:59:58,76
4783661159,夜王,2026,momo,3,Mimi和Coco实在貌美，但这种题材也实在过时,2026-03-01 18:47:25,43
4783656598,夜王,2026,九苍,2,在九十年代的港片里一个八十分钟能讲完的事儿墨墨叽叽熬了130分钟，节奏拉跨的昏昏欲睡。夜场男女复仇大快人心就够了，非得每十分钟就以泪洗面反复重复我行我行我就是行，筋疲力尽的无奈感贯穿通篇。黄子华的表演真是戏剧性表达的反面教材，每一个转折点的回味都被他提前三十秒清清楚楚写在脸上，这就是如今港式表演的巅峰了。,2026-03-01 18:42:19,19
4776889146,夜王,2026,双,3,“有些人有些地方你见过最靓的时候，就算今时不同往日，也不是说放下就能放下”，久久忘不了，这句话既是在讲黄子华和郑秀文，也是在讲这片土地,2026-02-22 13:42:56,32
4780747556,夜王,2026,Tom Light,3,《夜王》别太会编了，合着是拍了个夜场版世外桃源是吧？都2012年用上iPhone5了，移动互联网都要起跑了，剧情还跟现实夜场隔着一条银河，纯纯自我感动式的理想主义，跟现实半毛钱关系都没有。 也是，也就没怎么混过商K、没见识过逢场作戏的人，才会信剧里那套纯爱至上、江湖义气的戏码。毕竟真天天泡在里面的人，早把爱人与被爱的能力，当成开酒的赠品随手送出去了，哪还剩得下啊。 要我说，同题材里，《金鸡》是把里里外外都扒给你看的写实巅峰，就算是口碑稀烂的《喜爱夜蒲》，人家烂也烂得真诚，起码不睁眼说瞎话，是什么样就拍什么样。 唯独《夜王》，端着架子拍讨好向剧情，还搁那输出所谓的金句呢——“客人不是花钱玩女人，是花钱买在公司、在家里得不到的尊严”，哟，可太会往脸上贴金了，这鬼话编得，我差点都要信了。,2026-02-26 10:17:35,29
4775871002,夜王,2026,Ö,2,想看鸭子版本的，一个老富婆掏出照片对可以做儿子年纪的小鸭子说：你长得好像他。v姐和欢哥已经到了半截身子入土的年纪，感情观还是这么不成熟，建议两口子都咨询一下chatgpt直面感情中的问题。博人一笑的电影，也就仅仅留在博人无聊一笑。,2026-02-21 14:22:35,89
4778275962,夜王,2026,眠去,4,自千禧年至今，Sammi果然还是香港最时髦女人，和黄子华演前夫前妻意外很搭，“有些人有些地方，见过Ta最好的时候、一起开心过，就算今时不同往日，也不是说放下就放下”——这也是今日对香港电影旧欢如梦最好的注解吧。,2026-02-23 19:52:38,20
4778514532,夜王,2026,吴雨,2,一开始以为是无厘头喜剧，结果突然搞起了事业，以为终于要好好搞事业了，突然就变成了出老千骗人入局。每次看到黄子华跟各种女单独在天台在K房在江边在房间在天桥，我就想快进……电影可以深沉，但不能故作深沉。,2026-02-23 22:59:09,53
4775270886,夜王,2026,梁州,5,看完《夜王》，控制不住地想起潘绥铭说的那句话——许多风俗行业的女性，其目的从来不止于“赚钱”，更多的是一种在缝隙里求生的意志。这一点《夜王》做得很好，角色有自己完整的行事逻辑。她们首先是人，其次才是她们所从事的职业。进入这个行业的，是在底层挣扎着的一个个具体的人，有来路，有去处，有放不下的事，也有不肯弯的腰。越是烟花地，越见薄情与真义。,2026-02-20 21:26:34,43
4776824792,夜王,2026,冰红深蓝,4,春节档尾声的一剂生猛港片，也是今年第一部港片佳作。导演不愧曾拍出过《毒舌律师》，与《我谈的那场恋爱》编导何妙祺搭档，聪明地用夜场的新奇外壳，融入小人物生存艰困、抱团取暖的议题。乍看以为是“下海”猎奇，实则是一群失意者凭借智慧与情义对傲慢资本发起的一场漂亮反击。黄子华与郑秀文这对“对抗路”前夫前妻，真是火花四溅，高手过招的张力比常规的爱情戏更拉扯。黄子华也再次证明，他这几年已成为高品质的代名词，把一个小人物的世故、硬颈与温情演得入木三分。前半段密集的粤语梗非常好笑，后半段众人联手做局、绝地翻盘，又有击中人心的热血与爽感。世界艰难，但我们没怕过；自己的尊严，要靠自己夺回。看完后不由得感慨，香港电影的那种精气神又一次限定回归了。,2026-02-22 12:17:05,146
4779599528,夜王,2026,张小北,4,因为我看的是普通话配音版，所以我在 3 星半和 4 星之间犹豫了一下。而且内地版起码前半部分有较为明显的删减痕迹，也能理解。不过整体还是很好看的，尤其是后半段有《骗中骗》的爽片感觉。前半段讲香港夜总会的部分，对于内地年轻观众来说，即老套又陌生，因为那个年代离我们感觉太遥远了。等粤语完整版上线后再看一次吧，肯定有很多支线情节被剪掉了。本片在北京排场很少，很多影院一天只拍一两场，时间也都很晚，估计北方观众对这个题材的兴趣确实不大。如果内地影院有分级制，本片应该是「16 禁」级别的，确实不适合青少年观众观看。,2026-02-25 00:14:49,14
4778994474,夜王,2026,二 天,2,今年真的是2026年吗？？？mimi 和欢哥告别那场戏看到他找到耳环时我真要吐了。,2026-02-24 14:15:58,52
4764422486,夜王,2026,我来我征服,5,如果你对香港有情，你从中看到的就是辉煌不再后的挣扎求存，对舞照跳酒照喝、世界能慢一点变化的卑微企望。如果你对香港无情，你只会问：为什么拍这个行业，女性是不是被客体化了被物化了？人物关系是不是太陈旧了？事实只是：见过美轮美奂的宫殿群落，是不可能对废墟无动于衷的。而这种“不甘心”和“硬顶上”，又何止是香港人的宿命？20260223光耀华纳影城北京大红门店,2026-02-24 08:09:11,50
4788547787,夜王,2026,Dr.Jones,5,开场以为情色片，看到一半以为商战片，最后原来是爱情片。五星给coco、mimi 和其它这么多女孩子,2026-03-08 00:04:32,46
4778371918,夜王,2026,Virgil,3,【先声明：给三星在我这也是不及格，不推荐观看】没有拍得特别凝，但也不好看。而且恰恰是因为本质职场+商战片+没有很凝视所以完全脱离现实（夜场当然是最恶臭最凝最物化女性的地方。不想走这个路子不如换个职场。）没有辩护本片的意思，但其它短评说像王晶电影的人眼睛不要可以捐了。最基本的辨别力都没有何必出来丢人？本片整体就是一集大TVB剧集剧场版，融了很多非常俗套的梗还执行得很一般（高潮戏居然是《骗中骗》rip-off玩儿我呢……）不要抱太大期待入场。过港回深选这部打卡屯门街坊影院 @ 巴黎伦敦纽约米兰戏院,2026-02-23 21:16:57,40
4778959056,夜王,2026,西楼尘,0,放掉六合彩，念错塔罗牌。在这情爱广场试过许多双高跟鞋，也在那狭小房间留下过很多只耳环。女人说多恨一个男人的时候是做给自己看的，男人心冷的时刻还会帮她用钞票把碎玻璃拨开。最惨的不是不相信男人，是不信幸福会走向自己。迷醉在灯红酒绿的尖东，怀念在维港向大海许下的朴素愿望，竟然再难实现。,2026-02-24 13:33:07,30
4780433295,夜王,2026,顿河,5,拍出了经济下行时代上行的美。顺风时，驶得大船；逆风时，划得小舢板。客人来之前，自己先饮两个钟。陪你饮杯，陪你欢乐。重要是，不得停，日行千里和日积跬步都是往前行。拍电影的这帮人和电影里的故事，不都是一个意思：听Sammi戏里吵架都有些气喘吁吁，听到片尾眉飞色舞又活了，就是这个一口气提着，才是港片，才是香港。,2026-02-25 22:29:16,24
4789074858,夜王,2026,朱熠,3,前半部的夜场节奏非常好，到处都是令人捧腹的笑点，后半部的商战就太儿戏了，郑秀文的角色甚至在这场儿戏里变得毫无存在感，而黄子华就如同绝大多数港片港剧一样一直在输出直白的说教。夜王真正令人怀缅的还是那些老江湖中的义气，但也如同港片的时代已经走进了夕阳只余一地尘埃。,2026-03-08 17:02:01,29
4776359600,夜王,2026,一条大肥兔,1,以前女人做🐓就只用做🐓，现在女人不仅要做🐓，还要做清醒独立不花男人钱的大女主🐓，被男人吃干抹净还要提供“你是尊重女性的新时代男人”的情绪价值，有没有一种可能，🐓这种职业就不应该存在？,2026-02-21 22:27:28,206
4774856692,夜王,2026,文,1,想着挺喜欢黄子华所以来看的，原来是娱乐会所宣传片。谁来出个性转版让我享受一下呢,2026-02-21 17:00:52,152
4776894978,夜王,2026,鸿禧,3,是垂垂老矣尽显疲态的香港电影（乃至香港）的缩影。大尺度只是噱头，所有笑点在预告里已经放玩了，很努力想出金句，但也只看到努力了，港片曾有的灵气已无。操着普通话、把老将冲击得七零八落的外援，人物对话时不时冒出隔壁包厢的普通话歌，片尾的眉飞色舞——看到大潮退去后落寞的香港，曾经的辉煌已成化石，吃力地求新求变。唉,2026-02-26 14:08:07,39
4755555173,夜王,2026,天使遗骸,3,卢镇业真是影抛脸，太子峰这个自卑自负又阴狠的角色演得太好，看完都没认出来是《年少日记》的弟弟。 郑秀文的角色好扁平，含女量高但女强男更强，好一个大男主片子，全体托举精神守节的深情男。看mimi丢床底的耳环数量可想而知俩人是固炮，如果男女主都还惦记对方，那为什么女主没有这种精神守节的情节，皮松老登到底能力是多强能让女人们争抢啊😓（不针对演员，65岁的黄子华能健身成这样，演夜场老板已经算不错了，对比内娱老登来说，毕竟们内娱可是油肥老登都能演赛车手呀👌）,2026-02-27 12:20:28,31
4775291395,夜王,2026,昵称输入中……,1,想玩深沉又玩不明白，为赋新词强说愁,2026-02-20 21:43:07,141
4777567016,夜王,2026,韩松落,5,我觉得《夜王》最可贵之处在于它提供了一个非清教徒式的叙事。它很聪明，洞察了夜场的实质：提供人际关系幻境的场所，所谓声色犬马华灯初上，不过是一个职业场景，夜场的从业者负责提供的产品，是千变万化、量身订做的人际关系幻境！它是利字当头的营生，却是人情的营生，要对人情怀有宗教般的虔诚，试图以真心换真心：欢哥、V姐撑起的，是时代巨轮下的一个欲望百景小宇宙。 它还展现了中国古老世情文小说的特有能力，那就是处理复杂的故事、复杂的观念，拒绝单纯的高概念设定和高概念叙事，多线索进行，但却都有始有终，多种观念并行，但又能互相兼容。这是理性过度发达的时代的文艺已经丧失的能力。 欢场故事只是它的外壳，在人类科技越过奇点的此刻看来，是一次决绝的回眸。,2026-02-23 23:28:38,20
4780240515,夜王,2026,Ove?,5,谁说香港做不出好电影，即使没有那么多投资和浮夸，一样能讲好故事，反而是某些内地的国师名导，拿着那么多钱、占着那么好的坑位，拍出一部又一部烂片。,2026-02-25 19:26:32,62
4777842766,夜王,2026,mumudancing,5,剧本厉害！《饭戏攻心》《毒舌大状》两班人马，加多一个郑秀文就这么默契劲爆有新意。上一部讲揾食艰难这么好的还是《金鸡》。黄子华又衰又mean又大佬，活该经济下行期就是你天下。吴炜伦很惊喜，廖子妤一定会再拿奖。郑秀文坐在那就能让我哭。这是什么感人鬼马喜剧，都去看！票房快爆！,2026-02-23 11:58:49,42
4766515338,夜王,2026,暨暨,5,春节档而言两广应该还是更吃这种喜剧，各种粤语梗给人一种很亲切的感觉，而且是粤语区独有的特色，感觉看这一场相当于看春晚了，又热闹又好笑，还带点励志哈哈,2026-02-17 10:04:35,151
4784687551,夜王,2026,回头,5,看到一堆被女权洗脑过度的人打差评，真是一群神经病啊！,2026-03-02 22:31:36,44
4775246592,夜王,2026,哎哟我去,1,完全被骗进去杀 2026了还在玩韦小宝/如花的恶俗叙事，所有女性塑造都围绕一根吊服务，非常失望,2026-02-20 21:05:20,135
4775807970,夜王,2026,品客,4,今时今日咁嘅服务态度系唔够嘅！当年华仔在金鸡里的这句台词，在24年后又被子华神call back了一遍，两广地区之外的观众大概就可以get到这部电影讲的并不是单纯的声色犬马，灯红酒绿（当然，因为粤语的关系，确实尺度可以肆无忌惮一些😏），而是看似光鲜实则市井的生命在变革时代下的悲欢离合。题材看似浅显，实则立意深刻的喜剧风格，作为两广文化圈的一份子，主观、客观自然都是非常喜欢的。 其中我最喜欢的是廖子妤同子华神和谢君豪之间的那段戏，尤其是最后丢耳环的设计，你以为的夜场人情感肤浅，却反转出一把感情刀。 虽然一开始在内地是两广限定，但是初七要在全国大规模上了，有粤语场的话应看尽量看！,2026-02-21 12:58:26,133
4785153552,夜王,2026,道可道 非常道,3,資本的起家和維持唔需要被美化，全片仲有教人怎麼做小姐的劇情… 講到最後好似HE其實仍是從人身上吸血，唔知道想講咩啊，一群女仔打工人同老闆講義氣賣自己,2026-03-03 15:57:27,31
4762938621,夜王,2026,西部大镖客,1,这种题材怎么拍都不讨喜，扑硬！,2026-02-21 12:19:00,46
4778132778,夜王,2026,Morning,2,像那种无聊的TVB烂剧，堆砌了很多陈旧的桥段，为一些角色找到普世的行为逻辑，随便上点价值，缺乏反思。剧本做了一个轻巧的架空骗局，明明有更现实的转型线不敢去触碰，只在结尾潦草表现。欢哥角色最丰富但并不丰满，包括非常俗滥的对前妻念念不忘，空着的一个旧房间，以及别人嘴中摆平了V姐的危机。V姐是行动的空壳，许多动机或者和主线有关的原因都写得很差。其余角色就更不用说了，没有目标和欲望，只有人设，然后等着剧情给他们安排一个“结果”。廖子妤的mimi看见欢哥推门而入，那一句“欢哥”，演得太好了，堪成封后的表演。行业本身的性质在本片不必追究了，看得出来很用力的去避了，不过这里口口声声说的尊严是特指男性尊严，它是典型的男人为失败找不认输的理由和念想一段旧情找尊严的故事，欢哥是正面，太子峰是反面（卢振业演得很好,2026-02-23 17:30:33,39
4776037275,夜王,2026,圈圈儿,4,今夕是何年！前半段笑点密得像香港餐厅的翻台率一样。不管郑秀文和黄子华把头发烫到多么卷，都还是有老友的亲切感。很喜欢编剧之一何妙祺的前作，所以不会那——么担心欢场题材下的女角色塑造。在这个拜财神多过求桃花的时代，《夜王》有真实的情感，没有黏糊的情爱，每个人知道自己的站位，有种”笑一下算了”的清醒感。就像欢哥又重复多一次的港片箴言，开心最紧要。,2026-02-21 17:39:38,123
4772660207,夜王,2026,max 1,4,好喜欢coco姐和mimi姐啊,2026-03-08 20:56:40,39
4774815439,夜王,2026,柴斯卡,5,前妻变上司，这设定简直是港味喜剧的究极老配方，却被黄子华玩出了新火花。妥妥的两广人春节专属狂欢场，old fashion的小人物叙事里，笑点密不透风，爆点精准炸场。子华神的中年危机演得太扎心，笑完鼻尖一酸。近五年最爽港产喜剧，郑秀文美得发光✨,2026-02-20 12:24:02,183
4775812081,夜王,2026,Kimberly.,5,有日子没有HK贺岁片在内地上映了 有种经济下行的美 不是牛马就是鸡鸭 都不容易,2026-02-25 14:24:16,36
4776927638,夜王,2026,圆首的秘书,4,一部非常用心的作品，导演表演美术各个方面在整个春节档里都称得上鹤立鸡群。创作者先给观众设下了很多纸醉金迷、甚至故意冒犯的迷局（真的是凝视吗？真的是雌竞吗？真的是男性拯救吗？），但整个过程中创作者都在协助观众拨开这些迷局。陪酒女的尊严不在于放弃这份赖以为生的职业将身体包裹起来，那是一种更不切实际的“体面”；真正的尊严，在于如何在极其有限的生存空间里尽力地里辗转腾挪，以微薄之力对抗极度功利的香港上层，在于不再依附任何人而走上自己的人生道路。难得的是影片跳出近些年香港电影严肃的形式框架，转而为它披上一件或许更易被主流和档期接受的喜剧的外衣。当然电影并不完美，但如果被极端二元简化的“主义”话语埋没，其实是观众自己的损失。,2026-02-22 14:30:44,40
4775180005,夜王,2026,豆瓣路人己,0,在咸湿的港味里破出了新路。,2026-02-20 20:00:36,13
4780267009,夜王,2026,yuki,4,这个春节档最好的电影终于出现了！以及，这部电影有种“香港”本身的寓意，曾经辉煌曾经嚣张，现在大家都知道游戏规则变了、风光不再了，但还是有人明知道没有回天之力依然想抓住自己认为对的东西。,2026-02-25 19:55:35,25
4724388479,夜王,2026,菲茨卡拉多,4,我太爱了 又可以续命了/夜场局中局，有些场面的调度排得很不错啊。子华，时机对了，你也终于出现在贺岁档娱乐大家。真好。我爱Sammi的手臂线条红色纹身粉金发色，好美。Louise的下庭真的好像姐姐，忍不住盯着看。爱江老板，海外发行太牛。 今日初一，未买到黑森林，食旧黑芝麻千层頂住先。飛行靠逆風，點知呢個世界已經去到逆風都需要等。无论點樣，開心真係好撚重要啊。 我等第二部！,2026-02-18 03:03:39,124
4762930668,夜王,2026,酱桑,4,【7】真正的春节档成人电影。语言与地域文化的魅力太动人。几分钟一爆梗，整个电影院观众都笑翻，这是粤语梗与地域文化融合，火力全开的结果。近几年很多香港电影在讲“新”，在讲“破”，但实然不如本片真诚。拍“夜场”也拍“战场”，实然是在讲那些老旧式背后香港人们的如今“活着”“挣扎”以及情义何在。该怎么形容呢？就在于：本片把一个复杂，刻板又充满猎奇的行业故事，通过语言，地域，自洽，且不会令人不舒服进行探讨，本身就论证了剧本，笑料的用心价值。Sammi在电影里抽烟，摇晃，舞动，碰杯，真的美炸了。,2026-02-20 15:39:36,212
4777965200,夜王,2026,亚比煞,5,多年没看过这么浓郁正宗的港味电影了。正宗的港味在我心里，永远是属于小人物的倔强，坚持，钻营与人情，在这繁华的弹丸之地，充满无限生机，也有无限杀机，不够胆的来了这座城市就无异于是送人头。所以港仔港女身上永远有最迷人的泼辣与顽强，无论如何都会活下去，会活的好，每当失去力气，想要放弃，只要看看香港那蜂巢般的万家灯火，就会感到震撼。“我们是底层，我们从来没容易过。比我们惨的人多的是，他们都撑得住，我和你在一起，怕什么。”,2026-02-23 14:33:17,27
4778087686,夜王,2026,开开心心,1,难看，让你拍九十年代风格，不是九十年代价值观。疯抢60后老头……🙄,2026-02-23 16:45:24,66
4781484766,夜王,2026,塔塔君Minkun,2,要是杜琪峰来拍就好了，但也大可不必。,2026-02-27 01:39:02,6
4793403186,夜王,2026,LEのn个晴天,4,这世上真的会有这种在背后默默花大价钱帮你摆平麻烦，为你扫干净玻璃碎渣，还把自己房子也抵押掉为你还钱的痴情男吗，我是一点也不信的，至少在我周围的世界里从没见过。电影是很好看，场子里是笑声不断，竟然还会有一段碟中谍也是没想到。廖子妤是真的美，很喜欢她在远处敬了欢哥后又对着玻璃里自己的倒影也敬了一杯的那一幕。但是咱丢的耳环未免也是太多了哈，试个几次都不行就算了吧，耳环也是要钱的。,2026-03-14 10:49:51,24
4783437361,夜王,2026,熊猫毛,5,肯定是不值得五星的啦，故事断裂感比较强，一截一截的，感觉可以拍个剧。但肯定要给五星啦！它就是这么一部坦诚的娱乐电影，不说教，不上价值，把群像戏都写活了，有亮点有看点有视点，还有久违的郑秀文，多好。电影这东西本来就没啥价值，也就别乱上价值了。,2026-03-01 14:14:29,19
4778548889,夜王,2026,阿德,4,纯正港味，夜场江湖。,2026-02-23 23:23:44,10
4771426372,夜王,2026,不加糖,5,拍的很搞笑很爽，很适合过年看～ 特地来看子华神，不错不错，很满意！,2026-02-17 00:18:00,96
4772474216,夜王,2026,蘇州街邊蘇州河,1,通过招魂低人权夕阳产业为不满香港的现状叫屈，只能暴露出创作者极度保守且陈旧的思想。相较于利用低人权优势打造的东方好莱坞的黄金时代港片中充斥的那些直给的凝视和剥削的镜头语言，本片一定程度上进行了收敛，但它依然无法逃避通过美化女性的苦难来维护父权的旧有建制的内核，影片的多次找补只为迎合性别观念依然落后的港人和港片观众。还不反思，港片已死！,2026-02-25 00:50:22,30
4783530610,夜王,2026,Vinda,3,評論說拍出了女性主體性的有種阿Q的美。,2026-03-01 16:13:01,28
4769351813,夜王,2026,eczod,4,笑点很密集，一定要选粤语版☺️,2026-02-17 00:32:35,81
4773308283,夜王,2026,老板娘,3,笑料段子乏味且空有热血，夜总会的场域没有和毒舌大状的行业剧一样深挖，没来由给黄子华安排的三角恋情蛮硬的，但片头刻画尖东夜总会小姐上班如上坟的状态比较有趣，有些原汁原味的段子比如“鸡硬心软”不知道内地如何翻译（和谐）。,2026-02-18 21:43:25,39
4779201448,夜王,2026,houty2018,2,现在也是越来越不懂豆瓣的评分了,2026-02-24 18:21:08,63
