评论ID,电影名称,上映年份,用户昵称,用户评分,评论内容,评论时间,点赞数
4775201609,夜王,2026,萨蘑椰椰,4,你是缪斯太子爷，我也是东日coco姐,2026-02-20 20:21:49,4456
4774809380,夜王,2026,雷宝珠,4,对女性的刻画明明很好啊？没有争风吃醋没有抢夺男性资源，而是把男人当“可选择的鞋子”，最后一起联合起来，一起反击资本，且义气这个词不限于男性的！V姐，一个能因为算命就跟男人果断分开的女性，你说她缺少主体性？不懂,2026-02-20 12:14:20,4308
4776770319,夜王,2026,哭给世界看,4,说冒犯女性我是不认的，片子最神秘的角色当属太子峰妹妹。太子峰一直被嘲比不上自己妹妹，他老爸对妹妹永远都是满分欣赏，其他女性角色，从郑秀文的V姐，到葵芳、结衣、coco、mimi，哪个不是魅力拉满。这样的片子还被盖冒犯女性的标签，有点过了,2026-02-22 11:03:09,1846
4762855596,夜王,2026,风夜|日壳子,4,明明两公婆可以在澳门当赌神 偏要抵押房子搞事业绝地翻身 本质还是个励志片来着,2026-02-17 08:25:40,1576
4775780282,夜王,2026,tangkk,5,已经预见到很多拳师下意识里会政治正确地给电影贴上“不尊重女性”“男性凝视”的标签。在我看来这部电影恰恰是对于做夜场这种“被人看不起”的“弱势群体”（这两个也是我推测很多人会有的标签）女性的最大的尊重。你在说影片不尊重女性的时候，你有没有想过你是怎么看夜场里面女性的呢？,2026-02-21 12:19:14,5331
4769683093,夜王,2026,Enkaka,4,还得是香港导演啊，这种咸湿题材也能拍出很有深度的一面，看似喧闹的夜场故事，讲的却是最朴素最真诚的人与人之间的情感。,2026-02-17 11:45:57,1595
4778337239,夜王,2026,琦殿,4,傻孩子 没有任何一个男人（直）会注意到你只戴了一只耳环,2026-02-23 20:45:43,1074
4773533729,夜王,2026,fly,3,感觉回到了王晶电影的年代，充满着男性凝视的镜头和对女性容貌的羞辱，都已经2602年了依然在用黄色笑话和容貌嘲讽来作为笑料，让英雄救美来成为女性的归宿，让人不免觉得low了点。片中的廖子妤是真的美，郑秀文也真的飒，可惜了。,2026-02-19 00:41:05,2175
4774356900,夜王,2026,груша,0,谁能有我惨，在新加坡买票进去结果是国语,2026-02-19 22:16:51,651
4775510844,夜王,2026,落鳥,4,新年的新slogan是“我使閪你睇得起？”,2026-02-21 00:41:13,942
4740929125,夜王,2026,ELeslie,0,「有哋人有哋地方，你見過佢最靚嘅時候，就算今時不同往日，都唔系話放低，就可以放低嘅」 在混亂劇情中瞥見的一絲真心，香港香港,2026-02-17 09:07:21,630
4763247965,夜王,2026,ceci,4,情人节看了优先场。本来香港的贺岁片就应该以热热闹闹著称，也不搞什么合家欢都能看那一套，爆粗暴露暴暴富就为让观众笑。开心就完事，价值那一套大过年的就免了，要不就去看看春晚。,2026-02-17 08:01:09,1103
4772004891,夜王,2026,kinder23,3,并没有很好笑，丽英的角色太尴尬了……说情怀、说逝去，这种以特殊行业缅怀过去的故事，《金鸡》早已说得很好，难以超越了。这样一来，没有对比就没有伤害。,2026-02-17 18:45:12,467
4778322503,夜王,2026,老郑卖茶🌈,4,《夜王》里这些女性角色，没有被神化，也没有被牺牲。她们有欲望、有判断、有失误。电影真正尊重她们的方式，是允许她们的复杂，也肯定她们的精彩。,2026-02-23 20:33:32,408
4774960705,夜王,2026,Lecleg,3,7分，没有想象中的笑翻天和高级笑料，但仍是春节档最佳，适合不想被北佬说教/喜剧片毒害的观众。对女性的刻画比起预料中的刻板和男本位的叙事要丰富许多，唯一女性编剧何妙祺一定发挥很大作用，尽力把物化的剥削的元素转化为在一定程度上有所自反的叙事，角色的情感表达也很细腻，已经很不容易；更大主题是香港电影有一部算一部的“悼明”精神，但这种怀念不令人感到说教，而是借助所谓“人情味”、“义气”，持续呼唤一个幻想中的团结、奋斗的香港社会——但最终的命运也或许和夜总会的消亡一样，只能“灿烂到此”。第三幕如谍战悬疑片一般的夜场局中局，我们或许能稍稍看到一点香港电影昔日的荣光，但也到此为止。,2026-02-20 15:47:44,400
4775502315,夜王,2026,ming,4,其实翻工同做小姐有咩分别啊，又咪系遇着D閪客同叫你含。总之，嘟起个嘴，顶硬上啦。,2026-02-21 00:32:34,399
4777006424,夜王,2026,雨苔思音,5,完全反对现在的高赞评论，《夜王》恰恰是春节档女性群像处理最好的电影好吗！真的要夸编剧何妙祺，看过她的《我谈的那场恋爱》就知道，她很懂怎么写出有血有肉的、不完美但独特的女人。《夜王》里无论是V姐还是Coco，都不是为男人而存在的花瓶。V姐背锅后反击，是典型的职场女强人。Coco为了良知和情义，放弃富二代男友。女编剧才明白女人怎么在江湖生存，这份细腻和共情，我真的有感受到。别随手一个大帽子扣上来吧。,2026-02-22 16:05:30,1864
4766517433,夜王,2026,偷懒小猪罢了,5,剧情比想象中扎实，不是为了搞笑而搞笑。内核整体上是延续了毒舌律师的风格的，还是讲“义”，不过毒舌律师讲的公义，夜王讲的是情义，比单纯的喜剧更有深度，小人物对抗资本特权的故事，是一部值得二刷的好片,2026-02-17 11:03:25,1246
4778560795,夜王,2026,子戈,4,港片爱用某个“行当”的内部变化，暗写时代变迁。黑帮、间谍、记者、殡葬业，都曾被作为喻体。这次轮到了夜场。 拍的是夜总会，但字字句句说的，又何尝不是电影业？“尖东迟早会垮，东日也不知能活几日，但不管怎样，我们一定饮到最后。” 影片实际是在一种“日渐式微，迟早要完”的氛围里，让一群重情重义、还按老规矩做事的夜场人，最后体面了一把，有如泰坦尼克号上的最后一曲。 高潮戏，基本是按盗匪片处理的，但所用逻辑，皆是夜场的规矩。其实就是用“信息不对等”这种原本属于上流社会的致富密码，最后反戈一击，成为制胜关键。 是我在整个春节档里，看得最欢乐的一部电影。尽管悲情藏在深处，但纸醉金迷、灯红酒绿，还是做在了表面。大势所趋，或许无法避免，但我们还是可以处置自己，尽力做一点事情。,2026-02-23 23:32:43,222
4771442626,夜王,2026,曼波,5,子华神还是子华神，很多粗口很正，看完轻松快乐，怀念过去五光十色的香港,2026-02-17 00:10:50,827
4772652210,夜王,2026,Q,2,为什么那些公然嘲笑女性外貌年龄的桥段可以光明正大被人笑？ 为什么最重要的剧情结果就是个串通老千局？香港没落了，是的，不没落才怪,2026-02-18 09:53:10,1230
4774961758,夜王,2026,有只骗子,2,主要的问题是剧本，写得有点差。整个节奏很怪，一时搞深沉一时想搞笑，前半段太太太长气了，多余的儿女情长，好鬼闷，贺岁片不是这样搞的，不用上价值。后半段的局写得也不好看，整体很小气局促的故事之余，台词总有种想写金句搞笑但很不自然的感觉。,2026-02-20 15:49:13,373
4777136185,夜王,2026,超鱼,2,腐朽。没看到坐台小姐坚守在边缘行业和道义有什么必然联系，生硬尴尬到让人坐立不安的搞笑桥段，女主女配都围着一个老男人转的煽情情节，叱咤尖东三十年的女强人V姐躺在男人怀里呜呜呜呜呜哭着说“我呢世都未试过欠人咁多钱嘎”呜呜呜，笑死我了。,2026-02-22 18:24:59,222
4778629725,夜王,2026,Lue,4,不演就不存在了吗？灰色地带没有自己的世界价值选择生活吗？没觉得擦边反而每个人的人设都立住了，谁不是为了生活。,2026-02-24 00:33:47,239
4775170659,夜王,2026,June,1,看完倒是能更清晰地意识到，黄金时代是一场男性的春梦,2026-02-20 19:50:38,1161
4763042037,夜王,2026,AD ASTRA,4,2026.02.05澳门银河首映礼。吴炜伦和何妙祺两个相性差别这么大的人能合作写出这么和谐的剧本。吴彻底放飞自我在前半场把《毒舌大状》里法庭上不能说的字使劲喷出来，本广州土著都不得不佩服原来粤语里常用的几个国粹还能如此排列组合。何妙祺则为每一幕过渡段的文戏填充独属于女性的细腻和温柔，各司其职又不互相冲突。后半段切换风格拍商战居然可以做出谍战片的味道搞反转，安乐影业下次得给吴炜伦开一部谍战/警匪片试试水了。（廖子妤和王丹妮站一块就巨来电，已经演过姐妹、对手、战友了，这次还是止步于女同事，下次能不能演“事”不发音的那种；跟《饭戏攻心》撞演员梗了，欢哥那个做夜总会的老母转世成这辈子的情人还依旧做夜总会🤣）,2026-02-17 01:08:18,291
4769761368,夜王,2026,匣中猫,4,何妙祺蠻厲害，感覺如果沒有她參與的話，參照導演前作，很有可能會變成一個刻板的男性向後宮故事，但那些避免寫到「肉」而是專寫「靈」的糾纏部分，讓整個發生在曖昧的灰色地帶的故事變得可信，所有的情感都像是曾發生過的某段風流韻事，結果就是能夠拋開一切束縛去沉浸在這種介於由心而發和懷舊之間的曖昧感，無關於任何新時代，卻老土又動人。而感覺是黃子華近年主演話語權最小的一部，沒有太多精心棟篤笑反而討喜，鄭秀文囿於角色過分傳統，反而觀感沒有那麼好；Fish和小野伉儷完全可以打包雙提女男配，幾場重頭戲處理得相當出彩。可惜就是抽真空獨白式的開頭結局相對而言還是無趣了一些，4.5歸4。,2026-02-18 17:01:54,218
4778125493,夜王,2026,兔丸,3,太吊诡了，厌女晚期的港片居然成了春节档“含女量”最高的片子。 比这更吊诡的是，本片明面上讲述的是夜总会小姐的故事，实则最后集体托举出来一个混迹情场但精神守节，为前妻两肋插刀的深情男；虽然V姐强，但女强男更强，女人追求事业好，但最后还是要复合，怒包饺子。 一套组合拳下来，差点以为误闯晋江言情频道。 100年之内，没人能看懂这个春节档。,2026-02-23 17:23:20,324
4773613594,夜王,2026,水草肃,3,纯纯大过年的博各位老爷一乐之作，6202年了，香港还停留在怀念上个世纪的幻梦里,2026-02-19 02:49:14,220
4783483757,夜王,2026,Rolls-royce,4,一地耳环 一厢情愿,2026-03-01 15:14:15,148
4775080712,夜王,2026,遙遠,4,黄子华新赛道：夕阳产业代言,2026-02-20 18:10:09,151
4779554012,夜王,2026,豆瓣认证江湖骗子,5,好看！黄子华演的真好。这个电影其实是女凝，视角也让我觉得很平等。因为大家都很有职业上班的感觉，男客人们角色也很扁平很工具。并不是说这个题材就是男凝，如果捂着眼睛当这些人不存在才叫自欺欺人吧。如果让某些国内导演拍这题材免不了要对着胸部然后男性看呆了、失足少女悲惨身世、陪酒女被客人动手动脚不知所措被男主拯救的情节，以上才叫男凝。,2026-02-24 23:35:36,166
4778060876,夜王,2026,一桶桑,2,给“夜场女”套上江湖义气的皮套也改变不了物化她们的事实。,2026-02-23 16:18:23,179
4777778805,夜王,2026,LOOK,2,相当失望，情节、场景、主题的营造各方面都太简陋了。核心一点是get不到挽救夜总会这件事的深层价值到底在哪里。选角问题也很大，黄子华本质上不适合这个题材，没有江湖味，和郑秀文也不来电。,2026-02-23 10:26:31,119
4781900491,夜王,2026,浪漫主义狗,3,能拍一部鸭店版吗？,2026-02-27 17:50:56,179
4778430041,夜王,2026,同志亦凡人中文站,4,风月场中的情和义。没有猎奇和雌竞，更多是下九流的同仇敌忾，还带着老派港片的一点情怀。黄子华的个人风格还是太强了，导致郑秀文后半段成了puppet。我心疼床下散落一地的耳环，谁说坐台小姐没有心？这个职业能出现在国内大银幕上，本身就是最大惊喜。,2026-02-23 21:57:28,130
4789484508,夜王,2026,无逾,3,最中幻想。 男主角身边围绕的莺莺燕燕里有三个对他影响至深的女人。女主，一个强势的正宫，被反派坑到破产，等待他的拯救；红颜知己，自甘为男主排解寂寞，无私助力男主的事业，在男主找到真爱后黯然退场；女儿，从小跟着男主在夜场讨生活，对男主言听计从，为男主的成功放弃千万财富。 如此美妙，中登死前能梦上这么一场，就算做了一辈子loser也不会死不瞑目。,2026-03-08 23:35:44,111
4778356087,夜王,2026,晚不安,2,欢场本就是男人的世界，写满了父权的规则，把夜总会的题材叠加上贺岁喜剧的类型，注定无法摆脱物化和剥削女性的原罪（依然大量使用容貌羞辱这一套老式下三路的招数）。用毫无性张力的黄子华来做安全牌，再用人情味美化夜场的脏污，最大限度地降低了观众感知到的危险，其实这反而是一种更大的毒性。在这个灯红酒绿的旧世界，女性的主体性始终无法摆脱厌女的底色，因为吴炜伦对过去投射的是怀恋的目光，而不带半点反思性。所谓东日保卫战，保卫的绝不是这个只存在于想象之中的乌托邦，而是一个坚固的男性利益共同体，《夜王》完成了对这个概念的偷换。,2026-02-23 21:00:54,137
4778772412,夜王,2026,桃桃林林,3,从娱乐角度可看性还是不错的，但相比《毒舌律师》还是粗糙了很多。其实核心还是调动大众情绪，底层守望互助大战邪恶资本、富二代天龙人这种设定。没落的夜总会显然是对曾经辉煌的香港的指代，但既然选择这个角度，确实会在性别方面遭遇质疑和吐槽。其实更明显的问题是，感情戏写得太差了，基本就是硬写出来的，去掉这些其实也没什么影响。但是那些搞笑的部分、弱胜强的部分还是很接地气的。,2026-02-24 08:23:44,111
4774843355,夜王,2026,油油萬,4,群像塑造非常好，相比之下，这次更像是黄子华给女孩们当绿叶，戏剧上所说的两难抉择，落到了女性角色身上，她们的选择真正影响了整个大局，从戏剧角度看，她们才是真正的主角，有成长弧线的高光人物,2026-02-20 13:05:13,454
4775965325,夜王,2026,竹和,3,为了Sammi买的票，结果V姐是所有人里面最扁平的一个角色，基本功能只有美，甚至都不能算主角，因为本片所有角色几乎都只做了一件事，就是全方位托举欢哥。基本上这片还保留了香港电影的内核（讲真大聊黄赌毒还能在两广上映我是真的很诧异了），从滥俗梗到港片快准狠的节奏以及常用的设局矛盾激发，这片的确可以拿来贺岁，只可惜它充满了男性视角，最后肯定会惹怒一群人。人物一一分析的话，黄子华的角色最讨喜，连唯一的感情污点最后化成了饮恨而终的动人爱情。V姐的设定很无聊，从能力到智力到人际关系处理都没有特别之处；coco和mimi则都是为男性角色而牺牲成全的工具人...我只能说会这么写故事那多半就是因为创作者潜意识里的价值局限。,2026-02-21 16:18:45,146
4774812399,夜王,2026,MerrieRobin,1,2026年还搞这种物化女性的电影到底有什么好笑的,2026-02-20 12:19:21,781
4776678558,夜王,2026,笑树🌵,3,还以为拍一半摄影指导换人了，前一半画面丑出天际了，剪得也很烂。前半个小时只是为了凸显欢哥的人格魅力但完全可以删掉。明明可以写v姐和其他姐妹们的女性情谊，偏偏要写争男人最后还得靠男人救，不知道最后的clubv是想表达什么，可能是想起来还有个女主角吧。,2026-02-22 08:00:02,119
4784316659,夜王,2026,囧之女神daisy,2,不是平庸，是难看。而且难看到让人喟叹惋惜，如果香港电影和黄子华就这样了，那真的就这样了。2026年了，还在拍风月场里阅尽千帆的女性们想在一个干瘪老头（即使他是黄子华）身上找真爱，港女形象依然是看似飒得不行最后等着男人来拯救世界，醒醒吧，美国都干伊朗了，你们拍的故事还是里根时代的。当然，最最最最可怕的是，如果牺牲题材和进步性能换回一点低俗的好笑的话，那还可以理解，但是！它！居！然！一！点！都！不！好！笑！,2026-03-02 13:48:57,67
4774957410,夜王,2026,球宝宝,4,《夜王》没有把人物写成脸谱。葵芳甚至稍显执着的勤奋努力来自责任，结衣主动“下海”的积极来自于对“丑小鸭”蜕变的主动追求，其他角色也各有坚持。立场不同，但动机都很动人。你能看到他们在局势下调整姿态，却始终守住自己那条线，这种人物完成度挺难得。,2026-02-20 15:43:05,304
4777201599,夜王,2026,阿戍,3,两位老板的身材管理和肌肉量🙏🙏🙏爬楼这么有效吗,2026-02-22 19:34:41,71
4776411633,夜王,2026,普鲁士蓝,2,一言蔽之，成部电影就系一场大型嘅湿鸠老坑临终幻想。,2026-02-21 23:03:53,76
4775837733,夜王,2026,i-Kuma,2,2/9看的香港首映。真的很男性中心，很老套，很low的懷舊。黃子華本人也來了，狀態很好很精幹，鄭秀文也還可以，其他人都沒有星味。,2026-02-21 13:40:48,94
4776751779,夜王,2026,差梨,4,2026年人生信条：学习V姐恋爱观——天下男人皆可杀，他死总好过我死。,2026-02-22 10:40:13,127
4779909532,夜王,2026,依然是瓜皮少女,2,我不喜欢，黄子华就是这个非常差的剧本打的安全牌，他游走在小姐们中间假装这不是一个剥削女性的环境真的很扯淡，郑秀文的V姐强势能干至此都得一个男人来“拯救”她，夜总会里的其他女性想有人物弧光就是更不现实的事情，在纯男性低级视角里，女性的高光就是讲他们男人的义气我真是白眼翻跟斗，我真的开心不起来，满眼都是美女，但只是把她们看作欲望商品，这种视角落后到就该被淘汰。,2026-02-25 12:28:51,69
4779047927,夜王,2026,欢乐分裂,3,3.5；“复古”港味扑面，还是熟悉的配方——不变的情谊主题，永远的香港精神，不息的生命斗志，跌倒再起，逆风翻盘，碟中谍套中套，赌场欢宴纸醉金迷，勾心斗角诛心算计，一层层迷局剥开来，里子全是旧情难忘、义薄云霄，底层互相打气，只因明白揾食不易，野草们须抱团取暖共同对抗外力强拆，巅峰期人生得意须尽欢，落难时薄酒一杯待重拾山河。 以灯红酒绿中重重幻影对照人心情意的可贵，到最后金钱居然失去了该有的、该死的力道，居然就有人傻气到丢了六合彩好运也要圆一场好梦，居然有人在床后的无数耳环里怀揣了一个关于爱情的神话，居然就以拥抱结束了说不出口的告别，在一次次响起的高跟鞋宣言中她们选择了自己的路。,2026-02-24 15:22:57,38
4779273626,夜王,2026,大奇特(Grinch),4,三星半，吴炜伦从《毒舌大状》延续下来的创作脉络，借行业喜剧的壳做一个传统类型片的新包装，上次是用当代法庭来拍扭计师爷，这次是用夜总会来拍老千计，里面有身份、尊严与逆境求生的寓言——欢哥和V姐看着对面公寓楼那场戏最明确，几乎每个角色的行动、动机也都围绕尊严展开，和《毒舌大状》另一个相似点是都在做扳倒富人的情绪价值。只是这个剧本其实是有结构问题的，像三种片拼在一起，包括夜场生态大群像，前夫妇恩怨爱情戏和最后的计谋喜剧，类型是不断跳变的，而且这三种戏是按前中后三段划分的。最后关键的计谋喜剧部分，反派也降智了。好的方面，它的粤语对白写得很入味，从演员嘴里说出来也自然，摄影对视听有追求。BTW：廖子妤的表演无疑最佳。,2026-02-24 19:46:56,35
4777452336,夜王,2026,seagull💙,3,电影很好很欢乐！但真的夜场完全不是这样，年轻女孩不要抱有幻想！,2026-02-22 22:56:01,90
4767281721,夜王,2026,tlmgt,5,这么好看的春节档年度大戏应该推广全国上映才对。好看到我直拍大腿。四星，冲着这么多差评就给五星，气死那些差评。😡 😡 😡 😡 借着喜剧外壳其实贡献了一段超精彩并且刺激感十足的顶级间谍戏情节（群戏绝了）同时配乐很棒，开头第一段和示范待客的配乐有很好听的 funk / disco （后一段戏的弦乐组非常高水平！！）感觉这个配乐有向不少黑人剥削电影(Blaxploitation) 取经。 看差评的理由看得我最气死的一点就是批评这部片凝视女性（？）分明塑造了不少鲜明的女性角色好吗？甚至有不少温情的镜头，好想二刷。但是如果你只是想看喜剧的话，其实这部戏的笑点并不是特别密集的。总的来说是比较合家欢，但并不是一部纯搞笑的娱乐喜剧。有很多地方看得挺感动，很适合这个经济差劲看不到未来的2026.,2026-02-20 20:22:33,302
4782798604,夜王,2026,黛玉怒拔垂杨柳,4,吃早茶那场戏，女孩子们叽叽喳喳讨论点什么菜，怪温馨的。,2026-02-28 19:33:50,92
4777165744,夜王,2026,笛子痞🌈,3,整个电影就像香港自己一样，还在幻想着昔日的辉煌，还觉得情怀可以拯救一切。但是一切都如夜总会这个设定一样已如昨日黄花早已只剩下陈旧的躯壳和老旧的灵魂。仿佛那些被扔在床下的耳环，已经都不配对了怎么可能再大放异彩？这个世界已经大踏步向前，只有香港还在怀念昨天的自己。至于女性仍然在等待男性拯救，郑秀文几乎在剧情里没有任何存在感，我都懒得提了。还有黄子华一把年纪还在幻想自己的杰克苏情节，真是男人至死是少年的最好注脚！,2026-03-02 18:31:03,58
4769570474,夜王,2026,理想主义新贵物,5,燈紅酒綠只係表面，江湖義氣先係最打動人嘅地方 開分估計可以上8分以上👍🏻,2026-02-17 10:04:09,229
4772420939,夜王,2026,BubbleAlien-,4,廖子妤每次都能被分到最美最灵动的戏,2026-02-18 00:09:33,120
4784871359,夜王,2026,蓝詹,3,经济下行时代的安慰电影已经出现了,2026-03-03 03:03:14,33
4776807760,夜王,2026,影评人 杉姐,4,没有刻意美化，也没有刻意贬低，而是真实呈现夜场女性群体的复杂、欲望、力量与真实，她们清醒、独立、敢爱敢恨，修复了影视作品里对夜场女性，惯有的形象表达。 很喜欢它传达出的成熟关系的真相：有些感情不必回到从前。成年人世界里，真正的「破镜重圆」，从来不是旧情复燃。 爱意或许淡了，怨怼慢慢散了，可信任还在，懂得还在。于是，曾经的夫妻，如今商场上的对手，没有歇斯底里，只剩成年人独有的克制、体面与默契。 霓虹闪烁的夜场，照见最真实的人性，人到中年，怕输、怕被淘汰、怕辜负身边人，却仍能在泥泞里守住一点情义，谁说不是另一个维度的，人间罗曼蒂克？,2026-02-22 11:54:14,183
4777401133,夜王,2026,夏言,5,我是真没想到现在还能在院线看到这个尺度的电影，心情如同《周处除三害》，无论如何都要支持一张电影票。前面铺垫略长，但后面合伙设局骗太子峰的高潮极其精彩，一度看得我手心冒汗。几个女性的刻画也很好，无论是一心搞钱的V姐，为了守住东日放弃大好前程的coco，还是为了父亲化疗被迫下海的葵。一群在底层挣扎的女性，却从没放弃义气，真好。,2026-02-22 22:19:34,102
4777551809,夜王,2026,TVB48-小风,4,居然出乎意料地好看，0个关于女性的玩笑，0个雌竞，夜场的女仔也很有情有义。整部电影节奏不错，中间看得人很紧张，整体有笑有泪，在春节档秒了。相比于男女主，女配们更为出彩，喜欢mimi、coco、chiling和葵芳。,2026-02-23 00:12:08,77
4776822252,夜王,2026,vvVv,4,sammi唱出了这部电影的内核——假使可以贯注心意，everyone is a superstar. 幽默感不仅是靠舌烂莲花的低俗笑话，更重要的是对生活细枝末节的观察。剥去风尘喜剧的外壳，它更是一部真诚、流露着“小市民”互帮互助气质的经典港式商战片。如果因为酒小姐的角色背景就批判厌女、物化女性、男凝，忽略所有女性的主动性，这才是最表演性质的一种“爱女”。,2026-02-22 12:13:31,37
4775602465,夜王,2026,马蓝星,3,中间的节奏太慢了，造成整体的观感下降了很多。而且想表达的东西也非常杂糅～喜剧效果也没有预想的好，全靠土地和葵芳勉强笑一笑。,2026-02-21 03:23:32,62
