评论ID,电影名称,上映年份,用户昵称,用户评分,评论内容,评论时间,点赞数
4786408940,夜王,2026,眠风兔,4,犹能看到狮子山精神，烂人真心是真的好嗑。,2026-03-05 11:37:31,10
4775139400,夜王,2026,昭和惊弓鸟,4,找回老港产片的节奏，在四十年后重拾逝去的尖东80年代荒诞神话，虽然此景此景只待追忆，但所幸过火癫狂的老港片桥段仍能得到再诠释，也依然延续黄子华电影的抚慰创痛功效，在声色犬马里持续注入旧街坊式强心针。,2026-02-20 19:17:46,7
4787283641,夜王,2026,TacoT,3,7分，近些年的港片总感觉隔靴搔痒不上不下，不否认是完成度与娱乐性极佳的作品但各方各面都欠缺火候。群像塑造与边缘群体叙事都只是停留在更安全与合家欢的框架之内，收尾玩闹般的商战博弈难以承载传统与现代这样宏大的命题，情义为重这样的主题也被说教地厌烦了，就连导演自己也似乎不信服地在最后选择拥抱新兴行业。以及虽然凝视与物化谈不上，但似乎绝大多数笑点都是下三路的堆叠，作为以喜剧为头牌的影片本该更精巧些。不过几条感情线的设计还是蛮出彩的——我在你这里真的丢了很多只耳环。,2026-03-06 16:12:39,7
4778358315,夜王,2026,柯里昂,4,带有怀旧滤镜的港式职场寓言，用一个即将被时代淘汰的空间，折射香港都市文化的更迭。一边是港式嘴炮节奏和无厘头桥段，一边又为一个行业的消亡写下时代挽歌，都市烟火、江湖义气…拥有黄金时代港片特有的浪漫与自洽，热闹背后是时间的重量。该说不说，这部里的黄子华真的蛮有型的。,2026-02-23 21:02:38,8
4775356788,夜王,2026,Antarcticite,2,看完出来朋友说一直以为这部电影叫《鸭王》，我宣布这比过去两个多小时都要好笑。,2026-02-20 22:32:31,18
4772579108,夜王,2026,Mystupidmouth,1,我怀疑只有最后40分钟写了剧本 勉强算得上个故事 前90分钟是大学生微电影吗我请问 拼拼凑凑莫名其妙 好笑也不好笑 不是本重庆人get不到 影厅坐满了香港人 没听到几声笑声的 体验极差！！！,2026-02-19 07:16:50,45
4782933569,夜王,2026,EasyRider,4,你是缪斯太子爷，我是东日CoCo姐！,2026-02-28 21:55:07,33
4778049609,夜王,2026,牛奶很忙,2,《填词L》但是没那么多表达，《金鸡》但是没那么多情怀，安乐给香港（电影）写情书真的快写吐了吧,2026-02-23 16:07:20,6
4777914499,夜王,2026,mubu,2,在女性意识觉醒的现在，还能有这种片子上映，也真是很扫兴了，影片有千禧年港片的味道，但更多的是观感不适。,2026-02-23 13:34:28,40
4781887349,夜王,2026,k-pax,4,"学富五car, 赴汤蹈fire... 这才是大湾区的春节档！每个角色都有戏，剧作和演技都一流！地域文化原因，不能全国大卖，是个遗憾。评：4.5星",2026-02-27 17:32:18,8
4778279273,夜王,2026,日灼,4,“夜 场”的落寞，表面是行业式微，实则是纸醉金迷退潮之后香港的失重感。但与之前几部戏不同的是，黄子华这次重点放在逆流而上的香港精神。最让我惊讶的是编剧把两种故事类型融合的蛮流畅，前半部分是职场片，后半部分则是《骗中骗》式的骗局片，同时几乎集齐港片各种精神碎片：江湖气、市井气、人情味、甚至一点无厘头来调度观众情绪，足版上映很难得。至于现代语境下对这个行业的展示，其实影片并没有浪漫化，甚至提到本就是底层的她们，一旦再度滑落后可能的生活，也构成影片叙事的逻辑出发点。ps：强烈推荐《如龙》玩家观看，某种意义上可以体验一把港版真岛吾郎式的故事。,2026-02-23 19:55:31,8
4775221826,夜王,2026,天后董小姐,4,一群人在夜里讨生活，有什么好看的？好看在她们没把自己当成可怜人，导演也没把他们拍成符号。镜头扫过那些女人的脸，你看见的是疲惫、是倔强、是算计，唯独没有“被同情”。她们有选择，有脾气，有自己的活法。看着她们在镜头里走来走去，比看一百句宣言都提气。,2026-02-20 20:41:21,147
