评论ID,电影名称,上映年份,用户昵称,用户评分,评论内容,评论时间,点赞数
4429904127,熊出没·重启未来,2025,万世伊知华,1,有 这么一部动画，它比《哥斯拉大战金刚2》更彰显塑料奇观，它抄《神奇宝贝》的反派三人组各种玩尬，它说我们抄点《流浪地球》的元素是为了畅销环保主题，它告诉我们“缝合怪”创作也能拍出主创负分想象力但就是很赚钱的IP价值。在这部动画里，我们不仅能看到为牛奶打广告的小女孩，还能看到曾 孙大骂太爷爷，更能看到《阿凡达》机甲暴打小孩哥（还顺手抄一波《变形金刚起源》那段揭露反派阴谋的情节）。于是在全场观众还疑惑为啥城主与主角团不合作救世，这哥终于爆点说，“人类各种坏各种恶，救世界有什么意义，所以我为了自己的城市和被赞同的爽感所以害了你爸”。这下父母小孩都看无语了，我也看无语了。原来你才是那个把本片保护环境的主题非得硬改成故作人性批 判的老白左。属于是既无原创性又无创作道德情操还无语的三无动画了。,2025-01-31 13:07:40,29
4426850359,熊出没·重启未来,2025,娱乐圈梗姐,4,科技的终极想象就是科幻，主创团队致力于在打造超越当下的极致想象，为了观众勾勒出未来的无限可能，能感觉到主创团队的良苦用心。,2025-01-29 12:57:46,5
4465748034,熊出没·重启未来,2025,天鹏,4,用科幻外壳包裹温情内核，新角色「小亮」的塑造堪称惊艳。这个来自末世的10岁男孩，身负救世使命却保有稚气，看似弱小却迸发惊人信念感。他背上的全息投影背包、手腕的智能装置，既体现未来感又与剧情深度绑定，而他在废墟中倔强重启生态系统的执念，恰似一簇刺破绝望的微光。主创将环保议题具象化为孩童视角的拯救行动，既避免说教感，又以「再微弱的光也能照亮黑暗」的台词赋予角色诗意升华。当小亮在孢子风暴中逆行的身影与光头强的成长弧光交织，观众不仅看到熊出没宇宙的新可能，更感受到动画对「少年心气」的理想化投射。,2025-03-01 20:23:10,3
4426861817,熊出没·重启未来,2025,一只小孙鼠🐿️,4,熊二这次真的让我刮目相看，憨厚又勇敢,2025-01-29 13:08:05,6
4426745752,熊出没·重启未来,2025,五色风马王灰狗,4,再微弱的光，也能照亮黑暗。非常成熟的科幻冒险动画，像是看了一部少年番，大人完全看的下去。,2025-01-29 11:31:29,10
4430596910,熊出没·重启未来,2025,思域绝缘体,4,作为子供向动漫很不错了，毕竟受众不是我，小孩子也不讲逻辑哈哈。就是有时候主角讲大道理不知道说给谁听，大人不爱听，小孩听不懂。本电影含妈量几乎为零，也是登味十足呢,2025-01-31 21:32:15,6
4578709666,熊出没·重启未来,2025,rainforest,1,花了100分钟看了个究极缝合环保大电影，光头强和熊大熊二就是个套皮怪，人物除了能逗小孩子基本上就是个空壳，剧情无聊透顶且注水。包括但不限于“致敬了”《末日孢子》《明日战记》《上海堡垒》《灵笼》《宝可梦》（火箭队）《寂静岭f》，熊出没这个IP已经变得毫无特色可言，只剩下越噶越多的韭菜。,2025-07-08 01:56:07,2
4451146745,熊出没·重启未来,2025,Hey Johnny,4,补个打卡。带娃观影，意外竟然比之前那个什么哆啦A梦好看，全程没犯困。,2025-02-16 19:34:46,3
4426894874,熊出没·重启未来,2025,烂片吐槽社,4,真的超出意外的好看，可以无脑冲，一点都不低龄，笑点很密集，节奏也比较紧凑，整个故事内核很宏伟，画风和想象力都非常成熟，是适合大人小孩一起看的全家欢影片。熊大熊二光头强出现在大荧幕时，熟悉的声音一响起，就好像回到了小时候蹲在电视机前的我，还好有他们一起陪伴。这是《熊出没》科幻篇的最终章，但不是《熊出没》的最终章，期待明年的大电影。最后，呼吁大家真的要注意保护环境，从你我做起。,2025-01-29 13:39:22,6
4427363856,熊出没·重启未来,2025,巴伐利亞酒神,4,一部熊大熊二和光头强玩高科技的故事。这次不砍树了，改玩机器人、无人机，连蜂蜜都搞起了“高科技养殖”。熊二还是那么贪吃，但学会了用智能设备找蜂蜜；光头强也不再是单纯的伐木工，变成了“科技达人”。电影里有很多未来感十足的场景，像是进入了科幻世界，但搞笑和温情的部分一点没少。小朋友看得开心，大人也能找到笑点。总而言之，这是一部既有趣又富有想象力的动画，老少皆宜。,2025-01-29 19:28:11,7
4525988188,熊出没·重启未来,2025,马特柯代尔,1,这城主的人设很像朝鲜金家政权,2025-05-07 18:54:18,2
4426968099,熊出没·重启未来,2025,惘然,4,原本只是陪亲戚家小朋友看的，结果发现居然不错，主题和呈现也是适合全年龄段看的动画电影。 喜欢电影中对于孢子的设定：它原本并无毒，甚至提取出来后还能拯救未来世界，但被污染后就成了可怕的“毒王”。电影对于反派的设定也是，曾经他是救世主，但为了保住权力，逐渐腐化堕落，站到了光头强们的对立面。 当然最喜欢的还是光头强、熊大、熊二、小亮他们的拯救未来小分队。当然后面又有别人加入，正义联盟逐渐壮大。电影还给现实中总被推出去背锅的“实习生”正名了。 感觉明年春节会是我要求亲戚家小孩陪我来看这个动画系列了！哈哈～～,2025-01-29 14:44:36,6
4428470240,熊出没·重启未来,2025,厄庇墨透斯,4,起初，没有人在意白熊山……这是小破球1卡通版。小亮是中二少年刘户口、眼里闪过能量炮光辉的光头强是“前进三”刘培强，地王孢平替一下无辜木星。老钟人是不能容忍疯狂MAX的赛博世界的，必须全世界无产者联合起来，众志成城。另技术层面胜过魔童百倍。,2025-01-30 13:46:40,7
4446203633,熊出没·重启未来,2025,静待花开,4,我小孩说很好看,2025-02-12 13:23:02,3
4428354835,熊出没·重启未来,2025,一杯柠檬茶,2,一年一部，比较稳没什么雷点，也比较无聊，反派角色设定也比较无聊，说教式地输出“环保”的议题，“火箭队”两人的人设翻转还挺有意思，女性角色的台词不超过三句话，有之前“熊妈妈”那么受欢迎的角色竟然不多增加一些。视觉效果，3D出屏做的还行。#2025院线03，评分：6.0/10。#春节档01,2025-01-30 11:57:36,128
4435736217,熊出没·重启未来,2025,酸辣小星星,4,每年一部，似乎也成了我家的传统。现在真是越做越精彩，主题也宏大。,2025-02-04 02:08:46,3
4524471635,熊出没·重启未来,2025,bird,2,实在是越来越没人味儿。,2025-05-05 20:24:55,1
4437475114,熊出没·重启未来,2025,i_chips,4,熟悉的配方，惯用的套路。 加入了赛博朋克、末日废土元素，发挥还算稳定。 帮小盆友打三星半。,2025-02-05 10:54:50,3
4427187298,熊出没·重启未来,2025,爱吃面条,4,我小时候要是有这动作场面看，那不得爽死啊！虽然7年前做宣发的时候就知道《熊出没》是春节档的隐藏boss，但直到今天才第一次看。堵车迟到了，进影厅时候正赶上熊大熊二一行人在大逃杀，真正领略了什么叫“整个影厅都充满了快活的空气”，小孩们几乎都是站起来看的。 我觉得《熊出没》不需要分析什么，孩子爱看就是它的硬实力，如今中国动画电影（包括哪吒）很大程度上是拍给成人看的。能让小孩开心整个下午，能让父母跟着开心放松，这生态位就算是卡死了，再拍50年我看没问题！,2025-01-29 17:32:18,8
4676532843,熊出没·重启未来,2025,小程同学🌈⃤,2,年年如此预制片有点腻了,2025-10-28 00:11:53,0
4430599938,熊出没·重启未来,2025,平淡无奇的影迷,4,动画质感一级棒,2025-01-31 21:33:48,4
4579548872,熊出没·重启未来,2025,SpyLiu,1,#华语片保护月#叙事套路，也走上了不走心的创作路径，但保护环境的主题倒是没有太多说教感，与剧本融合得还行。,2025-07-09 05:20:45,1
4426744375,熊出没·重启未来,2025,标本师库特,4,之前只看过《熊出没·重返地球》，主题都是科幻，都很精彩。这一部的爱护环境、揭露污染恶行的主题又贴近我们的日常，又有科幻批判精神，是科幻片里常见的元素，没想到这部《熊出没·重启未来》能做的这么好。,2025-01-29 11:29:52,5
4430611029,熊出没·重启未来,2025,yyys,5,今天连看两部电影，《唐探》和熊。 我也是连续两年陪看熊出没了，我觉得今年没去年精彩！小朋友说今年的好看，还给我balabala一顿说:熊出没里没有人会挂，坏人也不会挂！坏人会变好balabala。我问为什么？小朋友说你不懂[哈哈][哈哈] 好吧，我真的不懂孩子的世界。顺手给个五星好评。,2025-01-31 21:39:29,7
4433635516,熊出没·重启未来,2025,何许人也,1,这代儿童真的没什么好剧情的动画片看啊。我难得一次在影院睡着，小孩看得开心。,2025-02-02 21:06:18,5
4311899026,熊出没·重启未来,2025,小辉辉,4,没想到能在熊出没里看到废土朋克 还能听到careless whisper,2025-01-29 10:52:20,10
4463406834,熊出没·重启未来,2025,🍏,5,看过,2025-02-27 14:50:05,1
4247505637,熊出没·重启未来,2025,影瑞,4,未来在重启 我的青春已经定格，无法重启,2025-02-04 17:29:53,3
4450986274,熊出没·重启未来,2025,xTnis,5,多给一星，以资鼓励。,2025-02-16 17:07:57,3
4261464337,熊出没·重启未来,2025,一只特特呦,2,去拍50集环保广告吧，架空闯祸拯救世界，合家欢包饺子标准结局。 这部新角色倒是好看点，资金充足画面也保持“半科幻”的水准。 口音梗、谐音梗、和去年一样笑点都抄段子，原来是借鸡摸狗式借鉴，因为是拼的世界观所以导演根本不理解也没想过所有的细节，为什么是孢子，为什么种草莓......,2025-02-04 23:52:46,12
4433876540,熊出没·重启未来,2025,炳子,2,比较俗套，都要睡着。儿子都耐不住要走。,2025-02-02 23:03:11,13
4432076395,熊出没·重启未来,2025,fxxxxxc,2,电影越来越尬，童年越来越模糊，故事越来越离谱,2025-02-01 21:00:41,14
4523505630,熊出没·重启未来,2025,能文能武,2,林永长 / 瞿才佳《熊出没·重启未来》，5/10。一如既往的歌不错，但是越来越低龄,2025-05-04 20:29:14,1
4521832999,熊出没·重启未来,2025,爱琳,2,熊出没越来越像美国电影了（这句话是贬义词）,2025-05-02 21:48:25,1
4426790090,熊出没·重启未来,2025,罗弘霉素,4,熊出没现在这个阶段真的是零帧起手即惊艳，视觉效果在重返地球时期已经出圈，上一部逆转时空的超级英雄式集结简直是中国动画的里程碑名场面了。最厉害的是“生物危机”这种科幻世界观放眼全世界的动画电影都很少呈现，没想到能做到这一步，当真厉害。,2025-01-29 12:07:31,6
4426833064,熊出没·重启未来,2025,琛🇨🇳,5,“再微弱的光 也能照亮黑暗”新年第一碗毒鸡汤我先干为敬了，有内涵的台词yyds,2025-01-29 12:43:28,8
4426739033,熊出没·重启未来,2025,蓝影志,4,在动画电影里来说还是很好看的，中国合家欢系动画电影工业一年一度的汇报。科幻外壳，环保主题，少年成长，英雄闪耀，中间还夹着一丢丢光头强的觉醒高光……喜剧部分也是又好玩又可爱，两只熊能量满满，两个小反派角色各种逗比，每一个笑点都笑得我肚子疼。最后所有人都团结起来的大场面有燃到，熊出没动画制作是越来越强，格局也真的是越来越大了。,2025-01-29 11:21:44,7
4441426542,熊出没·重启未来,2025,JieS,3,你别说，这个系列电影制作质量相当稳定，算是成熟商业公式化电影典范。儿童向公路冒险片，整体画面制作上差不了隔壁哪吒多少。如同我一直认为那样，只要有资本，视效完全可以无差别，但电影最基本的故事，却不是努力就可以做得好的。两者的剧情只能说是大哥和二哥的区别，只是哪吒的独立性元素更多，熊的剧本观感上公式化更加明显而已。东搬西借，基本就是套个立意，引入新人物，展开冒险，拯救某某。年年一部，确实有点腻了。,2025-02-08 12:20:35,0
4288146465,熊出没·重启未来,2025,HAN.,4,每年的必选项 还是一如既往的欢乐,2025-02-01 10:36:44,4
4434993809,熊出没·重启未来,2025,暴怒影评狗,1,年年都要洗钱是吧？,2025-02-03 20:00:27,3
4642699842,熊出没·重启未来,2025,暴殄天物,0,不评价了，我就是在第1个植入广告那儿不看的。,2025-09-16 14:52:20,0
4426846971,熊出没·重启未来,2025,金玉其中,5,内容风趣搞笑，但是无厘头的画面里总是会有很多深刻有意义的台词，大朋友表示自己也会经常被这种类型的电影感动到,2025-01-29 12:54:48,5
4430592702,熊出没·重启未来,2025,梵高星空,5,不错的电影。这电影是关于环保的主题，带小孩子看还能教育孩子保护环境爱护地球。电影虽然是针对小孩子的，不过做的一点都马虎。剧情还可以，画面，特效看得出是下了一番功夫的，还不错！在场的小孩子看的很入迷，很开心！第一次看熊出没的动画，没想到做的这么好！真是不错！！！,2025-01-31 21:30:06,16
4459381571,熊出没·重启未来,2025,契阳,3,过了看英雄片的年纪，理解了姑姑以前看哪吒1的毫无感觉,2025-02-23 20:44:41,0
4442206346,熊出没·重启未来,2025,潘老师,4,特效真是国内顶尖的水准了，很符合春节档，很热血正能量，不得不说每一部熊出没都能给人很大的惊喜,2025-02-08 23:23:51,2
4428543888,熊出没·重启未来,2025,老白,4,人类皆伟大！就爱这口重工业科幻动漫大片！好好好！,2025-01-30 14:52:22,3
4428507647,熊出没·重启未来,2025,AL Rorschach,4,即使是动画人物也特别鲜活，炒鸡治愈！,2025-01-30 14:20:26,3
4430605681,熊出没·重启未来,2025,luo_,5,还是好看的,2025-01-31 21:36:41,4
4428776150,熊出没·重启未来,2025,星期一,5,好看，最喜欢看光头强了,2025-01-30 17:47:35,5
4426748096,熊出没·重启未来,2025,工号-英雄所见,5,搞笑有趣，各种各样的笑点总能让我会心一笑，熊出没之重启未来尊嘟给了我好大的惊喜,2025-01-29 11:33:53,4
4594044841,熊出没·重启未来,2025,披着人皮的鬼,3,手艺活相当不错的裁缝 希望有一天自己能织料子,2025-07-24 19:40:51,0
4614571418,熊出没·重启未来,2025,星游,3,感觉跟熊没什么关系了,2025-08-14 11:34:56,0
4433866845,熊出没·重启未来,2025,身体大师,3,因为看了哪吒2，再看熊出没就感觉没有啥意思了。总体过得去，但不算精彩,2025-02-02 22:58:42,2
4426902358,熊出没·重启未来,2025,傅尔曼,4,本社畜和光头强又共情到了，人一天天老去，奢望也一天天消逝，像挨了锤的牛一样，我们需要一个契机，一个激发自己破壁的人，一面能反射欲望的镜子，光头强遇到了小亮，他又活了，希望我们也能遇到那个微光，在2025年。,2025-01-29 13:45:34,2
4429803533,熊出没·重启未来,2025,Alpha,4,每个人都是微小的光，聚在一起，终能将黑暗照亮。有笑有泪，制作精良。非常棒的合家欢电影，很适合带小朋友一起来看，好看又有教育意义。,2025-01-31 11:33:14,3
4546658399,熊出没·重启未来,2025,龍爺,4,挺好看的，我想知道光头强媳妇长啥样哈哈哈哈哈,2025-06-01 19:02:06,1
4436389677,熊出没·重启未来,2025,李湘,4,好好看。进入幻想世界。一个痴情。一个贪吃。一个爱钱。哈哈哈哈。,2025-02-04 16:34:41,3
4395415588,熊出没·重启未来,2025,林先生的小可爱,4,光头强原来姓光,2025-01-30 14:55:18,3
4445654496,熊出没·重启未来,2025,Go East,3,"春节观影之三。这个系列春节档基本盘还蛮稳的，寒假都快过完了影院里还挺多小孩，而且比我想象中好看多了。 故事扎实不低幼，中间还响了一段careless whisper, 我差点没在影院里唱出来。要是不让你一直保护环境就更好了。 光头强但凡帅上那么一丝，他跟小亮都能磕上一口cp。 3D看得我昏昏欲睡，求求国产电影放过3D。",2025-02-11 22:29:39,0
4431316657,熊出没·重启未来,2025,Just恩澍,5,去年是复联终极之战，今年是流浪地球，虽然场景相似，但我喜欢跟小朋友们一起在电影院欢呼和鼓掌,2025-02-01 11:30:56,9
4428786238,熊出没·重启未来,2025,阿文,4,我最喜欢的熊出没电影还停留在《熊出没之过年》《熊出没之年货》。虽然突破很难，但熊出没系列却一直在向前探索。虽然不完美，但好在一直的努力与陪伴！,2025-01-30 17:55:07,3
4428154242,熊出没·重启未来,2025,三只龙猫,4,新的一年开启新的熊熊篇章，熊出没系列就是好康,2025-01-30 08:17:33,3
4431961529,熊出没·重启未来,2025,witness,1,小朋友的欢笑声和大人的鼾声此起彼伏,2025-02-01 19:53:46,6
4418966460,熊出没·重启未来,2025,lww,3,【5】每年一部这样的裹脚布流水账电影。感觉熊出没除了卖情怀这条出路以外，如果再不找到其他创新剧情的出路的话是很难实现口碑逆转的。这一部电影的特效还行，但是剧情依旧套路模板化。不过里面是笑点还是可以的，翠花的建模也太丑了，建议改回原版，不然你这样友情客串还不如不客串呢。熊出没现在是越来越喜欢偏科幻这一类型吗？感觉应该是吃到了票房红利而已，但是剧情上面没有一点新意？去年靠卖情怀也只有6.9的评分足以证明剧情创新程度完全不够。不过如果以后的电影能让以前的一些英雄出场的话，卖一卖情怀，我还是很乐意接受贡献票房的。就看熊出没愿不愿意了。Ps: 1．里面的那个BGM好像星际穿越里面的。2．光头强是太爷爷这个设定还蛮有笑点的。3．结尾的那个蛇年的彩蛋算是为10年之前的童年画上了圆满的句号。感动。😭,2025-07-30 18:50:19,0
4426848095,熊出没·重启未来,2025,1900,4,同去年在人物配比上相似度很高，狗熊岭三人组里光头强为主，熊大熊二虽然也发挥很大作用，但是在人物塑造上是缺乏主体性的。说今年是科幻系列的最后一部（希望说到做到），不出所料的元素融合（剧情框架和铳梦式美术风格），整体的观感是要比“逆转时空”强的，对节奏的把控没有失衡，在异世界穿梭冒险的段落有点儿“R&M”的恶趣味感，软化孢那段扭曲的肢体与五官形变带来很好的笑果，流畅的动作场面也维持着其动画工业一贯的稳定水准。塑造了一组屡见不鲜的对立关系：行走于黑暗之间的英雄与站在光芒下的集权统治者，一些出生入死而建立起的信任显得光头强与小亮之间的亲情联结有点多余，比起前作迪迦式的把大家的光都给你，让每个人都行动起来，去反抗去勇敢一次确实是更有效的，希望这次炫技过后，可以回归淳朴不花哨的创作…,2025-01-29 12:55:47,6
4443361378,熊出没·重启未来,2025,萨布,3,这种弱鸡IP以后会被孩子们抛弃吧？很过时的感觉。,2025-02-09 21:52:51,0
4444289406,熊出没·重启未来,2025,落落的风,3,大年初九，包场看电影,2025-02-10 18:34:19,0
4426902441,熊出没·重启未来,2025,拔剑四顾心茫然,4,和宝宝一起看的，小家伙很喜欢。没想到合家欢的外壳下，蕴藏着环境保护的严肃主题。主创团队确实有情怀，这地王孢的末日设定一下子就让人联想起《宇宙骑士》中被太空植物侵占的地球。守望城，掠夺者，各种熟悉的末日设定让人会心一笑，创作者显然已经捕捉到末世文明中最经典的科幻元素，而唯一不变的主题永远都是：生存与希望。无论怎样穿越时空，无论怎样插科打诨，熊大熊二光头强的嬉闹背后，承载着对人类善意的无限畅想，心存善良，总有光亮。,2025-01-29 13:45:38,6
4550588338,熊出没·重启未来,2025,momo,3,熊出没这个ip出现的时间，正好是我开始长大、不再爱看动画片的年纪，（查了下百度，《熊出没》系列的第一季于2012年1月19日在中央电视台综合频道（CCTV-1）首播。）所以算是以路人视角来看这部动画电影，其实是好看的，只是不属于我的童年。,2025-06-08 01:02:14,0
4441331674,熊出没·重启未来,2025,赵敏🤤,3,居然熊出没都能有流畅的剧情了,2025-02-08 10:29:51,0
4427310997,熊出没·重启未来,2025,天羽翼,3,合格的合家欢电影。立意在环保上很不错！整体呈现度很ok，画面质感也很惊艳。,2025-01-29 18:54:55,2
4467790853,熊出没·重启未来,2025,竹傲风,3,想生存要靠英雄，想发展还得看组织。,2025-03-03 14:05:48,0
4431345785,熊出没·重启未来,2025,。Ryunosuke,4,每年春节档去看熊出没已经成了我的习惯，虽然已经有点厌倦光头强视角，想念可爱的熊熊，但是今年的故事还是给了我很大惊喜。最后半小时真有流浪地球1最后的感觉了，怎么说呢，永远抵挡不了这种众志成城舍小为大的情节，从果宝特攻到将夜，从流浪地球到熊出没，永远会被感动。,2025-02-17 18:59:53,2
4443364626,熊出没·重启未来,2025,纯绒皮卡丘,3,站在几岁小朋友的立场看，这可以说是一部非常顶配的动画大餐了，从主题到故事再到画面表现，简直是120％的适配度，比我们当年吃的好太多了，美味又有营养，孩子看得开心，家长选得放心。 但我不站在这个立场看，本片就带有一种复联4后看蚁人3的乏味感，在上部整了十年之约的大招后，这部的表现太工整了，铆劲地按套路出牌，片名更是烂大街，我该说你是用心呢，还是敷衍呢？,2025-02-09 21:54:42,3
4459318916,熊出没·重启未来,2025,人生如戏,3,本片作为《熊出没》科幻系列暂定的最终章，确实有点令人失望。本片对“未来世界”的设定与呈现看似有想象力，实则缺少创意，从孢子森林到守望城无不显露出拼贴杂糅的痕迹，况且，呼吁环保完全没有必要借助这样一个赛博朋克风格的故事。更糟糕的是，小亮被赋予了过于离谱的战斗力和科研能力，守望城城主则被塑造成一个至恶的反派角色，此人毫无理智可言，他为了维护自己的统治地位而做出的一系列行为很可能导致全人类灭绝，但他却对此全然不顾，这种至恶的反派角色即使放在真人科幻电影里也算是十分罕见了。本片还有一个严重的bug，小亮所处的时代是由人类对地球环境的污染造成的，而本片又特意强调了时空穿越无法改变未来，这也就意味着，为了不改变历史，现代的人类还是会继续污染地球，既然如此，光头强的这趟“重启未来”之旅也就变得毫无意义了。,2025-02-23 19:56:44,0
4444757017,熊出没·重启未来,2025,zoroalice,4,虽然但是，熊大熊二怎么成配角了，废土风格有点意思,2025-02-11 01:03:40,1
4675414634,熊出没·重启未来,2025,+画郭,3,年年如此,2025-10-26 17:08:38,0
4526260658,熊出没·重启未来,2025,Yxci。,4,十三年，从保护森林到保护世界,2025-05-10 22:42:47,2
4426827408,熊出没·重启未来,2025,翟天临,5,强哥牺牲那刻我真的泪流满面了，超级无敌不舍得555,2025-01-29 12:38:41,3
4441873683,熊出没·重启未来,2025,Nirvanania,1,没觉得你的人物和世界观的画风格格不入吗,2025-02-08 19:35:33,2
4479978770,熊出没·重启未来,2025,鬼域阿波罗,4,画面很炫，立意很强，但故事发展却还是那样,2025-05-03 17:47:01,1
4271334065,熊出没·重启未来,2025,Elvick,3,6.5/10 尚可 还是一如既往的稳，作为子供向动画，能做到让小朋友看得开心，同时遇到寓教于乐。本片其实在城主反转之前我是还挺喜欢的，因为反转之前可以说本片没有反派，只是两方之间立场不同，所关心的事物不同所导致的，但是在反转之后，整个故事就有点落入俗套，树立了一个明确的反派，虽然这么做没有问题，对于子供向动画来说也很正常，但是对于我来说就稍微有些没有那么有意思。不过整体水平还是在线的，他们第一次遇到掠夺者那一段长镜头追逐戏还看得我挺爽，并且里面光头强得知自己是小亮唯一亲人时想要保护小亮那一段也很有趣，整体是一部很适合带小朋友一起看的电影。,2025-01-31 15:41:59,1
4567413402,熊出没·重启未来,2025,光影一路同行,2,堆砌概念场景来掩饰每年都如出一辙的模板文本。我还是要说，熊出没不是一个伐木工和两头熊的森林故事吗，何必非让他们成为科幻动画里的工具人呢。,2025-06-25 15:39:31,1
4427051973,熊出没·重启未来,2025,陈,3,熊出没版生化危机，可惜是电影真人版的生化危机，不是游戏生化危机。,2025-01-29 15:55:22,7
