评论ID,电影名称,上映年份,用户昵称,用户评分,评论内容,评论时间,点赞数
4428621407,熊出没·重启未来,2025,林夕遥,5,非常正能量的一部电影，让小朋友知道要保护环境，人们要团结一致。亲情，友情贯穿整部电影，值得推荐。很适合亲子观看,2025-01-30 15:55:57,1
4548434757,熊出没·重启未来,2025,福尔摩司机,3,还是美术救了这个熊出没这个IP，虽然这个故事只是光头强和熊挂了个名，本身是一个老套的少儿冒险故事。从美术到剧情都直抄了近年动画故事的素材，一部片仿佛看出了十部片的影子，相当于买一送十了，给消费者一种赚麻了的错觉。定位还是学龄前的儿童，但不如汪汪队电影版好看，以后再不看了。,2025-06-03 16:50:06,0
4496830761,熊出没·重启未来,2025,小菲二二,3,不是，这么明目张胆的“致敬”火箭队吗？,2025-04-03 07:25:32,0
4469064707,熊出没·重启未来,2025,熊小月,4,陪孩子看的，意外的挺有意思，笑点萌点+环保教育+责任意识+不放弃精神，组合起来意外的不错，虽然有时候会想到阿凡达+星爵+流浪地球，但还是挺有自己的特色的。另外，画面是真的很美,2025-03-04 17:36:10,1
4780919850,熊出没·重启未来,2025,K.E,3,百年发展如此神速吗,2026-02-26 14:49:57,1
4434907524,熊出没·重启未来,2025,heisenberg,2,tc版，中国的超级英雄题材，故事总体讲的还不错，超出预期了，低俗的地方虽然俗不可耐，但是孩子们喜欢，而高级的地方孩子们又看不懂，2.0。,2025-02-03 19:03:30,2
4426754424,熊出没·重启未来,2025,时光Serene,4,从现代世界穿梭到未来末日，各种直给的科幻画面主打一个惊艳！五彩缤纷，功能各异且仿佛加了各种特效的孢子真的让人应接不暇，万万没想到有朝一日光头强还能变成螺旋桨来避难啊！“爸爸的爸爸叫爷爷”儿歌想起来的时候真的忍不住啦！太欢乐啦！另外本片的主旨也很让人动容：“什么都不做才会完蛋！”保护环境绝非空言，拿出实际行动来吧！,2025-01-29 11:39:47,0
4472741195,熊出没·重启未来,2025,Seres,2,弱智低俗说教，大篇幅的抄袭，满满的AI风。 纯粹是过年收割小朋友压岁钱的,2025-03-08 08:41:31,1
4646956125,熊出没·重启未来,2025,嘟小七,3,陪娃看看,2025-09-21 15:03:45,0
4440529727,熊出没·重启未来,2025,永远在路上的猫,3,剧情逻辑不谈，小朋友们看的蛮开心的，就是熊大熊二的戏份太少了，这可是熊出没啊,2025-02-07 17:56:35,0
4532685843,熊出没·重启未来,2025,Chris 勃,4,一年一部未有缺席，却意外好看,2025-05-15 22:29:23,2
4498383056,熊出没·重启未来,2025,Benedetto,4,孩子觉得好，时而感动、时而好笑、时而害怕。,2025-04-04 22:47:28,1
4426749033,熊出没·重启未来,2025,要啥自行车,4,光头强前一秒还说“我强哥外号丛林探险王”，下一秒就被变异植物狠狠打脸，心疼强哥30秒hhh,2025-01-29 11:34:47,0
4435914156,熊出没·重启未来,2025,冰,3,每年一次的熊出没，动画效果是越来越好。,2025-02-04 09:35:46,0
4526017943,熊出没·重启未来,2025,五角飞碟,2,本片不适合8岁以上人群观看,2025-05-07 19:40:59,0
4426753252,熊出没·重启未来,2025,ztc7888,3,熊强组合再度冒险，主打一个紧张又刺激，咱就是说动画片也有自己的冒险style,2025-01-29 11:38:45,0
4428978743,熊出没·重启未来,2025,落雨初心,3,没想到光头强有曾孙子了……就是不知道老婆是谁？ 本季为第三季度科幻系列，上一部模仿复仇者联盟，这部又是低配版流浪地球，还有人设照搬火箭队的男女配角。 水平永远是稳定的，不好不坏，有心意无能力,2025-01-30 20:12:02,0
4429429922,熊出没·重启未来,2025,司马明达,5,仇人苏龙德反对的，我一贯支持,2025-01-31 00:16:07,1
4426783144,熊出没·重启未来,2025,喜欢小⭐的妮妮,4,我和我老婆都在恋爱时就谈论起熊出没，毕竟是同龄人，在外人面前装成熟，但是在熊出没面前我们原因保持童真,2025-01-29 12:01:51,0
4426981473,熊出没·重启未来,2025,Nausikaa,4,@新天地 守望城的景搭得不错，有点流浪地球的意思。,2025-01-29 14:56:14,1
4463629487,熊出没·重启未来,2025,沧海一小生,4,非常好看，新年必看系列了，我这一场居然看到成年人若干，哈哈哈！,2025-02-27 19:19:41,1
4433542238,熊出没·重启未来,2025,披头,1,第一次去影院看熊出没，旁边小朋友看了半小时就开始玩手机了。熊出没还遵循着古老的传统：童话世界什么都是合理的。所以一群游客一开头就作死冲雪山大喊，光头强穿个夹克就赶往雪山里冲，孢子都遍布世界了，在野外穿行也不用任何防护措施。那后面一百年后的飞船也能靠短路打着火，光头强突然就会开从没见过飞船上演追击大战就不用追究了，反正存在即合理。所以在遇到哪吒这种讲道理故事又扎实视效碾压的全年龄动画，就只有一边看着的份了。求求了，别用低龄观众的要求要求自己了，创作点好东西吧。,2025-02-02 20:08:56,10
4646318102,熊出没·重启未来,2025,tottal,2,虽然是幼儿片，可是也太难以忍受了……,2025-09-20 21:07:31,0
4428352879,熊出没·重启未来,2025,酒酿萝卜皮,2,看的第一部熊出没电影，才知道以前年年都有贺岁片…… 这部电影总让我想到《机器人总动员》，咋说呢，没有对比就没有伤害,2025-01-30 11:55:48,1
4431082699,熊出没·重启未来,2025,MaΙkοΙm,2,对成熟商业片体系的全盘模仿使得本片沦为拼贴狂欢。从头到尾的剧本、结构、主题、人设、反转、笑点、走位全都像是吃了100部商业片的幼龄版，毫无原创性，也在咀嚼吞咽后失去了延异的可能。 最能体现本片比起国外幼教片“过度低龄化”的一个点：台词直接将“熊大”“熊二”“光头强”“小亮”这种昵称/绰号作为人物本体言说（比起来，《哆啦A梦》的胖虎也有其本名刚田武，但刘小强）——一种典型的对儿童认知的扁平化想象。,2025-02-06 21:09:57,3
4428133164,熊出没·重启未来,2025,大头大头,4,熊大熊二揪光头强头发那一part给我猛猛笑出声，太逗啦,2025-01-30 07:23:19,1
4436229284,熊出没·重启未来,2025,V.,3,强哥的孙子和曾孙子居然这么多头发，挺科幻的。,2025-02-04 14:27:46,0
4587018259,熊出没·重启未来,2025,Esfog,3,熊出没开演时候已经上大学了，所以没什么童年加持。可能适合影院里带小孩子看。整个故事剧情挺俗的，场面还行，但燃不起来。不如隔壁羊羊有时候热血沸腾,2025-07-17 16:50:53,0
4412035032,熊出没·重启未来,2025,日暮里,3,2.5,2025-08-22 19:33:34,0
4759332183,熊出没·重启未来,2025,saint2021,3,很成熟的剧本和制作，与迪士尼/皮克斯的平均水平相去不远。如果笑料如果再密集一些，可能会更好,2026-02-01 21:55:45,0
4803790923,熊出没·重启未来,2025,吾等,2,不好看又穿梭未来了世界毁灭了 你有一个城市，那其他人呢 世界观太小 反派一眼就猜出来,2026-03-27 01:41:58,0
4434972171,熊出没·重启未来,2025,小侠来了,3,如果你觉得不好看，恭喜你，你是个成年人了,2025-02-03 19:49:24,3
4426818391,熊出没·重启未来,2025,飞翔,5,情节很惊喜，说真的我一点没看够科幻系列，但也很期待接下来的新篇章,2025-01-29 12:30:59,0
4547818424,熊出没·重启未来,2025,木棍先生,2,很用功但还是很低幼，结尾大战场面借鉴《阿凡达》，配乐借鉴《星际穿越》，记得上一部借鉴《复联4》。说“借鉴”算是给这个系列留点面子。,2025-06-02 21:50:24,0
4460297380,熊出没·重启未来,2025,AntonioChai,3,稳定发挥，目标明确，不忘熊心❤️,2025-02-24 15:49:18,0
4437428173,熊出没·重启未来,2025,开心消消乐2016,4,比哪吒好看,2025-02-05 10:03:37,1
4431755455,熊出没·重启未来,2025,Evenc伊文西,3,熊出没是精准面向小朋友的产品，不能简单用电影的标准评价。但当面对更加精致更加投入更加用心的动画后，就形成了指数级碾压，从任何维度它都没有与之一战的能力。,2025-02-01 17:33:50,0
4594265103,熊出没·重启未来,2025,炜森,3,科幻是外壳，故事不行套什么壳子都白搭。,2025-07-24 23:33:57,0
4497974361,熊出没·重启未来,2025,W,3,和小朋友看的第三场电影，看到中间稍微有点怕，有几次捂住眼睛没看了，但是他好像还是能完全理解剧情。看着很科幻，其实是一个环保片。小朋友对各种各样的孢子特别感兴趣，什么毁灭孢、软化孢……回家以后还在说。,2025-04-04 16:18:51,0
4427064812,熊出没·重启未来,2025,千帆星河,5,熊出没版《灵笼》,2025-01-29 16:05:36,2
4436513554,熊出没·重启未来,2025,小金,5,好家伙，从中国动画电影的标杆快要干成中国科幻电影的标杆了，场面上比去年逆转未来小了一些，但是主题上相较于逆转未来的个人选择变得更宏大了，在遵循时间法则的定律下，选择了拯救未来的人类；末世废土+政治谎言+普世价值观+顶级精美的特效，完全是一部不输西方大工业水平的动画了！“你把所有人困在城里，都是为了自己的权力！”,2025-02-04 18:04:46,0
4457478482,熊出没·重启未来,2025,火娃,2,5/10。将视线聚焦在一个被孢子植物覆盖的色彩多姿的世界上，当熊强组合和小亮穿越到未来之后，看到了周围奇异美丽的植物，并在迷幻孢的沉醉作用下险些被吞噬，食人孢和石化孢之间美丽与邪恶的景观，暗示人们不要被事物的表象蒙蔽：释放出原始孢子的光头强并非毁灭世界的大魔王，真正的元凶是人类对地球无节制的污染，而被视作救世主的守望城城主正是人类贪婪的代表，他将小亮父亲毕业研究心血的净化体诬陷为有害物质，一遍遍在广播里称颂他的功绩，宁可把人类逼到灰暗的空中之城内苟活，也不愿自己的权威受损。最终光头强和小亮经历了不信与信的两次转变，提取出净化体拯救世界。但幼稚的环保主题和模式化的假英雄，不过是为了熊出没IP主题乐园+衍生品广告的叙事铺路，方特公园的游客画像与开头小女孩喝QQ星奶的硬广，都证明细节刻画上的功利。,2025-02-22 11:56:46,0
4444392699,熊出没·重启未来,2025,Parallax...,3,全球气温的变暖，原始孢子的解冻，废弃物品的丢弃，促成末日的不是魔王(光头强)，而是构成雪崩前的每一片雪花，每个个体。,2025-02-10 20:22:38,0
4438888281,熊出没·重启未来,2025,自由像海岸线,4,光头强也做太爷爷了,2025-02-06 11:43:39,1
4426845978,熊出没·重启未来,2025,贾府门前的石狮,5,感觉自己已经非常久没有看到这种笑点密集并且每个角色都很有个人特色的动画片了，熊大熊二永远是我的最爱,2025-01-29 12:53:58,0
4426759694,熊出没·重启未来,2025,lltzahd,5,熊强组合之间相爱相杀的设定猛戳我笑点，咱就是说这个组合也算是春节档常驻的搭档了hhh,2025-01-29 11:43:54,0
4427709266,熊出没·重启未来,2025,.zhu,5,国产动画做到这个程度，已经很好了，加一星鼓励。,2025-01-29 22:37:46,0
4428312264,熊出没·重启未来,2025,丌,2,熊出没本身就是非常粉丝向的电影，偏合家欢性质吧。不太清楚为什么一定要往这一些科幻之类的方向靠拢，或许是能够展现出视效上的技术力，让观众觉得值回票价。 但真心觉得，熊出没更多的出产好似变形计，雪岭雄风一类的作品，近几年与科幻向的都并不觉得能看进去，或许小孩更喜欢这种风格吧。,2025-01-30 11:16:40,4
4434724161,熊出没·重启未来,2025,Daibol,4,《熊出没》确实是春节档电影最扛打的电影。它绝对不会像哪吒这样非常火爆，但也绝对不会让观众们特别是儿童观众们失望。《熊出没》的制作公司一直在默默无闻地但非常保质保量地每年制作一部佳片给粉丝们，而这些粉丝们长大后会离开，当上父母后带着孩子又悄悄地回来，只要这个世界上仍然有自然的更替繁洐和成长，只要制作公司看好自己的制作团队，那我相信《熊出没》系列电影可以永存在春节档电影中。今年春节档电影就打算观看到这了，如果你只想看一场，那就是哪吒了。如果你还想看第二场，推荐《熊出没之重启未来》。其他的不值得花钱进影院了，看流媒体足矣。,2025-02-03 16:34:31,1
4428734935,熊出没·重启未来,2025,Lethe,1,更无语,2025-01-30 17:19:26,0
4521744213,熊出没·重启未来,2025,蜀黍酱,4,一部优秀的作品,2025-05-02 20:09:53,1
4427740918,熊出没·重启未来,2025,青岚,3,大年初一九点场，蛇年第一部。带孩子的和自己来看的基本对半。 第一次看这个IP感觉有各种曾经熟悉的电影和动画的影子，合在一起也不突兀，或者说，融合本土化的很好。 大体还是中规中矩，环保一套也说不上差，小而稳的赚钱的把戏。,2025-01-29 22:52:46,0
4427957109,熊出没·重启未来,2025,貓不,5,好看哇，有很多搞笑的部分，也有让人动容的情节，好好哭,2025-01-30 00:54:13,1
4450393117,熊出没·重启未来,2025,Byron,4,没想到影视工业化在2025会体现在熊来了身上，不需要太精彩的剧本不需要太深刻的内涵，仅仅靠着标准化流程的一力降十会，强行拉起视听效果也能拿到不错的成绩,2025-02-16 01:42:37,1
4521814412,熊出没·重启未来,2025,十九,3,欢迎来到熊出没科幻世界。还是蛮有想象力的，动画的场景和人物做得都很精细。突然穿插进来的搞笑情节，比如石化死亡和电梯里“臭屁”爆炸，能调动小孩的欢笑声，这才是春节档的意义。,2025-05-02 21:29:20,0
4559832339,熊出没·重启未来,2025,孤独的风,3,故事比较老套，陪孩子看看挺好的,2025-06-16 17:22:09,0
4354783487,熊出没·重启未来,2025,豆豆,2,已超预期,2025-02-01 14:44:22,0
4428641330,熊出没·重启未来,2025,柳穿风,4,剧情对于观影经验丰富的人来说可嫩略显老套，但是同时也做到了剧情完整成熟，有很多callback的细节，画面没什么好说的，很好看，稳定发挥的一作，值得一看。,2025-01-30 16:11:51,1
4428230983,熊出没·重启未来,2025,大大熙（已黑化,5,熊粉狂喜，末日科幻主题，带来了全新的观影体验,2025-01-30 09:57:36,1
4441433811,熊出没·重启未来,2025,閃光登,3,去年是借鉴的漫威复仇者联盟4，今年是借鉴的英雄联盟双城之战，看个标题逆转未来我还以为是借鉴x战警呢，谁知道纯粹是借鉴一个名字，没有人发现熊大熊二是熊真是bug了好多年，光头强也依旧是毫无魅力可言，每年都是套一个美国故事内核的喜洋洋式大电影，看到哪吒2的成功，我在想，如果真的深造白熊岭呢，就把东北挖掘极致了，是不是更有中国特色呢？,2025-02-08 12:29:09,0
4540112180,熊出没·重启未来,2025,作风,2,稳定发挥,2025-05-24 23:15:43,0
4474095794,熊出没·重启未来,2025,江郎,4,最后流浪地球式的众志成城居然也感天动地啊！,2025-03-09 12:04:52,1
4356726206,熊出没·重启未来,2025,麻瓜和厨子,4,小朋友看过了，来自他的评价。,2025-01-31 00:44:09,1
4426750994,熊出没·重启未来,2025,安和桥伴奏,5,每次攻击强哥都冲在前面，被扎得满脸毒刺也不放弃前进，又惨又搞笑，不愧是我强哥！,2025-01-29 11:36:41,0
4262551694,熊出没·重启未来,2025,bye~,0,大马猴息影了吗,2025-12-10 09:20:28,0
4428207868,熊出没·重启未来,2025,阿抗,3,熊出没系列中最具科幻色彩的一部！不过，缺点也很明显：两熊又成大配角了。。。总评：7.9分、3星半。,2025-01-30 09:34:00,0
4439443559,熊出没·重启未来,2025,鱼缸养玫瑰.,4,春节档最好看的一部。。,2025-02-06 20:08:25,1
4433005667,熊出没·重启未来,2025,shù,5,只希望一年比一年好,2025-02-02 13:35:32,1
4433262053,熊出没·重启未来,2025,call of abyss,3,一年一度春节档唯一必看影片，完全是因为安安。比起去年与前年，这部我看睡了一段时间，大约从ACT 2开始就觉无聊。电影很工整，标准的8段式，加一个环保主题（熊出没的永恒主题），但工整的很像chatGPT写出来的剧本。未来、灾难、英雄光环组队打败反派，但到底为何是孢子，反派的纠结是什么，都是强设定。「熊」系列剧场版有个套路，真正的核心人物都是一个新角色，光头强和二熊都是意外参与到主角的冒险行动中，这部的另一个大问题是故事置换为别的IP人物参与也能成立。影片还有个大问题是一众次要角色都是无脑NPC，一个“秘密”揭示就突然转变立场。高潮应该从「流浪地球1」而来，众人推动无法运转发射的关键性道具，这可抄倒也无可厚非，遗憾的是其实重点应该在宁愿放弃避难所，这才是燃、悲壮与决绝。全片最可爱的是迷幻孢和软体孢。,2025-02-02 16:58:24,0
4440438883,熊出没·重启未来,2025,水中茱萸,5,既然有不明id到处辱骂，那我闭眼打个五星吧，第一次看熊出没,2025-02-07 16:35:58,1
4429577151,熊出没·重启未来,2025,狂奔的蜗牛,4,孩子很喜欢，但是看完对比问他，还是更喜欢哪吒了,2025-01-31 02:37:53,1
4625008287,熊出没·重启未来,2025,微光,3,上一部看的同系列是狂野大陆 这个不如那个 建模也变丑了,2025-08-25 18:59:38,0
4439417512,熊出没·重启未来,2025,D伯爵,5,第11部，孩子14，我的年龄却是看不进去这个片子，也看不懂孩子,2025-02-06 19:48:17,2
4427648167,熊出没·重启未来,2025,郄玄亓,3,一般般,2025-01-29 22:08:15,0
4402146429,熊出没·重启未来,2025,疾风,3,熊出没的电影还是会一直看下去的，只是感觉最近的几部都有点类似，结构太相似了，很多转折点都能预判到，完全没有惊喜，环保这个主题不算新，但也不会厌烦。不知道是我长大了，看过太多更优秀的作品，还是说熊出没的电影就是没电视好看，我记得当年在电视上看熊出没还是很喜欢的，觉得很好玩很搞笑。 本来是觉得看完这部的话我今年就可以直接去影院看最新的一部了，但如果同样是这个质量的话，我会有点犹豫是否值得花这个钱，看时间情况吧，有时间的话就再考虑一下。6.5分。,2026-03-11 14:50:52,0
4379399378,熊出没·重启未来,2025,Joe,3,熊出没之泰兰尼斯稳稳鞋大电影…… 上一部特别现实，这一部超级玄幻，物理学已经不存在了…… 都不确定会不会去看下一部了…… 最喜欢的还是伴我熊芯那部。,2025-01-31 14:08:40,0
4435466918,熊出没·重启未来,2025,鱼塘带盐人,3,三星半，缺点是太套路化了，笑点也不是特别多，其他挺好的。不想看隔壁烂片，看了这个发现确实还可以。,2025-02-03 23:22:37,0
4411549167,熊出没·重启未来,2025,围炉影话,3,小亮竟然是光头强的后代？！,2025-02-13 09:34:51,0
4436664139,熊出没·重启未来,2025,ROXO,3,带弟弟来看，2.5⭐️没什么好说的，有退步。,2025-02-04 19:49:26,0
4457892984,熊出没·重启未来,2025,牧,4,如果不是有小孩，我可能永远也不会看这个系列，但正是陪小孩去电影院，我才见识了网友说的“熊出没系列是合格电影检验机”，真的是，他每一部都能合格，比他口碑好的，就是好电影，比他口碑差的，就是烂片，真的准！,2025-02-22 18:32:24,0
4583865636,熊出没·重启未来,2025,苏雨烟堂,4,有多少人是带着孩子去看孩子觉得好看但是最后按照自己喜好打低分的。。看到一个热评“旁边的小朋友看得很开心啊”然后反手打了个三星。有的大人心理指定有点毛病,2025-07-13 23:13:26,0
4406162555,熊出没·重启未来,2025,非帅的杂货铺,4,这次是环保主题，有两个反派角色有点像宠物小精灵里的火箭队。不过小朋说很喜欢。,2025-01-31 18:43:07,1
4437647515,熊出没·重启未来,2025,muqimm,5,给唐探七八分的小朋友说给这片九分,2025-02-05 13:38:56,1
4460566284,熊出没·重启未来,2025,天早清微凉,4,第一部影院看的熊出没，还不错,2025-02-24 20:46:34,2
4427122199,熊出没·重启未来,2025,Wrath,3,陪侄儿去看的，动画特效水平中国的其实还不错，声效也挺到位，对于这类商业幼儿电影而言剧情什么的甚至还有点超纲，就是3D特效差点意思，可能是担心小朋友扛不住,2025-01-29 16:46:31,1
4432925269,熊出没·重启未来,2025,鱼🐟,4,都不如伴我熊芯,2025-02-02 12:24:31,0
4426847274,熊出没·重启未来,2025,逆天少帅,5,习惯了逃避现实向现实妥协，这种自我叩问其实真挺触动人心的，也更加能够引起人们的共鸣，光头强这个角色也是矛盾感很足的角色,2025-01-29 12:55:03,1
4484808096,熊出没·重启未来,2025,大金牙呀！,3,末世奇观设计不错，五彩斑斓却处处藏毒。但是光头强的后代竟然头发如此茂密，这是污染导致的人类基因突变吗？,2025-03-19 23:41:14,0
4427341391,熊出没·重启未来,2025,conwei,4,熊出没的电影倒是越来越能看了,2025-01-29 19:14:10,0
4583228238,熊出没·重启未来,2025,小木,3,抄的不错 要是我没有看过《变形金刚起源》，我就打五星了,2025-07-13 11:47:57,0
4509101300,熊出没·重启未来,2025,觉渺,0,幼儿向,2025-04-17 11:12:05,0
4520937302,熊出没·重启未来,2025,易无安,3,熊出没系列再这么拍下去就没必要了。,2025-05-01 21:21:01,0
4431786892,熊出没·重启未来,2025,Mr. Wrong,4,我是觉得现场买不到票的电影，是很夸张的，不可否认品质在线。,2025-02-01 17:55:27,1
4428933519,熊出没·重启未来,2025,🤫,3,第一次看熊出没，居然引入了废土世界的设定，我不知道小朋友什么看法，反正我被震撼了，因为我没有想过用儿童动画展现废土世界，还引入保护环境的主题，这点值一颗星。整体及格，个别设定逻辑不行，但是这是儿童动画，应该宽容一点。现场能感觉各个年龄层的笑点都顾及到了，且穿插自然。居然有点期待明年的熊出没了。,2025-01-30 19:42:05,0
4430068374,熊出没·重启未来,2025,邏輯子,4,合格的贺岁档儿童电影，电影院好多小小孩还伸长手抓孢子,2025-01-31 15:30:14,14
4440317780,熊出没·重启未来,2025,夏之瑶光,3,带五岁女儿来看，她很喜欢，还看哭了，大概对灾难片比较容易共情,2025-02-07 14:38:26,0
4546597730,熊出没·重启未来,2025,momo,0,反派好像周受资,2025-06-01 17:52:35,0
4427648501,熊出没·重启未来,2025,撒哈拉啊,2,2025年第二部。剧情比上一部差不少。而且，配乐真的不是抄袭蝙蝠侠的吗,2025-01-29 22:08:25,1
4428795837,熊出没·重启未来,2025,汽车人-变形,4,儿子每年必看的年货电影～光头强有重孙子啦，但是老婆是谁未知,2025-01-30 18:02:10,1
4466124284,熊出没·重启未来,2025,Eric 小周周,3,2025年春节档最佳影片，凭着对类型元素的严谨套用与对剧作结构的全面贯彻，以及兼顾了儿童与成年观众的双主题，吊打了同档期的其余影片。而更为突出的是，该部《熊出没》剧场版在分镜调度上也十分成熟，视觉奇观具备一定想象力，已达到了能甩饺子的《哪吒2》不止一条街的水准。,2025-03-02 00:42:13,0
4449049412,熊出没·重启未来,2025,苏白,2,每年都陪孩子看，每年都挺失望的。里面的二人组真的没有模仿火箭队的武藏和小次郎吗？,2025-02-15 00:37:32,2
4429763100,熊出没·重启未来,2025,逆天丸子,3,中规中矩，还可以,2025-01-31 10:49:26,0
4539607550,熊出没·重启未来,2025,袭人,3,【3-】2025.05.24｜48.297.1772,2025-05-24 14:39:17,0
4434081180,熊出没·重启未来,2025,执笔戏流年,3,动画制作者是不是去过云南吃过蘑菇看见小精灵才有的这个动画的创意啊。未来世界是蘑菇世界还挺有创意,2025-02-05 19:16:33,0
4429801724,熊出没·重启未来,2025,"17,17,17",4,小孩哥平一己之力，拯救世界！完全可以没有光头强和熊大熊二主角光环哈哈哈哈哈哈～ 但是！赛博朋克的未来世界真的好好看啊！六一再次感动落泪！即使再微弱的光，也能照亮黑暗！,2025-01-31 11:31:26,1
4434594176,熊出没·重启未来,2025,李杨白梦,4,《流浪地球》启蒙版,2025-02-03 14:36:18,1
