评论ID,电影名称,上映年份,用户昵称,用户评分,评论内容,评论时间,点赞数
4427217980,熊出没·重启未来,2025,私享史,3,为了陪小侄女第一次看《熊出没》，竟然超出预期。从形式到内容都是模仿拼贴的产物，形式是阿凡达式视觉奇观加空战大片式视效奇观，内容是指环王的护戒之旅加星战的赛博朋克，故事糅合得还挺好，小朋友看肯定超级震撼，但作为电影确实是缺乏原创性。另外，偶尔插入的乡土笑料还挺违和且独特的，大概是主创吃准了三四线城市观众口味。【仙桃金逸】,2025-01-29 17:53:10,435
4428048259,熊出没·重启未来,2025,陆小鸟,3,旁边的小朋友真的很开心啊,2025-01-30 02:13:39,84
4426733162,熊出没·重启未来,2025,少年赵里昂,4,我嘞个豆，居然是《未来水世界》和《疯狂的麦克斯》那种科幻世界观+废土朋克美学。对于那些说“《熊出没》就是低龄三维动画”的人们来说，我只想说你们该开开眼界了。当然《熊出没》系列一贯的主题——带着希望和勇气、敢于探索和冒险、保持纯真和善良，一直贯穿始终，这一部甚至打了一手讽刺牌，很好，请继续！,2025-01-29 11:09:30,87
4426909228,熊出没·重启未来,2025,麒麟先聲,5,春节档唯一真神！,2025-01-29 13:51:43,695
4428703861,熊出没·重启未来,2025,空知英秋,3,陪小孩看的，挺难熬,2025-01-30 16:58:19,85
4431333350,熊出没·重启未来,2025,安托万的黑眼睛,3,闺女看的津津有味，我旁边睡的很香。,2025-02-01 11:47:42,41
4426737726,熊出没·重启未来,2025,叶酱,4,惊喜非常多，从世界观到特效，走到第11部的《熊出没》早已不是低幼动画，早已用迪士尼冒险动画的要求来严格呈现。诸如前两年靠着世界观和科幻场面出圈的《逆转时空》和《重返地球》，每一部都是一部独立且成熟的科幻动画。真的，如果再用当年的目光来看《熊出没》电影，那真的是会错怪这个越做越好的国产动画系列。,2025-01-29 11:19:14,68
4420923939,熊出没·重启未来,2025,酱桑,4,春节档最合家欢的电影。熊熊可爱是其次的，比上一部进步最明显的，是视效的提升和世界观格局的拓宽。机甲，赛博朋克和人类危机和未来文明的探索真正有在用心突破以少年为界限的动画片格局的且存在寓教于乐的作用的。清晰地见证到一个笨拙可爱的系列的完整和成长为精美且富有想象力的作品。可爱，人畜无害的电影。,2025-01-29 12:52:11,57
4427014577,熊出没·重启未来,2025,HarperDie,3,在好莱坞的创作法则里，长系列IP一定会有一个核心母题，或为家庭、或为亲情、或为寻获自由的勇气，而《熊出没》作为一个寓教于乐为主的动画系列，坚持探讨环保的重要性不失为一个很好的选择，或许对于成人来说看似微不足道，但从影院离场时小朋友主动学会带走垃圾这点来看，意义远比想象深远。,2025-01-29 15:25:09,21
4437755358,熊出没·重启未来,2025,M2,3,一部及格的贺岁动画大电影，和日本那些每年一部例行公事的剧场版动画没有什么区别，要说有什么新意应该是软科幻的题材和熊出没的世界里前所未见的动作大场面。看了开头就能猜到结尾，没有任何一个包袱能让我这种成年人笑出来，高燃片段球1既视感，开头QQ星的植入过于显眼。光头强的后代小亮全名是光亮，所以原来光头强姓光。,2025-02-05 15:10:11,10
4257020527,熊出没·重启未来,2025,豆友os6I4aKojw,5,干脆改名叫X战警逆转未来吧,2025-01-30 17:24:46,221
4256840365,熊出没·重启未来,2025,老moss,5,虽然我是熊出没的老粉了，但能不能出一些别的题材的电影，老是科幻都审美疲劳了，不知道的还以为你们编不下去了！,2025-06-01 12:20:32,9
4450255611,熊出没·重启未来,2025,三岛,3,20250207 avec.Kyle 熊出没近两年有着最为完全的工业流水线式的稳定出品，且似乎总是根植有已有的原型故事，不论是去年大IP乱斗的妇联，还是本片有着完全混杂的《兔年顶呱呱》+《变形金刚：起源》+......而作为系列电影，引入的新角色在与老角色完成亲缘关系的暴露之后，作为儿童的观众通常会较为容易的接受。春节档的动画电影在动作设计和运镜上是明显优于真人电影的，本片的该一部分主要由新角色承担，熊作为配角成为捧哏，履行着可爱和搞笑的职责，只是作为《雪岭熊风》的忠粉，这样越来越不重视动物角色的举措不知能否有效地捕获长大了的老观众继续观看的愿望。,2025-02-15 23:54:44,3
4428870472,熊出没·重启未来,2025,用户6621488957,5,超级好看！不愧是陪伴童年的动画，最后的群像特别燃特别感动，我们国产动画真的很厉害，隔壁某流量的粉丝都滚远点，恶意打一星的全部反弹到你正主身上，别祸害真正的好电影,2025-01-30 18:57:30,20
4429733153,熊出没·重启未来,2025,朝阳区妻夫木聪,0,第一次在大银幕看熊出没系列，观感确实要好很多，技术上已然十分成熟，有笑有燃，情节流畅。这部主题聚焦环保，科幻废土风格+时空穿越设定，同场大人小孩都看得乐呵呵的，真正做到了全年龄层都拿捏住。不得不服，熊出没每年十几亿的票房不是没原因的。,2025-01-31 10:15:52,17
4429803926,熊出没·重启未来,2025,格格,4,动画版流浪地球！守望城有点地下城的感觉，最后大家一起手动推光能炮也跟流浪地球一模一样。熊出没每年都很稳定发挥，可惜今年遇到哪吒闹海，观影群重叠，票房被吸走了不少，就好像是90分的优等生学霸，遇到了连附加题都满分的110分学神！,2025-01-31 11:42:06,30
4426732775,熊出没·重启未来,2025,宋雯婷,4,太喜欢了。其实一直都很想看这个系列，但是总担心太幼稚犹犹豫豫的，这次认认真真看了，果然真的很能看得进去也。该欢笑的地方和该思考的地方，节奏全都拿捏得死死的，甚至一度让我想起小时候一个人在家看动画片的感觉，也许你能猜到结果，但是你还是目不转睛地跟着那几个动画主角度过了这段时间。因为他们不是商品，他们是我的朋友。,2025-01-29 11:08:38,36
4526165318,熊出没·重启未来,2025,本味何知,3,看来《逆转时空》强烈的现实主义色彩只是一个意外。《重启未来》从环保角度看，对环境问题的揭示不够深入，从反乌托邦角度看，守望城城主为野心而野心，凶残度和逼格都不够，如果那番人类发展问题的自我辩护展开做做文章的话能好不少。,2025-05-07 22:40:08,3
4427080008,熊出没·重启未来,2025,李小丢,4,熊出没系列电影已经渐渐变得和春晚一样，成为了人们心中的电子年夜饭。系列电影票房坚挺且持续走高的态势也是有道理的，它绝非仅限于“子供向”的动画电影，而在制作、视效、故事等软硬件方面都做到了全年龄向的行业高水平。具体到《重启未来》这一部，五彩斑斓危机四伏的孢子丛林、赛博重工的未来都市构建的末日世界观让人眼前一亮，对小朋友来说，片中幻想的高科技产物、贯穿始终的环保主题都能唤起他们心中那颗小小名为希望的种子。对大朋友来说，自觉软弱、世故的光头强何尝不是我们这些成年人的自况？“自己有没有勇气可以再勇敢一次？”这是光头强问自己的问题，也是我们问自己的问题。,2025-01-29 16:16:41,5
4629271462,熊出没·重启未来,2025,壹安²,3,当看《熊出没》变成了看国产动画星球大战…总是恍惚间能看到某些经典科幻片的影子…甚至还有翻版火箭队…好吧，有句千古老话说得妙，小朋友们你们开心那就好！,2025-08-30 20:42:07,2
4426754805,熊出没·重启未来,2025,女神的秋裤,4,世界观很完整，地王孢很有隐喻性，很明显有一部分剧情是给大人能看明白的。小孩子只要记住有理想的光头强，有勇气的熊大熊二，有坚持的小亮，还有善良的守望城城民们就好。,2025-01-29 11:40:08,20
4429808209,熊出没·重启未来,2025,希区柯克小迷妹,4,不错 特效效果很棒 娃看得开心 抄袭痕迹不明显哈哈哈,2025-01-31 11:37:50,11
4575053840,熊出没·重启未来,2025,琧婯,3,你永远可以相信熊出没：那就是比熊出没差的都是没眼看的，但比熊出没好的其实可能也没多少。。。起码孩子看着觉得可乐就行,2025-07-04 19:05:13,1
4427020910,熊出没·重启未来,2025,利奥波德·菲兹,4,兄嘚，真要给我搞破防了。没想到《熊出没》进一步全年龄段化，视觉上呈现的末日未来景象已经完全脱离儿童科幻的范畴，从废土到未来，从危机到希望，这哪是跟你讲环保？这是跟所有“大孩子们”讲人生，影院内的你我，你是身边孩子的未来，孩子是你的曾经，我们常常为过去懊悔，为未来焦虑，却忽略了唯一能把握的现在。时间不会倒流，也无法预支，当下的每一秒都是不可重复的珍贵。“重启未来”重启的是我们大人。,2025-01-29 15:30:08,15
4428911398,熊出没·重启未来,2025,Do,5,谁会拒绝过年时看一场熊出没呢，每一次都是不一样的惊喜，这次主要讲述人类要保护环境，污染环境就是毁灭世界，还好小亮和光头强他们阻止了悲剧的发生，当然也少不了熊大熊二，祝票房大卖 春节就看熊出没 全家一起更欢乐,2025-01-30 19:26:31,13
4692028965,熊出没·重启未来,2025,等一个人,3,照比去年的逆转时空差，剧情推进太老套了，不能自圆其说的地方也很多,2025-11-16 21:15:21,1
4433116931,熊出没·重启未来,2025,叶籽猫,2,陪四岁小朋友看的第一部电影，虽然感觉她没有很看懂，但是问了我一个非常振聋发聩的问题，为什么电影里面都没有女孩子的？国产低幼动画片，也是任重道远啊,2025-02-02 15:09:57,133
4428873651,熊出没·重启未来,2025,小野猫,5,熊出没充满着童年回忆，又搞笑又感动😜，在污染环境面前，做到人人环保，每个人家园才不会被破坏✓，也是一部值得教育素材，在困难面前，团结友爱与战胜自我，画面很精彩,2025-01-30 18:59:46,8
4434281836,熊出没·重启未来,2025,華斯比,4,大型环保宣传片。原来光头强真的姓光😂😂😂曾孙子光亮比他帅多了。,2025-02-04 10:06:28,23
4428921320,熊出没·重启未来,2025,木点,5,电影讲述光头强、熊大和熊二联合小亮去到100年后的未来世界处理孢子危机的故事。 故事的完成度想当高，没有逻辑漏洞，画面将未来世界展现出满满的科技感，特效、场景看出来是很用心的，加上动感的音乐旋律贯穿，让人我忍不住跟着节奏摇摆。 以保护环境为主题，很有教育意义，非常适合一家大小观看，相当值得一看的电影。,2025-01-30 19:33:38,10
4529449338,熊出没·重启未来,2025,醉梦·聊生,3,总能借穿越让该系列有更宽广的题材涉猎，诸多高票房电影的影子时隐时现，光能炮坏了众人一起推，像是志愿军里众人开水闸，诸多科幻场景恍如小破球，小亮大吼哪怕丢掉小命也决不放弃，活脱脱又一个哪吒，在宣扬两山论方面做得十分到位。,2025-05-11 21:15:09,1
4431843039,熊出没·重启未来,2025,UglY_MoNey,3,融梗很成功,2025-02-01 18:35:57,13
4547384606,熊出没·重启未来,2025,对称的福尔摩斯,3,足够正能量，足够热血，足够完整，逻辑成立，熊出没的电影确实看点十足，光头强越来越帅，熊大熊二也不像最初印象中那么讨厌，方特还是有两把刷子的。,2025-06-02 13:42:21,0
4427288825,熊出没·重启未来,2025,taming,3,一年一部电影院熊出没，孢子危机，年初二,2025-01-30 13:43:58,6
4437858621,熊出没·重启未来,2025,落木Lin,3,《熊出没》走过一轮生肖，从脚踏实地的温情故事到华而不实的科幻鸿篇，叙事程序已然成型，工业特效水准一流，想象创意大开眼界，被誉为“名作之壁”。 但科幻系列走到第五部难免审美疲劳，特效量远不如同期《哪吒2》，也比不上《逆转时空》，给予观众的视觉冲击还差些意思，但放诸国漫已是一人之下。 而核心问题在于主题老套、情感缺乏，环保命题新意大失，剧情主要靠光头强耍宝推进，略显生硬（不过做得比喜羊羊同题材《守护》好多了），聚焦亲情但没有现实扎根，暖心发言难起催泪之效。 而且今年的剧情更加简单，单线闯关式叙事虽直接易懂，但平平无奇，有点像为了五部曲强凑，完全循着套路运行，一眼望到尾。 不知明年跳出科幻执念后会带来什么样的故事，期待能回归到《雪岭熊风》的水平。 所以光头强将会有妻子了？,2025-02-05 16:37:17,3
4521648701,熊出没·重启未来,2025,驹光过隙,4,这几年的《熊出没》电影都是科幻加拯救世界的故事，今年的又结合了环保的主题，制作水准还是挺高的，视觉特效也做得很棒，有意义又有水准，部分情节难免有些俗套，不过制作上还是挺用心的,2025-05-02 18:00:33,3
4428799822,熊出没·重启未来,2025,戴圣诞帽的楼主,3,可能我不喜欢科幻题材，看得很瞌睡，小孩子看得蛮开心的。,2025-01-30 18:05:11,5
4427056749,熊出没·重启未来,2025,齐小谁,1,公益广告套个壳子，没想法就别再拍啦，年年圈小朋友…,2025-01-29 15:59:18,113
4427003899,熊出没·重启未来,2025,kakakarl,4,感觉熊的毛皮变得更加毛茸茸了，又是一年科幻故事，末日废土，孢子世界想象力丰富。 现在《熊出没》不光要成为国漫剧场版的翘楚，也要成为国产科幻的翘楚了……,2025-02-18 19:37:44,5
4427129766,熊出没·重启未来,2025,江南开爷,3,史上最强春节档，我看的第一部电影竟然是这个(陪孩子)。影院一半是孩子，一半是带孩子的家长，孩子很喜欢，从开心大笑到默默流泪，但个人感觉一般，中间我甚至睡着了，不过当做孩子环保教育片还是不错的。,2025-01-29 16:51:56,15
4428992600,熊出没·重启未来,2025,大海里的针,4,光头强？光头·刘培强！现在的小孩儿观众已经吃这么好了吗？熊出没果然不是低幼动画的范畴了，末世科幻大电影，感觉比一些大片燃多了。,2025-01-30 20:20:58,14
4449661982,熊出没·重启未来,2025,hsihsia,3,1、一个孤胆英雄，手持“金箍棒”，光一般的速度，穿越时空，拯救世界。这是独属于我们的浪漫！ 2、电影拼拼凑凑的，太多隐喻了，也看到了不少模仿或者说相似。当然这也是动画电影最大的便利，可以天马行空，为所欲为想象。 3、虽然对孩子们来说，熊出没总是可以期待的，但是，创作的范围只怕是越来越窄了，对一样陪伴着一路走来的家长们来说，不免审美疲劳。,2025-02-15 16:53:10,3
4498970405,熊出没·重启未来,2025,夏日梧叶,3,只能是动画片：不管是人，还是熊，不管是成人，还是小孩，故事需要啥技能，主角团就会啥技能，且主角光环强大，怎么都打不死。还得是动画片，才能轻松体会到个人英雄主义的浪漫与伟大，才能确信邪不胜正。 人力调整炮弹角度那块我挺感动的。 孩子看自然很欢喜，当然他啥都喜欢。只有看《帕丁顿熊3》的时候，他中途上厕所，问我：妈妈，你为啥要带我看这个电影？即使如此，我问他是否不喜欢，他仍说喜欢~,2025-04-05 15:58:38,1
4426903207,熊出没·重启未来,2025,龙叔,4,每年看《熊出没》，就跟看春晚一样，成了固定的节目。作为《熊出没》科幻五部曲的终章，这一部的动画制作技术升级了，质感也比之前的又进步很多了，肉眼可见的特效和大场面也更多。画面精致得就像壁纸，变异植物，巨型地王孢和各种食人花草，以及高耸入云的大厦，赛博都市等未来世界的科幻场景做得很有想象力。剧情方面也很有趣，冒险+科幻+赛博朋克，已经不局限于儿童片，其实男女老少都很适宜。,2025-01-29 13:46:16,6
4428965621,熊出没·重启未来,2025,mumudancing,4,每年和孩子一起看的《熊出没》早已经出息了！默默做到第11部，用越来越稳定的「科幻+温情」锁定叙事风格。要冒险有冒险，要价值有价值，今年讲到人类命运共同体了……这格局和视野，国产动画IP做大做强！,2025-01-30 20:03:20,8
4432909550,熊出没·重启未来,2025,朝觐电影,3,6.5/10 “麻烦家伙”型叙事嵌套的“金羊毛”型人物成长，人物一路上对解决麻烦的追寻便也是相互间增进理解，最终达成共识的过程。影片再一次将科幻元素嫁接到以亲情和友情为支撑的冒险故事中，不仅使叙事完成闭环，更在不经意间建构起另一套时空循环的链条。此外，在叙事的展开中不断向观众输出环保观念，在对观众进行环保教育的同时，使主题呼之欲出。相比同档期的《哪吒之魔童闹海》，《熊出没·重启未来》的煽情方式无疑是成功的，即在常规内游走，用传统的方式打动人心的一套煽情策略,2025-02-02 12:10:04,2
4433038500,熊出没·重启未来,2025,卫有疾,3,《天空之城》《铳梦》雪乡重制版,2025-02-02 14:04:43,0
4426760799,熊出没·重启未来,2025,四零,4,没想到二十七八岁快奔三的年纪会如此入神享受地看《熊出没》。这个IP系列电影虽然都是动画，但是在情节设计和创作真诚度强过许多粗制滥造的国产电影——要不人家怎么能从不被人看好的0一路走到今天已然11年，收获大小朋友认可。说回《熊出没·重启未来》，首先是很OK的一部动画喜剧，熊大熊二光头强穿越到未来后“蘑菇大冒险”的搞笑桥段在动画萌趣加持下真的让人开怀大笑，其次科幻元素虽然没有真人电影那么高深沉郁但也还是蛮有看头的。最后，《熊出没》也看得我动情到泪目了。当真以为光头强要没的时候，鼻酸眼热接受不了！看到他最终还是回来被熊大熊二压在身下长舒一口气。ps我也很好奇光头强最终结婚的老婆是什么样的！,2025-01-29 11:44:41,13
4419963715,熊出没·重启未来,2025,南宫非攻,4,春节档第一部买票观影的片子，本来是为了陪小朋友阖家欢的，没想到还真有惊喜。什么时候熊出没都能走末日主题了，设定以及逻辑自洽还都很合理，保障了剧情的同时节奏还拉得比较紧凑，有燃点有泪点，简直就是给25年科幻开了个好头。这我还有什么可多说的，高分给起。,2025-01-31 12:25:54,5
4431104382,熊出没·重启未来,2025,晒螃蟹的太阳,5,额，熊出没比封神榜2好看，哈哈哈,2025-02-01 03:19:14,25
4521740657,熊出没·重启未来,2025,Q.Henry,3,国产超英动画,2025-05-02 20:05:13,1
4524635190,熊出没·重启未来,2025,小傻瓜De萍萍,5,熊出没科幻主题找到了更富有新意和深意的表达方式，相互理解与共同成长，传递积极面对生活、勇敢探索未知、创造美好未来的勇气与力量，重拾重启未来的勇气，以极致浪漫的科幻终章之作人愈发期待影片剧情， 能够满怀信心地重新整装出发，共同携手迈向充满无限可能的未来。,2025-05-05 22:55:57,3
4442227767,熊出没·重启未来,2025,玩儿少,3,末世版本熊出没，还是幼稚了点，加上老套的环保主题，这部确实看不太进去,2025-02-08 23:36:35,3
4427590281,熊出没·重启未来,2025,苗安,3,虽然剧情几乎没有亮点，但整体观看性还不错，特效也肉眼可见地一年年更加精致,2025-01-29 21:38:59,10
4783070622,熊出没·重启未来,2025,CQB241,5,with BB。去年和今年的熊出没大电影就在家里看吧。挺好，只要BB在一起哪里看都一样开心(=´ω`=),2026-02-28 23:55:21,0
4436545098,熊出没·重启未来,2025,26号放映机,3,《熊出没》科幻系列里比较无趣的一部，但制作水准是有提升的。,2025-02-04 18:28:23,1
4448610576,熊出没·重启未来,2025,今生、唯爱,3,原来是爱护环境教育片呀！ 小亮怎么这么宽以待己，严以律人呢？ 咋一有事发生就都怪了光头强先。,2025-02-14 18:35:19,1
4427186092,熊出没·重启未来,2025,李逵艾,4,这部为观众搭建了一个全新的未来世界，孢子丛林的画风完全像童话般绚丽多彩，色彩运用大胆，炫目又充满着危险。与之相对的是破败的，苟延残喘的守望城，给人很强的视觉冲击的同时，也沉浸地体验了一次“熊式”浪漫科幻。末日主题之下特效依旧发挥稳定，有大场面的震撼也有细节的真实，肉眼可见的成熟，像机甲废土这些赛博朋克元素真的是很大胆的尝试，去除掉了观众对整个系列的固有印象，其实更适合各年龄段的合家欢了。拿着棍子来拯救世界的小英雄让人熟悉又安心，那种孤注一掷的勇气和绝不放弃的执着，让身为成年人的我感动并且羡慕。反派也不再是毫无理由的坏，反而能看到人性的自私和贪婪。,2025-01-29 17:31:31,7
4503690702,熊出没·重启未来,2025,UIDouban,3,应该是我所有在电影院里看的熊出没电影里最难看的一部…… 值得说的优点可能只有二维动画和用了速度线的一些地方，还有就是小亮把光头强旋转起来挡软化孢子那段比较好。还有就是用了几首外语歌用得还行。 有些可以算屎尿屁下三路的元素以后如果不改，片方迟早要向广大反感这种元素的观众谢罪…… 这次的“抄袭”都用得不算太好，而且怎么还抄到《流浪地球》上了？ 感觉我得系统地看一遍所有电影版，听说年货电影是两个班子每年轮换制作，不知道编剧是不是也是这样，不知道单数年和双数年会不会有什么明显的区别。,2025-04-11 00:15:31,0
4439182043,熊出没·重启未来,2025,烎烎🕉,3,观影后从洗手间出来，一妈妈问小朋友：“《哪吒之魔童闹海》好看还是《熊出没·重启未来》好看？”小朋友说：“都好看。”,2025-02-06 16:23:12,3
4568289655,熊出没·重启未来,2025,🤲🏻,3,和孩子一起在电影院看的第一部电影,2025-06-26 19:04:20,0
4437690421,熊出没·重启未来,2025,追风的人,3,末日下的乌托邦，中规中矩吧,2025-02-05 14:16:01,0
4427534014,熊出没·重启未来,2025,叶笙花,1,非受众，看得很无语…,2025-01-29 21:09:09,74
4347428030,熊出没·重启未来,2025,寻光,4,熊出没的剧情从第十部开始也是逐渐好起来了，这次的主题是环保给未来带来的危害，熊强组合和小亮拯救世界，冒险中有笑料也有精彩的追逐战。 错的并不是孢子本身，而是人类自己。当世界陷入绝境时，众人推起光能炮令人震撼和感动，城主为了权力干出了令守望城慢性死亡毁灭全人类的事情，完全不是人。 净化体可以净化孢子，但无法净化人类的野心。再微弱的光，也能照亮黑暗。小亮的全名是光亮，很符合这句话。 没想到五部科幻里，好看的反而是最后两部。也算是吸取前三部剧情的模仿、套路和结尾都很草率。期待明年会带来怎样的现实题材。 未来，世界到底会变成什么样，取决于我们自己的选择。故事的结尾，把这段话说给了所有观众听，如果人人都爱护环境，世界会变得更加美好。,2025-05-02 01:35:26,3
4427014114,熊出没·重启未来,2025,居无间,4,世界观做得挺扎实的，对末日世界的外部景观以及守望城的未来都市世界都有细致的描绘，动作场面也是根据孢子生物的设定衍生而来，有想象力也有惊险感。在主题上，故事关于环保，也关于希望，结合当下的环境，这样的内核很提气。,2025-01-29 15:24:44,13
4431840566,熊出没·重启未来,2025,基努里维斯基,4,情节发展基本可以预料，但完整度非常高，制作精良，值得很多片方学习。,2025-02-01 18:34:11,18
4320947430,熊出没·重启未来,2025,pearrock,4,也是隐喻两国价值观之间的博弈，孢子的形状就是1945年爆炸后蘑1菇1云的形状，还有日汗核1污1水入海，大的方面是环保主题，作为喜剧标签电影，在春节档有欢笑就值得四颗，只是表达的很明显，但也有一定的内容，科幻方面相较于近几年的熊出没电影系列还是有一定的新意，整体来说还是挺有意思的,2025-02-14 22:36:50,3
4427302091,熊出没·重启未来,2025,国王KING,4,一年一部的《熊出没》年货已然撑起了国产科幻动画的市场，那些在剧集得不到展现的极致脑洞，现在都以精致的故事包装推出，让人有意料之外的惊喜。世界观的设计也很出彩，未来世界的奇观视觉效果展现了奇特的生物共生特性。在场很多小朋友和父母，作为一部大年初一档的合家欢电影是很标准了。,2025-01-29 18:49:02,9
