评论ID,电影名称,上映年份,用户昵称,用户评分,评论内容,评论时间,点赞数
4432094551,熊出没·重启未来,2025,残花,3,末日景象，穿越时空并非重点，经典反派模型，欺骗的统治者，人类自己毁灭了世界，战争、贪婪、掠夺、污染。那段奔跑中救人安排的很生硬，马上就猜到后面会来帮助主角。手环掉落现场直播boss的真实嘴脸也是较为常用桥段。,2025-02-01 21:11:04,1
4483663267,熊出没·重启未来,2025,人间烟火,2,再也回不到雪岭熊风了么,2025-03-18 19:40:13,0
4434561281,熊出没·重启未来,2025,山月随人归,2,给学龄前外甥看可能刚刚好，环保教育也还算善莫大焉，但对我来说还是太折磨了。设定各种缝合，煽情桥段泛滥，时空穿越的逻辑硬伤又太大，让人怀疑这样一个人送贺岁档质检员美名的年货系列是何等沉迷舒适圈，坐享自己的基本盘而不思进取。,2025-02-03 14:04:37,5
4430106411,熊出没·重启未来,2025,淼儿Angela,5,远超预期 我小时候熊出没刚出来的时候觉得是劣质3d动画 画面和故事情节都不行 没想到这几年进步很大 电视上演的熊熊帮帮团也挺可爱的,2025-01-31 16:01:13,2
4431768503,熊出没·重启未来,2025,可惜我找不到自,3,虽然一眼看出“借鉴”一些电影，但是它真赚钱也稳定 只要不瞎搞都能买钱。 制作还行，剧情嘛！一般,2025-05-08 01:44:58,0
4426784931,熊出没·重启未来,2025,Sunny,5,声音萌萌哒，做起事情来有点笨笨哒，熊二炒鸡无敌巨可爱，我可太喜欢咯,2025-01-29 12:03:19,2
4441605020,熊出没·重启未来,2025,丰Feng啊,1,呃….【路演】「CM2025-5」,2025-02-08 15:26:30,0
4427437542,熊出没·重启未来,2025,张咏轩Wayne®,4,一部真正好的中国动画IP 在面对大众输出中国底蕴色彩中的天下大同，巧妙融合进保护环境与热爱大自然的理念，以一种轻喜剧的方式将此根植于大朋友和小朋友们的内心，这次探讨环境保护与穿越时空题材，涉及环境污染产生的病毒对世界的影响，地王孢与毁灭孢，进化体与光能炮的互制互能，场面高能燃爆，设定新奇澎湃，冒险天马行空，对未来世界的具象描写与细节的处理都看得出创作团队的用心，主题融合环保元素与众志成城的合作精神，新加入的角色小亮个性鲜明，对父亲对于环境保护的遗志铭记在心，与光头强熊大熊二抱团合作，为了彼此心中的信念勇往直前，从个人英雄主义到集体主义的升华的确动人，用充满坎坷崎岖的抗争精神完成对自我与世界定义的重塑，有欢笑有泪水有成长，不愧是春节档的常青树，每一年都会带来新的能量和对这个世界不一样的思考！,2025-01-29 20:13:36,9
4428386513,熊出没·重启未来,2025,Chin,5,比哪吒 2 还好看！,2025-01-30 22:10:20,3
4426685248,熊出没·重启未来,2025,突然粉碎,2,环保主题是好的，广告植入太土了，光头强在变强之前先当了圣父,2025-01-30 15:02:16,12
4520491956,熊出没·重启未来,2025,神君圣皇,3,这部电影和《阿凡达》《天空之城》《铳梦》……等动漫太像了,2025-05-01 12:01:35,0
4436520551,熊出没·重启未来,2025,xie黄堡,3,【7】视效质量好高，剧情我不好说，但是同场那些小朋友都看得很高兴的样子,2025-02-04 18:10:04,0
4607444236,熊出没·重启未来,2025,山那边，还是山,3,一年一部较好质量，也很厉害了,2025-08-06 19:39:33,0
4426766300,熊出没·重启未来,2025,smile,5,没想到这次熊强组合增加了新的人物，未来世界的小亮赋予熊强组合勇气，立意很好,2025-01-29 11:48:52,2
4427571430,熊出没·重启未来,2025,沙子,4,娃给打四星。爆满场，坐在二排一、二号，旁边还有抱着免票娃俩人坐一个椅子的大人挤得我腿都没处搁，目测上座率150%……,2025-01-29 21:29:24,4
4428706880,熊出没·重启未来,2025,许一一,3,《哪吒2》的大场面特效，《封神2》的磨磨叽叽人物，好在这里的主角最后那一支棱是自己上的,2025-01-30 17:00:25,1
4427067826,熊出没·重启未来,2025,Teletubbies,5,在没有流浪地球的春节档，熊出没已经成为我春节档最爱的环节了。一年三百六十五天那么多电影，只有熊出没是我在不看评价的情况下，能确保自己走出影厅时是心情愉悦的。故事结构完整，人物形象清晰，转变逻辑合理，主题深刻，还有好看的场面。没有伪善的“现实主义”、没有毒鸡汤，而是正儿八经想让孩子开心（也包括成年人），以及有可能的话，传达一些真正足以让孩子面对这个世界的价值观。以上这些（抛去针对孩子的点），明明是我批改艺考作文的基本点，可去年百分之九十的国产电影都没办法全部做到。,2025-01-29 16:07:43,3
4419820558,熊出没·重启未来,2025,小川叔,5,除夕当天遇到一些突发状况，所以不是特别开心，就想着大年初一看一部开心一点的作品，熊出没也算是老IP了，火了这么多年，第一次尝鲜，收获了意外惊喜，光头强简直是六人组的团宠，改变未来世界的科幻主题，一波三折，泪点笑点交织，主人公小亮两次陷入低谷，却有了不一样的力量推动，忽然觉得原来“重启”这件事，需要的就是相信。没有什么比意愿更有力量，新一年，想要重启，就要看充满电量的电影！特别的彩蛋就是，光头不会遗传哇！,2025-01-29 13:39:53,5
4441856114,熊出没·重启未来,2025,ANTISOCIAL,4,比前两年的好太多了，没想到这部已经开始以末世为背景。更没想到竟然是《熊出没》系列撑起来了科幻动画的一片天。 画面明显花钱了，非常喜欢里面城市的设计，细节做的很用心。 其实故事并不新鲜，但还是被感动了。虽说可能这个系列的初衷是做给小朋友看的，但作为成年人有时候也还是会被真诚热血的东西所打动。,2025-02-08 19:19:15,0
4451495517,熊出没·重启未来,2025,何睦,3,穿越到未来，拯救世界的故事。节奏很欢快，追跑较多，就是剧情有一点过于简单了。,2025-02-16 23:30:54,0
4810452077,熊出没·重启未来,2025,田心cici,3,因为电影票快过期所以一家四口去看的。第一次看熊出没的电影，挺不错也有点搞笑。讲主角们穿越到未来拯救了世界和大家。,2026-04-04 13:32:57,0
4428179435,熊出没·重启未来,2025,普通女孩秋不野,5,女儿的白月光，从小看，每年都不能缺，今年一如既往的正能量，被光头强和熊大熊二感动,2025-01-30 08:58:31,2
4430554116,熊出没·重启未来,2025,🌈raymexic,2,感觉这个IP蹭上硬科幻题材就容易翻车，完全步了《重返地球》的后尘产出了比较无趣而缺乏动人感的套路化影片。整体情节上一方面有着将众多过往电影缝合在一起的不自然，另一方面因为强烈的主题宣告感而让整体的表达变得刻意而生硬，虽然在某些细节设定上有一些隐约的自我表达，但最终也淹没在传统到令人无语的二极化对抗之中，不见深度，更不见过多的真心，跟《伴我熊“芯”》中悲天悯人的母爱和《逆转时空》中对社会牛马的深度刻画完全没得比，是一次较为失败的尝试。,2025-01-31 21:10:20,2
4439118783,熊出没·重启未来,2025,係只猴爬上树顶,3,【25/032】打斗场面在同类型电影里实属进步，一对比旁边的喜羊羊系列最新跟游戏一样，最后当然还是得集体主义来救,2025-02-06 15:28:04,0
4429749080,熊出没·重启未来,2025,Jessie,3,《熊出沒·重啟未來》，以拯救世界作為敘事動力，建構對未來世界的想像，即孢子災變的世界/鋼筋水泥築就、毫無綠色植被的守望城。與此同時，未來世界指向影片放映所處2025年現世世界的環保議題。同樣作為春節檔電影，《熊出沒·重啟未來》與《哪吒之魔童鬧海》延續了相似的敘事模式，青年一代（曉亮/哪吒）作為故事主人公對抗強大的敵人（守望城城主/仙界掌門人），家庭/父子關係作為講述重點，支撐主人公的人物內核，最終戰勝敵人，保衛家園。,2025-01-31 10:34:18,0
4748955927,熊出没·重启未来,2025,熾翼-炎凰,1,强烈建议去央视看无主题曲《去未来一趟》的和谐版，主题曲作词不仅挑拨民族对立煽动恐怖主义还拿南京大屠杀充oc,2026-01-20 19:14:16,0
4542086128,熊出没·重启未来,2025,沈精病,3,要故事有故事，要科幻有科幻，要画面有画面。看不起熊出没的朋友，你家哥哥的票房还没人家熊出没搞呢笑死,2025-05-27 07:41:47,0
4432103652,熊出没·重启未来,2025,吃多会变胖,4,故事很完整，对小朋友也是很有教育意义，爱护环境，熊熊有责。,2025-02-01 21:16:27,6
4426816933,熊出没·重启未来,2025,momo,5,第一次看熊出没系列电影，我cow这欢乐风格我可太喜欢了！我以前到底在strong什么啊啊啊,2025-01-29 12:29:42,2
4435098692,熊出没·重启未来,2025,Tiffany,1,每年都来能不能消停消停,2025-02-03 20:47:40,4
4426853632,熊出没·重启未来,2025,残小雪Eva,4,《熊出没》系列还是太全面了，每一年都有新的仪式感，今年甚至拥有未来赛博风格了，熊大熊二跟咱强哥都跑到未来去了，竟然还是孢子植物的新世界，这脑洞确实值得一开，看的感觉又危险又有趣，赛博都市的画面色彩斑斓，有很新鲜的视觉体验。,2025-01-29 13:00:39,2
4445054874,熊出没·重启未来,2025,御姐控_光崽,3,及格爆米花。歌曲难听。,2025-02-11 12:33:24,0
4548392547,熊出没·重启未来,2025,肆叁,4,朋克熊,2025-06-03 15:44:15,0
4604687157,熊出没·重启未来,2025,残梦,5,小朋友打五星,2025-08-03 23:12:06,1
4431852084,熊出没·重启未来,2025,野草莓一颗,3,每年必备的陪小孩看大片环节,2025-02-01 18:42:34,1
4430295332,熊出没·重启未来,2025,杀不死的比尔,4,3.5颗星。【熊出没】系列，从电视动画连续剧到走上大银幕，已12年。虽未持续跟踪其发展脚步，但仅从此部可见，制作、技术已向好莱坞动画靠近。[熊出没·重启未来]的光头强成了太爷爷，穿越到一百年后见到了自己的曾孙小亮，这一设定给光头强油腻的形象增添了一抹柔情。熊大、熊二的人物设置如果回到“动物”本性，是否会给“人与自然和谐共生”的主题增色？,2025-01-31 18:21:14,1
4426780695,熊出没·重启未来,2025,东东,4,感觉看的不仅仅是一部动画片，是一种对童真的怀念，更是一种我对新年的期盼,2025-01-29 11:59:53,1
4426737721,熊出没·重启未来,2025,天后董小姐,4,意料之中的好笑，意料之外的热血，就像电影里说的“再微弱的光，也能照亮黑暗”，只要我们相信有光，就一定会有好的未来~,2025-01-29 11:19:13,4
4427980810,熊出没·重启未来,2025,起个名怎么老虫,5,熊熊不怕困难，勇敢面对，以后遇到困难一定要像熊熊们一样勇敢无畏,2025-01-30 01:08:27,2
4456469119,熊出没·重启未来,2025,好杀梦中人,1,比喜羊羊好 但也只是屎上雕花,2025-02-21 13:18:31,3
4427489106,熊出没·重启未来,2025,开平彭于晏,3,也算是回归最初的自然环保主题了？就一般吧，剧情上这个谎言统治计划蛮浅显的，况且系列里科幻比重这么大，也不新鲜了。最后的高潮融得有点明显了，解决方法像《流浪地球》，配乐像《星际穿越》；不过画面质量一直都很稳定，有个类穿越机的镜头设计还蛮吸睛的。科幻最终章的决定挺明智的，好奇下一部是什么。 #院线首映·3D,2025-01-29 20:44:17,10
4431895298,熊出没·重启未来,2025,刹那。,2,我就是天幕 天幕就是我！,2025-02-01 19:11:31,1
4438152195,熊出没·重启未来,2025,宁缺✨毋滥,4,如果没有竞争对手《哪吒之魔童闹海》，熊出没还是能稳定以往的地位的，但是二选一的话，哪吒肯定是首选。熊出没科幻系列就此结束，以人类最敏感的问题而结尾，恰到好处，期待后续作品！,2025-02-15 13:58:30,1
4466680745,熊出没·重启未来,2025,水里没有鱼,2,陪熊孩子去看的，被QQ星植入广告恶心到了，听说熊出没每年一部水准不错我才去看的，这一部显然就有失水准了，看到一半出去刷手机了，下次不会上当了，幸好熊孩子觉得还行。,2025-03-02 15:43:01,1
4428536813,熊出没·重启未来,2025,沈十六,4,陪小朋友看的，制作上确实眼前一亮，很多设定还蛮有想象力的，绚丽多彩的末日丛林险象环生，有软化身体的孢子，有让人产生幻觉的孢籽，还有合拢后融化一切的毁灭孢。熊强加小亮的未来冒险，本成年人看得津津有味。光头强不是导致末日的大魔王，真正令孢子泛滥的是环境污染、战争、人类的贪婪欲念。所以，“未来世界到底变成什么样，取决于我们自己的选择”不是空话，既指小亮、小亮父亲这些努力改变世界的人，也在点醒当下的我们要爱护地球，遇到问题勇敢解决。这部是《熊出没》科幻系列的最终篇章，就内容呈现来说，感觉画上了一个圆满的句号。,2025-01-30 14:46:03,3
4432931436,熊出没·重启未来,2025,影视四眼虫,4,在宜春看的，跟哪吒比，差了那么点意思！,2025-02-02 12:30:26,1
4450937858,熊出没·重启未来,2025,wanglc,3,继去年后光头强再度当上大电影主角，又一次是科幻缝合怪，除了光头强最后主角光环太强，其余更像个工具人。,2025-02-16 16:24:17,0
4429229143,熊出没·重启未来,2025,芝士汉堡.,3,【3.0】历经去年的滑铁卢，今年重整旗鼓再度回归初心，在环保的大主题下依然托举着爱与自我的旗帜，轻松写意寓教于乐又老少皆宜，一个成熟且恢宏的世界观在我们眼前展开，斑斓的末日狂想让绝境的逆转都带着锐不可当的魄力，亲情与友情点亮黑夜，敬畏与勇气插上双翅，尽管科幻部分不算有什么新意，但如此编排做到了既不无聊又不乏深意已经很难得了……,2025-01-30 22:32:52,1
4431710284,熊出没·重启未来,2025,六个九十度,4,在西安万科生活广场ume影城看的，特效很炫，动作场面挺流畅，剧情也还凑合。 儿子第一次去电影院，就是3D版本，挺好，纪念一下。,2025-02-01 17:03:10,0
4443281094,熊出没·重启未来,2025,Sunshine,5,挺不错的 画面剧情都挺好，熊大熊二这个国产IP打造的也不错,2025-02-09 21:04:15,2
4426799154,熊出没·重启未来,2025,秋库布里克,4,从光怪陆离的孢子丛林到赛博朋克的末日都市，几个主角像拧上发条般，在光怪陆离却又险象环生的未来场景中不断穿梭，大片感简直拉满，故事也是寓教于乐的同时还不乏笑点。看着影院里其乐融融的大人小孩，才意识到不知不觉系列已经走过了十二个年头，以前是和父母看，现在是带着弟弟妹妹看，也算是承载了一代人的回忆与青春了。,2025-01-29 12:14:48,1
4431412305,熊出没·重启未来,2025,拧发条鸟,3,还可以，小朋友看的很激动。,2025-02-01 12:59:33,0
4432455892,熊出没·重启未来,2025,ling,3,借鉴了很多剧拼贴出来的感觉，但是意外还行，不算突兀，小朋友至少是开心的,2025-02-02 00:10:54,0
4428523362,熊出没·重启未来,2025,慕士塔格峰,3,世界没有熊熊可怎么办啊。,2025-01-30 14:33:56,0
4426759348,熊出没·重启未来,2025,宝小仙,4,带着小孩去看的，小孩很喜欢，全程看得很投入,2025-01-29 11:43:38,0
4426887846,熊出没·重启未来,2025,光华映像,4,各种各样的笑点在我想不到的情况下向我袭来，完全停不下来，而且都是很自然的引人想笑，已经很久没有因为一部电影开怀大笑过了,2025-01-29 13:33:36,1
4430924639,熊出没·重启未来,2025,芋圆啵啵啵啵啵,2,含熊量太太少了…感觉就是借着这个ip再造。不如简单的讲熊大熊二和光头强的故事，比如那年的《过年》,2025-02-01 00:13:26,4
4439873222,熊出没·重启未来,2025,苏妄言,3,真是春节档的一把尺，排名在熊前面的值得一看都不赖，排在熊后面的各有各的烂法。今年春节档，熊到目前为止排名第三。,2025-02-07 00:58:26,0
4426815008,熊出没·重启未来,2025,壹壹,4,反正这么正能量的电影我是拒绝不了 熊强和小亮的积极乐观和坚强勇敢都值得我们学习哈哈哈,2025-01-29 12:27:59,0
4445123668,熊出没·重启未来,2025,刚吒四太子,3,常见的环保题材+流行的未来重工业末世体系，很流水线的作品~十岁以下小朋友的心头好~虽千万人吾往矣，很中式的故事~,2025-02-11 13:53:26,1
4434161397,熊出没·重启未来,2025,路在脚下,4,故事已经很完整了，可惜碰上了哪吒,2025-02-03 02:04:06,1
4439353409,熊出没·重启未来,2025,潼月堇,3,很好看啊，虽然肯定有元素“借鉴”和堆砌，但是给小朋友树立温暖正确的价值观很好，而且视觉效果拉满，中国动画已经这么强大了。,2025-02-06 18:54:44,0
4585463834,熊出没·重启未来,2025,Parachutes,3,2.5,2025-07-15 20:14:34,0
4430678729,熊出没·重启未来,2025,陳顏,1,熊出没作为每年闷声发大财的电影，还是太轻松了…趁着子供向电影的绝对受众，小孩子观影量不高的信息差，基本上可以把一整年所有大片的剧情及设定拿来融合，看似十拿九稳的作品，实际上毫不费力。 这样看来，彩条屋和追光的原创路才更值得尊敬。 方特动画早年间那种《十二生肖》的灵气去哪儿了呀？,2025-01-31 22:11:47,9
4281288443,熊出没·重启未来,2025,瑞鸡,3,光头强每年见，用成熟商业电影的外壳包装然后幼齿化。儿子说和哪吒差不多好看，他还没长大。,2025-01-30 10:58:39,0
4492588209,熊出没·重启未来,2025,飘1002,3,睡着了，主题还行但是想多看熊熊,2025-03-29 14:26:14,0
4428543773,熊出没·重启未来,2025,江湖大骗子,5,群像刻画得蛮出彩的，喜欢可可爱爱的熊二，也喜欢越做越勇的光头强，更喜欢有勇有谋的小亮,2025-01-30 14:52:16,1
4429408106,熊出没·重启未来,2025,Gst(˘³˘),5,熊二一开口，熟悉的感觉就来了，梦回童年,2025-01-31 00:02:44,1
4427073102,熊出没·重启未来,2025,乡野农妇鱼饱饱,3,还行～,2025-01-30 13:40:32,0
4433134509,熊出没·重启未来,2025,李若失12138,2,最后十分钟睡得贼香,2025-02-02 15:23:35,1
4426962648,熊出没·重启未来,2025,馆馆,4,还挺出乎预料的，虽然内核依旧是环保主题，但用更直观的灾后100年与当下对比，就少了生硬说教感变得生动不无聊了，地王孢爆发和污染孢子覆满全身的画面有种诡异美感，喜欢毁灭孢闭拢那个大全景，好末日废土风，俺们狗熊岭有自己的沙虫哈哈 这一部科幻画面能看出用了心，没有刻意的做喜剧效果而是认真讲故事了，所以节奏挺快，角色弧光也有，大魔王和救世主都完成了善与恶的两极反转，守望城的坠落也是谎言和权力欲望的崩塌（想起了扫垃圾，这不就是动画版底层反叛神国坠落？） 最后那句“真的走到蛇年了”有点感动，春节档依旧需要《熊出没》，小孩子看热闹，系列粉看情怀，成年人看标杆，都说一熊之壁，其实壁的是作品对自身的标准吧，动画片也可以不止步于糊弄小孩子，总要有人不想妥协，才能创造出更好的世界,2025-01-29 14:39:49,3
4432830305,熊出没·重启未来,2025,天蝎小猪,5,系列作每年春节档必上，且每部都能保证高水准（四星起步），太不容易啦！基本上该有的优秀元素都有了，有燃点有笑点有泪点，又富含正能量，太适合过年合家欢了！“无论未来多么未知，我们都要勇敢面对。”“再微小的光，也能照亮黑暗。”善哉斯言，当浮一大白！,2025-02-02 10:49:22,1
4445288082,熊出没·重启未来,2025,青绿的流水,2,小孩子看得很激动，但我始终觉得，对待新一代的小朋友，应该可以更认真一点。,2025-02-11 16:57:02,0
4391466167,熊出没·重启未来,2025,硬派小甜心,4,光头强挤眉弄眼式搞笑不太适合我，带女儿去看小男孩逆境坚守的故事是不错的选择。在场小朋友们看得很激动,2025-01-29 19:28:28,1
4438915432,熊出没·重启未来,2025,微笑迦朵,4,为光头强最后一根头发(他竟然还有一个头发)加半星。和家里小伙也是从“熊样”般的动画一路见证如今“熊的力量”。,2025-02-06 12:14:17,1
4434565232,熊出没·重启未来,2025,叫我李斯特,2,主题很好 差点睡着,2025-02-03 14:08:31,4
4657012706,熊出没·重启未来,2025,红、,3,一般，不值得看,2025-10-03 21:08:51,0
4569832906,熊出没·重启未来,2025,ttty,4,3.5+,2025-06-28 17:44:11,0
4438860237,熊出没·重启未来,2025,工可每,0,终于完成这个娃打卡任务了,2025-02-06 11:12:09,0
4428691025,熊出没·重启未来,2025,等风来,5,和孩子一起看的，通过影片展现，很容易引起共鸣，要学习小亮的那种坚持、勇敢、坚韧！,2025-01-30 16:48:57,1
4588871355,熊出没·重启未来,2025,多艰,4,以前我都是直接瞿看电影或者和朋友看电影，从来没有接触过这一类型的电影，一位这是一种低龄幼稚电影。大年初三带着孩子在电影院看过之后发现剧情很饱满，是一部不错的电影，但我三岁孩子应该还是看不懂剧情，只是在画面强烈闪转的时候看得很认真。,2025-07-19 14:52:19,0
4326714092,熊出没·重启未来,2025,拱拱小野猪,3,前半部还行，有笑点也有冒险。 后半部有点水了，剧情展开完全不够。非常套路。看的都犯困了。 还有你太奶到底长啥样啊。,2025-01-30 22:22:52,3
4462782383,熊出没·重启未来,2025,莎草穗,3,标准的设计，但没有塑造到角色和剧情。我还说不清具体什么意思，主观感受。,2025-02-26 22:37:15,0
4427990315,熊出没·重启未来,2025,K歌之王,4,还可以,2025-01-30 01:15:20,1
4427888994,熊出没·重启未来,2025,大力水手就是我,2,说实话，超乎预期，可能和去年的贺岁片比去了，今年意外的好看，不知道是电影的进步还是电影院的进步，3d效果出乎意料的好，电影节奏很快，节奏感很强，搞笑的部分挺多，动画也很逼真可爱，就是一点结局收的有点莫名其妙，主角光环太严重，村民们本来都听城主的，一直当小亮是恶人。就因为几句话突然帮助熊大熊二有点不合逻辑。光头强也是一会被蛊惑让小亮放弃拯救世界，一会又让他坚持自己，说实在的，这个坚持也不是100能成功啊，这样说起来城主的坚持也没有错啊，后面怎么打都能站起来的小亮真是主角百层光环，不过看动画片如果太计较逻辑就没意思了，还是很讨喜的，特别是光头强最后说的小亮的太奶长啥样也正是我们想知道的，有了这伏笔下一部不会光头强结婚的故事了吧😄😄作为贺岁档，很值得,2025-01-30 00:14:39,0
4521173473,熊出没·重启未来,2025,英白拉多,3,这原本是一个狗熊与伐木工的故事,2025-05-02 01:12:58,0
4426827460,熊出没·重启未来,2025,小小菩提树,5,啊啊光头强给领导画饼名场面xswl，强哥怕不是一个超绝e人吧。,2025-01-29 12:38:44,0
4439730326,熊出没·重启未来,2025,UltharF,2,【theatrical】时代真是越来越好了，在中国院线都能看到tag起码能打十来个的福瑞cult电影了。谁能想到近几年（大概是自《阿凡达2》以来）来看过的3D效果最好的院线电影居然是一部子供向动画电影（当然对物体运动的游乐园交互设施式应用自然也是其取巧之处）,2025-02-06 23:12:07,0
4438872170,熊出没·重启未来,2025,三秋即逝,3,这个电影抄一点，那个电影裁一些，最后合家欢，（什么熊出没版风之谷，还有武藏小次郎）,2025-02-06 11:25:58,2
4549718418,熊出没·重启未来,2025,梅林,3,消灭孢子世界，拯救未来时空。,2025-06-05 09:44:09,0
4426733995,熊出没·重启未来,2025,阿丹丹,5,陪儿子系列,2025-01-29 11:11:20,3
4430281102,熊出没·重启未来,2025,Poker Face,3,Bug还是比较多的。市民没有收到任何信息，却知道要去电磁轨道炮上帮忙。观看期间发现的科学漏洞就有两个，第一个是反重力系统，一个个关闭就会严重失衡，第二个时间旅行，这题材的电影真是屡见不鲜，而剧情又其容易出问题，这部电影明显的违反了祖父悖论，未来的事情已然发生，那么未来和过去之间的一段时间世界便必然处于污染状态，三人组时间旅行回去的逻辑问题无法调和（是我在和幼龄向动画片较真了）。不得不提但还是得说，电影院里的小孩真是逆天，站在椅子上跳，看电影大声聊天，国内观影环境是有必要整改一下的。决战进孢心貌似还用了星际穿越的旋律？熊出没春节档系列电影从最开始满座拍案的几部狗熊岭轶事转型成现在的科幻大战，一年比一年幼龄向，是时候弄点成熟的了，方特！,2025-01-31 18:37:14,0
