评论ID,电影名称,上映年份,用户昵称,用户评分,评论内容,评论时间,点赞数
4425799015,蛟龙行动,2025,凝羽飞,4,7.5分。赶着过年前把点映给看了，应该是我印象里第一部国产核潜艇电影，一个新类型片子。带上最爱看核潜艇类型电影的老豆好好欣赏了我们国家最“先进”的潜艇设备和武器，只能说一句牛逼！整个故事简单说就是帝国潜艇舰长叛变和雇佣兵一起搞海底核弹准备制造海啸发动恐怖袭击，我们的潜艇和蛟龙小队击败了敌人的阴谋。整个本子在逻辑上还是有点问题，但是不妨碍在IMAX厅里享受视觉盛宴。相比于蛟龙小队的动作戏，反而是核潜艇上张涵予这个舰长还有王俊凯这个黄金耳朵的戏份更出色，我觉得这个角色会成为王俊凯的代表作之一了。至于《红海行动》续集的概念，其实反而有点刻意，以及黄轩和于适的故事也是，在我这反而是败笔。,2025-01-27 22:03:41,916
4429989344,蛟龙行动,2025,丁丁,2,拍的啥玩意？手持摄影让人昏昏欲睡，快剪特写让人眼睛疲惫，突然的口琴让老子猝不及防，莫名的歌曲唱的我膀胱肿胀，佟力到死才配有特写是吗？,2025-01-31 14:23:00,113
4393602431,蛟龙行动,2025,iris,5,中国电影重工业化现代军事类型不易，支持一下！,2025-01-30 23:42:27,83
4426962399,蛟龙行动,2025,搬砖侠,4,林超贤再次定义了“华语硬核军事动作大片”应该怎么拍，故事主打燃爽刺激，动作片影迷看得全程满足。叙事层面全无废戏，成功塑造了蛟龙突击队的英雄群像，杜江饰演的副队长徐宏成为贯穿系列的核心人物，作为突击队的副队长，他既是战场上的铁血指挥官，决策果断、行动果敢；但在战友面前，又展现出兄长般的温情，刚柔并济的特质在杜江的演绎下显得格外真实可信。尤其是这个角色的人设塑造很出彩也很接地气，不仅打破了传统军事片中角色脸谱化的局限，更刻画出一个有血有肉、有情有义的现代军人形象，不止有军人式的英雄主义和威严刚毅，也会流露出细腻脆弱的一面，杜江的扎实表演将角色内心的挣扎与成长表现得淋漓尽致，贡献出全片的高光时刻。,2025-01-29 14:39:35,447
4386267835,蛟龙行动,2025,哗啦啦,4,为啥不去五一国庆档呢？非要老百姓乐呵过年，资本对冲暗算无数无理时上，自残战损自己呢？太可惜了！ 尤其看了无数真假刻意恶评后，想骂街！这帮人为赚点儿小钱対得起中国电影吗？ 翻翻全球商业战争片电影史，都不可能靠后哈！史泰龙阿诺们年轻时，从海底出击追击红色十月也不过如此吧？ 而且，因为是军人主旋律，所以里面的弘大叙事更逼真热血。另说，编剧你非要写挂佟莉，还特么闪回，你自己怎么不挂呢？ 顶级的军事动作片就这么淹了，气得不行。还是那句话，真可惜。,2025-02-03 20:23:37,30
4443531577,蛟龙行动,2025,朝阳区妻夫木聪,2,为了怕被于老板当成是无脑跟风的黑子，那就给两星吧。剧情什么的基本是没有的，更别提文戏了，两个半小时全程都是燃点就意味着全片没有燃点。时至今日林超贤还有博纳对于主旋律的认识似乎还停留在1.0的阶段，噼里啪啦一顿乱打，危机时刻小煽下情，最后再喊几句口号，完事！甚至都不管那些所谓的专业术语观众们是否能get或者能理解，反正看起来挺厉害就行，某种程度上是偷懒的更是傲慢的做法。红海行动已经是差不多7年前的作品了，且不说主旋律这碗饭是不是还好吃，观众的口味也早就迭代了，而且要是别的档期也就算了，放在春节档里，你不扑街谁扑街呢？,2025-02-09 23:29:56,27
4428375265,蛟龙行动,2025,mumudancing,4,春晚上的机器人扭秧歌逗亿万人乐，潜水艇里的机器狗是恐怖武器杀人如麻。第一次深刻感受到AI不是科幻而是真实的环境——人类的肉身、意志、情感如何与机器对决，这部片上演了真正的残酷（现代战争）。香港班底的动作指导太能扛，好看不输二战潜水艇电影。,2025-01-30 12:17:39,18
4428559978,蛟龙行动,2025,后自愈,1,冬子急了，观众麻了，我们赢了，林超贤有点一生军旅情了。,2025-01-30 15:06:04,148
4425570623,蛟龙行动,2025,维恩B,1,好无聊的CGI大战，也没有个核心角色或者小队去推进，看不到想要聚焦的事物，视点混乱到处乱切，所有人都是主角，be like期末考试划重点：全部都是重点。更何况它只有明星没有角色，不是人多就叫群像啊……所以即便它的故事已经简单成那样了，还是讲得无比混乱，燃也没法燃起来，真的是黔驴技穷了。不都说迪士尼唱首歌就把问题解决了嘛，这部也这么干了，并且达到了新境界……目瞪口呆。,2025-01-27 17:39:04,210
4424951798,蛟龙行动,2025,啊柒,2,2.5，只有包饺子的水平，没有硬核战斗的水平。倒不如说在场面调度上林超贤导演有些越活越倒退的节奏，如果说前作《红海行动》之所以能成功靠的是从头打到尾的持续紧绷节奏+细节拉满的各种军备，以及导演善于叙事上扬长避短的巧妙性，到了本作则是把前面的优点一股脑的全扔掉，然后选择了近未来的时间节点，而很尴尬的是在世界观架空了的同时，也丢失了一部战争片本应拥有的那份属于其独特的“真实性”，活生生的把自己拍成了一部“科幻片”，从前半段海上油井战斗秀出的科技与狠活，加以文戏叙事铺垫情感的尴尬与鸡肋，直到后期潜入深海的类好莱坞战斗戏码来一顿我方的丝滑小连招，最终的胜利则是因为我们“团结一致”，最终才能“邪不胜正”，无一不在披露着导演的黔驴技穷，以至于失去自我特色的同时，还不忘初心的教育人，实属令人忍俊不禁了。,2025-01-27 15:24:49,168
4438408655,蛟龙行动,2025,阅世书生,1,打一分，是因为豆瓣不能打零分。我不是“黑水”，我是看完了觉得后悔。,2025-02-05 23:07:47,133
4437282109,蛟龙行动,2025,地球没有人,3,很矛盾，从电影工业的角度来说，这几乎可以说是一个满分的作品，但我在想，导演和整个制作团队花那么大的力气，去做这样一个老套的东西的意义的是什么？说真的，这部电影我几乎没有看到什么新的东西，除了炸裂的特效外，似乎就什么都没有了。整部电影就像一个精心雕刻出来的仿制“古董”，再精美，它也只是一个工业制品，离艺术还差得远呢。,2025-02-05 02:54:51,26
4433816726,蛟龙行动,2025,黎子岩Rain,5,多好的电影啊，勇者无惧，强者无敌。别被网络键盘侠影响！放心看！,2025-02-02 22:34:53,112
4426848399,蛟龙行动,2025,炯之,3,只能说拍的非常无聊，两男主的故事和主体情节可以说毫无必要联系，放进来没觉得对剧情有啥推动，大篇幅的潜艇指挥戏因为缺乏动作戏的动感，有点像纯台词表演，也就血腥的二十分钟作战场面有看头，也就这部分像观众喜欢的行动系列，以至于这么大的投资有点完全简单地沦为了潜艇展示戏。,2025-01-29 12:56:03,34
4445197205,蛟龙行动,2025,熊小月,3,贪多嚼不烂，什么都想拍，什么都没讲明白，温情不知所起，打斗不知所云。比第一部来说，真的有点差,2025-02-11 15:18:45,15
4425532412,蛟龙行动,2025,冷宵空濛,2,宣传拿蒋璐霞大肆宣传，我还以为是大女主片，结果不是进来看到演员表感觉配置很好啊，下一秒就看见说剧组把她戏份删到只有五分钟还把人写s了，太恶心了😅最好不是，不然大概率烂片，祝糊(哪怕主演再好感也是🙂 —— 二编，上线网络立马看了，只能说最后的打戏算能看，还有道具场景等制作都做得不错，但是故事性太差剪辑也一坨，外加毫无意义的长镜头…简言之，看看切片就好了。,2025-11-08 23:18:33,6
4436419085,蛟龙行动,2025,反方向的钟,2,危难时刻吹口琴太傻逼了,2025-02-04 16:56:11,68
4432576129,蛟龙行动,2025,梦朝大海,1,军迷看得脑溢血。。。,2025-02-02 01:31:52,122
4425559309,蛟龙行动,2025,晚不安,2,有意对主旋律现代战争片叙事策略做出一定调整：从《战狼》式的“虽远必诛”，到“责任全在美方”——不是想当全人类救星，而是迫不得已帮美方擦屁股。少了足量的民族主义倾向，这种新的落点估计会让一些春节档的主流观众无所适从。《紧急救援》就能看出林超贤已成强弩之末，到《蛟龙行动》更是疲态尽显，动作戏铺张至极，文戏却进一步垮塌。《湄公河》《红海》里起码勾勒出几个完整人物，《蛟龙》只剩下无休止的爆破和肉搏。博纳或将迎来春节档最大滑铁卢。,2025-01-27 17:23:38,69
3335047344,蛟龙行动,2025,恋影,3,《蛟龙行动特别版》：3.5星。没那么糟糕，但还是存在很多信息交代不够清晰的问题，比较乱。最后的潜艇大战和突击队制止核弹爆炸这两条线的并线剪辑做的并不够好，如果能够相互螺旋式上升，将节奏推上来，效果会更好。有了《碟中谍8：最终清算》的深水潜艇戏之后，能够明显的感知到这两部电影，潜水戏份的质量差距如此之大，《碟中谍8》里面的潜水戏路线清晰，目标明确，并且环境氛围那种沉浸感渲染足够到位。但是在这部《蛟龙行动》里面，潜水艇的戏份是非常混乱的，没有任何代入感。这就是在电影拍摄时想好怎么拍和没有想好怎么拍，在执行效果上呈现出的巨大差距。,2025-08-23 17:11:28,22
4440514666,蛟龙行动,2025,,1,HK导演太土了，学学徐克老老实实拍黑社会得了，求再也别拍主旋律了，槽点太多完全是低级红高级黑……,2025-02-07 17:41:52,38
4433609270,蛟龙行动,2025,greatabel,3,3.5🌟吧，优缺点都非常明显：好在于场面大，故事背景设定颇有些“科幻世界”感觉，坏的地方在于脑残剧情：舰长完全瞎指挥吧（不是第一时间获得的信息发回总部，和西大交涉吗），而且敌情不明就救援，还全体意见决定，海军空军真的是技术兵种，不是谁都可以发言，再说这样黄花菜都凉了）；强行煽情，打机器🐶“人定胜机”方面太老套（感情我们的高科技就是“基建”大潜艇和大疆，为啥就不能电磁枪/脉冲武器瘫痪），你方对接敌方潜艇怎么也要“破解/使用技术手段“吧；不过确实是近几年来比较大制作的“海战片“了，但只学来了好莱坞海战片其”表“，并没有真正中国军事题材的”核“,2025-02-02 20:50:22,33
4433568649,蛟龙行动,2025,HenriqueZZZ,2,0126点映；只有镜头跟着小树苗在船舱各处走的长镜头有那么一点拍电影的样子，其余近两个半小时，有一半的情节和人物都是废话,2025-02-02 20:25:24,31
4426744355,蛟龙行动,2025,系统参数,4,点映的时候就看了。这部质量是中上之作，喜欢商业大片的可冲。全片觉得最能吸引我的两个角色是佟莉和曹弘浪。1️⃣佟莉这个角色刚柔并济的特质可以引起观众的情感共鸣，而且蒋璐霞在蛟龙小队里是真的很出彩，希望未来有更多打女的好戏给到她，真的值得。2️⃣以及“黄金耳”曹弘浪这个角色也让我很惊喜，王俊凯在里面台词有爆发力，且语音语调的变化与角色所处情境的结合很紧密。可以看出来台词功底好，其实这块也是我通常更青睐科班演员的原因之一。看完蛟龙行动的观众会想给他一块黑巧，电影这里莫名还能磕到点！,2025-01-29 11:29:50,895
4431271349,蛟龙行动,2025,Michael.Momota,3,中间的节奏有点问题，只有龙头凤尾中间猪肚的电影。观影的时候都睡着了，全片最爽王俊凯，不用打就得到了金子般的角色。机械狗真的才是幕后大Boss,2025-02-01 10:47:33,17
4466451916,蛟龙行动,2025,JoeyLu陆柏宇,3,也是节奏稀烂（原版） 早这样剪就不会有那么多事了（特别版）,2025-03-02 11:58:02,5
4437012618,蛟龙行动,2025,交待材料,3,前20分钟很不错。后126分钟各种狂轰滥炸、哐哐砰砰、叮玲咣啷、噼里啪啦、嘶咻哼喘……老实说有点审美疲劳，中途睡着的十五分钟可以证明。,2025-02-04 23:15:17,17
4425523541,蛟龙行动,2025,麻绳,2,香港导演在主旋律娱乐电影创作上的打工心态，往往让他们在意识形态输出上显得过犹不及。林超贤还是放弃在这个类型上成为迈克尔贝的企图吧，这成不了中国版的《勇闯夺命岛》，只是加强版的《空天猎》《长空之王》。这部电影最吊诡的地方在于我根本不知道银幕上所展现的东西是否真的会在现实中发生，因为实在是很科幻，但他们明明不是在拍科幻片。蛟龙小队后一半才上阵，全员都是工具人，只是来完成一场动作戏的，他们的戏还不如声纳兵王俊凯完整，不擅长文戏的林超贤，这里是彻底放弃文戏了。,2025-01-27 16:35:07,58
4426820049,蛟龙行动,2025,JL,1,用“泄密”和女演员做噱头营销 很难看 不会变成今年春节撤档的电影吧,2025-01-29 12:32:29,287
4426744139,蛟龙行动,2025,总有蓝天,2,鉴定为人机。如果说前作是水准在线的战争片，那本片就只剩叮叮咣咣的表面功夫能看了。,2025-01-29 11:29:33,146
4707393903,蛟龙行动,2025,尤物小猫,1,2025-11-21 特别版： 感谢国家，感谢一切，中国赢了，中国电影赢了。 剧情？不需要！逻辑？不需要！节奏？不需要！美学调度？全都不需要！人物？没一个能分得清的，还提什么弧光！热血场面？有的是！兄弟情？硬加上了！ 全片没一处是在讲家国情，但是就是这么红，看得我两眼发红，红到骨子里那种红。 真的不用担心也不用藏着不给外国人看剧本，这国家机密谁能看得懂啊？！原来让人完全看不懂无法理解的不一定都是好电影，而这电影一定能载入史册。,2025-12-05 11:49:13,3
4393372747,蛟龙行动,2025,Niqa,4,IMAX点映场。文戏肯定没有上一部的水平，好在也不多。整体感觉艇艇对轰比人人对打戏份更重，还是满带劲的。机器狗很有记忆点,2025-01-27 22:38:18,773
4427956683,蛟龙行动,2025,阿德,4,还是那个林超贤，从头干到尾，要啥文戏！,2025-01-30 00:53:58,27
4629457060,蛟龙行动,2025,茄盒烧,2,自我感动的正义也是会变油的。杜江太绷了，请退出类似题材。张涵予看腻了，于适还是二百五。 蒋璐霞的参演镜头像是想给女人分一口菜，但心疼菜，觉得女人吃太多了，又一巴掌给人扇下桌去。 重剪的都这样，心疼正月里观众的眼睛。,2025-08-30 23:33:33,32
4430231251,蛟龙行动,2025,JackKu,3,作为续作是不合格的，没有延续第一部的叙事节奏，前作的4段落处理得干净利落，而本作的多线交叉推进则显得混乱冗长。 如果你没有看过《猎杀红十月》等潜艇战影片，没有看过阻止核爆（忘记名字了）的剧情，甚至没有看过《红海行动》，你都可能觉得这部电影还不错。但是作为战争片，尤其是以还原真实场景出彩的《红海》的续作，影片为故事片的展开而牺牲了军事上的逻辑真实太多了。 宣发的“保密台词”更是搞笑；战略核武器非得在引爆阶段给这么长的进度条等着你来破解；敌方的行动保障更是儿戏，陆战也拖泥带水起来。海战部分可以当科幻片看。 虽然影片全长很长，故事很长，可对人物的描写反而着墨不足，基本没有细腻的笔触，对人物也基本没有了解和共情。,2025-01-31 17:33:47,33
4430157086,蛟龙行动,2025,谢谢你们的鱼,1,差不多是小学生眼中的未来战争，夸张、幼稚且胡闹。两个半小时的电影，没有人物，没有情感，情节比《红海行动》还要干瘪无趣。也不知道林超贤咋想的，取名“蛟龙行动”，然后“蛟龙小队”完全是工具人，大部分时间就是一个山寨潜艇片外加各种军事武器展示，而潜艇戏不论是特效还是紧张感都被《碟中谍7》的前十分钟秒杀。不敢相信这是春节档投资最大的电影，水下特效差得离谱，置景也很塑料，建议博纳报警看看是不是被美术和特效坑钱了。最后，张涵予演的舰长真的是一个纯智障。,2025-01-31 16:40:40,87
3343183976,蛟龙行动,2025,迷影龙,3,作为中国首部潜艇片倒是独一挡，潜艇戏份拍得其实还是不错的（应该大部分投资都用在了这上面），遗憾的是此片整体质量远不及《红海行动》，至于复制它的成功也是不可能了，故事和角色创作都一般，感染力不强，作为妥妥的主旋律大片，却把主旋律口号拍得太过明显了，加上大家对主旋律已经审美疲劳了，可能是春节5部大片里面垫底的存在，实属可惜了。春节5部大片看的第二部。,2025-01-30 03:48:27,31
4446795930,蛟龙行动,2025,归墟,1,累了，枪毙吧，导演主创啥的拖去靶场，上12.7mm，打满五分钟再铲出去,2025-02-12 23:16:05,32
4425585111,蛟龙行动,2025,Noel,2,林超贤本质上就是一个拍港产动作B级片的行活导演，这样的制作他的格局根本hold不住。只能用持续的高频率但调度混乱的“大”场面来掩盖自己的叙事短板。障碍设置动作设计老土的要死，煽情段落十分刻意且公式化。还有林氏一贯的血腥恶趣味。唯一有点亮点的是载具内外部的设计。,2025-01-27 17:58:04,56
4448223559,蛟龙行动,2025,姓亚名蒙,2,核潜艇纪录片+《使命召唤》，潜艇战争元素喧宾夺主，全片几乎都看不到蛟龙小队成员们的性格特色，甚至觉得这帮人就一直在“想一出是一出”地行动，黄轩和于适、张涵予和段奕宏的人物关系老土又无聊，蒋璐霞没有任何存在感，这就使得全片看不到“人味”，反倒是王俊凯演的声纳兵有那么些创意，可对整体的人物设定于事无补，加上让人看不懂的潜艇设定和瞎打一气的鱼雷大战，以及样板式的鬼佬反派，可以确定于冬和林超贤对于“大片”的定位已经跟不上时代了，当下观众不是看这种不伦不类的主旋律大场面就能满足的,2025-02-14 10:48:32,14
4419560572,蛟龙行动,2025,赏味狙,1,2025.1.29 公映 2025.8.30 撤档重映 2025.11.7 上线流媒,2025-11-07 22:44:18,4
4440158467,蛟龙行动,2025,电影已死,1,《蛟龙行动》在“蹩脚的主旋律命题作文”与“中规中矩的战争片”之间反复横跳，最终连基本的叙事都没做好。,2025-02-07 11:48:41,21
4427584985,蛟龙行动,2025,太空牡蠣,1,遇事不决，先吹口琴,2025-01-29 21:36:13,39
4426941880,蛟龙行动,2025,欧阳鸿飞,4,国产这影片创新了，真心的好看紧张刺激好看(○｀ε´○),2025-01-29 14:21:15,406
4426677581,蛟龙行动,2025,秋奔客,4,剧情上的几个大雷点真的坏了特效场面这一锅粥，不过什么实景搭建也是事倍功半。7分，为特别的题材向上取整,2025-01-29 08:09:51,734
4437045212,蛟龙行动,2025,我不是momo,3,感觉每一秒都在烧钱啊，确实是大制作，大场面够够的，但是剧情太无聊了，毫无新鲜感。 群像拍得很差，蛟龙队员们的人设别说鲜活了，连清楚都做不到。全片戏份最多的那几个人也没拍出什么魅力来，纯纯浪费,2025-02-04 23:31:39,22
4635960112,蛟龙行动,2025,kylegun,4,个人飞行器小队潜入海上平台对战，潜艇追逐真假诱饵核爆火山，舱体密室营救游击战，三打机器狗终结者激光斗室肉搏大只佬……林超贤好像不太擅长窄空间动作场面的调度，只有最后的血浆对战才稍微找回点以前的感觉。另外，这么大一场硬仗就只牺牲掉一个前作女兵用来煽情，也确实不太理解编剧怎么想的,2025-09-08 00:57:39,4
4395733480,蛟龙行动,2025,大梁客,3,第一部《红海行动》票房36.5亿，简直称得上石破天惊。这一部作为续集，我预测票房高不了，10亿以下，甚至更低，原因如下：1.演员阵容不如前作。2.观众审美疲劳。3.最重要的一点是红海行动上映在2018年。那时候我们每个人信心满满，要建设强大祖国。而现在人们充满了失望与迷茫，更关注怎么找工作与不失业。仓廪实而知礼节，衣食足而知荣辱，普通观众很难再有共鸣了。4.红海行动在2021年和2022年都重映过一次，两次的票房才不到300万，也说明观众的兴趣已经变了。2025.1.20,2025-09-14 22:59:22,8
4425469745,蛟龙行动,2025,Mr. Infamous,3,既然是林超贤操刀，规模之大，动作之狠，铺排之密，起码在国产片范畴都是绝对上乘的。这次探入深海，大玩核潜艇，还有飞行装置和机械狗，非常抢眼。不过相比《红海行动》，还是对《蛟龙行动》失望。前者因为老乡拍家乡，添了一星加至满分，但那些自然生发的惨烈与悲壮，层出不穷的惊喜拓展，自觉抵挡主旋律痕迹的净化动作，在后者里丝毫得不到贯彻，甚至反插不少很生硬的章节，很难受的表达，而且很明显地，为了一些明星，戏里戏外都牺牲不少立下汗马功劳的原班人马，尤其是我最想看的蒋璐霞/佟莉。两星半。250125,2025-01-27 15:17:11,14
4426572378,蛟龙行动,2025,HatcherZ,3,从动作角度看确实是比《红海》的难度高，林超贤确实是想做些新东西，从镜头的设计和近未来的设定来看。但实际效果呈现却一言难尽，可以说除了动作以外文戏尴尬至极，但动作又全程毫无感情的打打打，人物塑造只能选择性塑造，更别说这个有点牵强的反派，有点乱的剪辑，还有林超贤对无意义血腥场景的滥用，除了煽情和猎奇没任何作用。综合来看就是一言难尽的主旋律，甚至比红海还要尴尬点。,2025-01-29 00:06:36,30
4425680183,蛟龙行动,2025,zeta,1,无语了。想过会扑 没想到这么烂！什么年代了 编剧活在抗战神剧的逻辑里吗？士兵忙着自救 领导无助吹笛唤醒大家不放弃？？？ 这影片抹黑海军的吧？？？ 适合小红书上推荐给美国人看哈哈哈哈哈,2025-01-27 20:04:05,229
4425545646,蛟龙行动,2025,崔秀彬,2,作为一个想吹当下实力的电影结果照着科幻片跑偏就已经注定了失败，看起来是花了很多心思在装修上但怎么看都像搭棚子，缺乏人物塑造、缺乏情节依托，甚至连打戏都不够精彩连贯,2025-01-27 17:04:26,47
4436658196,蛟龙行动,2025,高玉宝,4,确实是红海的升级版，够燃够利索，票房这么惨，真的只是观众变了，就不知道是同一批观众口味变了，还是说，七年前看红海的观众现在都不看电影了，电影院确实换了一批观众？？？,2025-02-04 19:45:49,9
4431048404,蛟龙行动,2025,毁毁的短途跋涉,2,大段大段的普通观众听不懂的专业名词都不解释一下吗，别以为说台词像机关枪一样就是快节奏啊。关于笨重武器对战也有拍得好的看看《猎杀T34》。 ps.我心疼蒋璐霞。,2025-02-01 01:49:19,31
4434258263,蛟龙行动,2025,刘佳辰Stephen,1,看制片人于东在那死矫情就恶心，浅浅给个一星吧。于冬一直强调这部电影有多么工业硬核，作为电影工作者，竟然这么肤浅，殊不知中国人更重视精神内核吗？真以为中国观众只看特效多么牛逼？场面多么宏大吗？如果剧本一坨屎，价值观肤浅，那就是垃圾电影，你口中所谓的更猛、更工业、更大气、更硬核，只是给这坨屎喷点香水。于冬啊，观众不傻。,2025-02-03 06:17:50,141
4426089068,蛟龙行动,2025,Lucky李IST,2,"蛟龙行动 Operation Hadal (2025.01.29 大年初一 146min) 2025.01.27 CGV白玉兰 点映 IMAX 推荐星级：★★☆ 小李评分：5.2 # 【红海行动】续作，物质性大场景有冲击力，军事装备细节丰富，聚焦深海作战、核潜艇，展现了军事大片的新高度。 类型化与实拍的细致展现，军事基地和潜艇的长镜头呈现，潜艇的近距离声纳探测和鱼雷对决，林超贤的火爆和博纳的""重工业主旋律""延续。 群像失败，找不到情感基础和依托，多点快节奏的动作失衡混乱，设置在近未来又没法代入最基本的动作逻辑---实景拍摄下，面目模糊的军人，面目模糊的敌人，毁灭与保护的暴力沦为假大空的口号。 #",2025-01-28 07:09:25,31
4422031396,蛟龙行动,2025,紫苏,2,当军事电影变成科幻背景再多炸裂军事技巧也只能是yy了吧？人物完成度太差了，整个蛟龙小队没有一个能记得住的人，再多特效和动作场面，再多视听上的努力，都像花里胡哨的春晚大串联一样吵闹无趣,2025-01-28 22:21:11,40
