评论ID,电影名称,上映年份,用户昵称,用户评分,评论内容,评论时间,点赞数
4427658573,蛟龙行动,2025,健忘的猫头鹰,0,作为军事白痴来看了一部“尴尬喜剧片”，片中的情节是随便推进的么，进入尚在内讧中的敌舰、内讧双方各有多少人、遇到生者救谁？人都进入太阳月亮两基地了、接驳的时候居然不被发现？敌舰爆炸的消息为什么没有通传所有人、比如艇外排出石块的人员完全没有规避的动作？后半段各种紧急时刻的倒数时刻毫无紧迫感，还吹上口琴了，太多不理解，还经常分不出来近身搏斗的是谁打谁，逼仄的潜艇戏仿佛转移到了陆上大型建筑内的对战戏。失望，需要重温前作，重温U571、追击红色十月等来回血。,2025-01-29 22:13:09,16
4433988684,蛟龙行动,2025,款冬,1,第一次见这么情绪不稳的老总，不过确实不好看，观众不背锅。,2025-02-02 23:57:11,68
4427191058,蛟龙行动,2025,Die Katze,4,非常好，非常令人感动。以后估计拍不出这么好的电影了。,2025-01-29 17:34:51,16
4441830539,蛟龙行动,2025,姜乌归,2,更像一部定制宣传片,2025-02-08 18:55:42,16
4424926434,蛟龙行动,2025,想去北方看雪,4,剪预告片的那个哥们应该扣发所有工资，很好奇他是怎么把一部不输好莱坞A级制作的大片剪成小孩过家家的。,2025-01-29 22:44:04,36
4430058045,蛟龙行动,2025,昭和惊弓鸟,1,没有任何人性和能让观众有所倾向的样板群像，突突一通缺乏节奏的狂轰滥炸，真的煎熬，拿阿lam和卖拷贝比都是侮辱好莱坞的成熟类型片体系。,2025-01-31 15:21:44,3
4425882087,蛟龙行动,2025,发条橙,2,看完之后仿佛听到了于冬心碎的声音，撤档吧好不好，撤档吧，你比较适合做一摊＊＊。不论剧情还是人设都干瘪得像一具陈年干尸，继承了《红海行动》的所有缺点并放大，无节制的突突突哒哒哒以及各种爆炸毫无美感，极度聒噪让人神经紧绷，看得实在是很累，对，好不好看都暂且不论但真的很累。外国演员的表演一如既往的塑料和脸谱化。,2025-01-27 23:14:40,41
4424958650,蛟龙行动,2025,樱,2,大片的形，平庸无聊的魂,2025-01-27 20:28:39,51
4476041043,蛟龙行动,2025,寒狐居士,3,潜艇已经这么科幻了吗？,2025-03-10 23:41:46,5
4425982493,蛟龙行动,2025,EN.,1,冲蒋璐霞去看的。结果？？？,2025-01-28 00:47:50,82
4424414728,蛟龙行动,2025,电影胜于她,2,好消息：剧本质量与特效技术已高度对标好莱坞商业大片水准。 坏消息：“好莱坞式类型大片”在当今已是“空洞主题与浮华形式”的贬义代名词。 注意：为单个明星（处于蛟龙小队中的角色）观看此片的观众请注意，由于林超贤的招牌快切剪辑与反映凶险、高压情境的颤抖式运镜，再加上严实军装的象征身份的服化道，除了单人打戏情节你根本辨别不出他人。,2025-01-27 17:28:41,71
4438094300,蛟龙行动,2025,嘉树清圆,4,钻井平台这一part与后续剧情没有强关联却占比极大，导致看到后面几乎不记得前面的剧情了。 蛟龙队成员太多，除了三五人有独立剧情线的能给观众留下印象，其他的像npc一样成为火爆大场面的背景板。牺牲的两个人物好像是要完成死伤kpi一样被祭了天，但观众情绪又没到位，祭天无效。,2025-02-05 19:53:56,4
4426417351,蛟龙行动,2025,Leo,3,7/10 比预期的好，特效方面和前作比有明显的进步，后半段的潜艇打斗好评。片子的槽点也很多，前面铺垫太长，开始看的时候感觉莫名其妙，人物形象塑造也很模糊，甚至连反派的动机都不是很清晰，兄弟线更是莫名其妙，无头无尾。有些片段不合逻辑，潜艇撞击的时候，艇长在吹口琴而不是想对策。整体说还算能看，毕竟特效做得不错，潜艇也是很还原，有些打斗场景确实挺燃的，不带太高预期看的话应该不会失望。,2025-02-09 13:26:05,6
4425778888,蛟龙行动,2025,红茶尼禄,2,《误杀4：蛟龙》,2025-01-27 21:45:32,39
4426090954,蛟龙行动,2025,Forrest,1,《蛟龙行动》剧情薄弱，逻辑漏洞频出（如“吹口琴修潜艇”强行煽情），动作戏堆砌却难掩文戏空洞，多线叙事支离破碎。女性角色被删减至“五分钟背景板”，票价虚高性价比低，打着主旋律旗号却沦为特效轰炸的工业流水线产品，林超贤这次失了水准。,2025-01-28 07:23:01,145
4425739209,蛟龙行动,2025,新世界,2,25年春节档第一部。肉眼可见的烧钱，龙鲸号刚登场后那一镜到底真的十分惊艳。但是问题还是太多了，人物塑造是没有的，林超贤对于文戏的调度可以说基本为零，这点就不如红海，红海里压缩文戏，把更多的戏份交给动作的部分。PS：主旋律类型化这条路得换种思路了。,2025-01-27 21:07:24,27
4426535143,蛟龙行动,2025,酱酱土土,3,潜艇作战场面很精彩，没想到的是曹弘浪倒是出彩了，单兵飞行和电子狗也比较溜，看看装备倒是可以期待一下，其他一般,2025-02-05 00:45:21,6
3055872591,蛟龙行动,2025,№ 偏执,3,当年，林超贤如果选择晚半年在暑期档与吴京硬刚，那么《战狼2》会被秒的连渣都不剩——前提是没有那些矫情的人去举报说吓着ta的小崽子。 所以我看完这一部的最大观后感是，我要再去看一遍《红海行动》。,2025-11-26 19:45:59,2
3404373825,蛟龙行动,2025,Olig梁,1,当年有多喜欢红海行动现在就有多讨厌蛟龙行动,2025-01-28 12:00:37,68
4689569772,蛟龙行动,2025,牛奶很忙,1,感觉像在看潜艇主题密室逃生综艺真人秀,2025-11-13 23:54:51,3
4446275783,蛟龙行动,2025,soul迪尔,3,不带脑子的去看还是挺有意思的,2025-02-12 14:49:03,5
4629073137,蛟龙行动,2025,第達里克·莫菲,2,特别版依旧不好看,2025-08-30 16:29:48,9
4424986910,蛟龙行动,2025,阿虚大,2,节奏好乱，好多地方交代的莫名其妙，也可能是我跟不上信息。观感很差，难以带入，只觉得音效好吵，对国产大片失去了兴趣了，春节档能不能来一两部安安静静专注内容的片子啊,2025-01-28 11:11:27,31
4426584608,蛟龙行动,2025,雪夜枫鳞,2,观影门槛高，基础故事差，题材无法像前作一样引发公众情绪，感官刺激削弱。这四点摆出来，还让点映的人看到就已经基本死刑了。 展开就不展开了，说一个很多（）都在发的话术：打着爽就够了。讲实话，前20分钟出片头后，能不迷糊的普通观众都是神仙，还打个爽就好。 另外，故事是真差啊,2025-01-29 00:34:33,30
4427356122,蛟龙行动,2025,T.V.Zoe ி,3,中国特色社会主义海王小队，看得太累了。,2025-01-29 19:22:38,12
4426746485,蛟龙行动,2025,婷娜贝尔,1,在令人一片眩晕的摄影下 超雄战士们的嘶吼中 只记住了一个吹口琴的爆笑画面和那句台词 “曹弘浪 给我答案”,2025-01-29 11:32:14,64
4427758742,蛟龙行动,2025,浅蓝大肥猫,2,情节拍得乱七八糟，不是情节本身乱，而是拍得乱。很多血腥暴力镜头无必要，不仅无助于推动情节、塑造人物，更拉低了影片的品味、扰乱了叙事。期待的大场面也没有令人满足，最喜欢的是蛟龙队员身着穿戴式飞行器飞起来的场面，其他大量海底潜艇场景比较令人压抑，容易引发幽闭恐惧症。,2025-01-29 23:01:23,59
4437180790,蛟龙行动,2025,张苑希,2,史上最差主旋律，文戏昏昏欲睡武戏凌乱不堪。领导决策失误吹口琴尬整士气，下属轮番攻敌集体面目模糊，反派无聊窝里横反转内斗，只有佟莉受伤的世界达成——拍摄戏份一剪没只给濒死特写活该票房大扑街。,2025-02-05 00:52:45,15
4426751524,蛟龙行动,2025,Miu,2,剧情从头到尾都说不通，莫名其妙冒着巨大风险救外国潜艇里的人，莫名其妙派了几个人就进巨大的核弹基地，还成功了。基地里的敌人就像游戏里的npc一样，就待在原地，等你过去一个一个地打死。,2025-01-29 11:37:09,30
4425485375,蛟龙行动,2025,乌龙,2,人物塑造和前一部比一个天上一个地下，结束了也没把人脸分清楚,2025-01-27 15:40:27,31
4426686016,蛟龙行动,2025,Django Tsai,2,实在不能理解为何用这么贵的置景却用最廉价的视听，感觉一切都是剪辑在力挽狂澜,2025-01-29 08:53:40,30
4773304533,蛟龙行动,2025,一贫,3,作为所谓国产首部潜艇电影，如果潜艇戏份再多一点的话，应该会更过瘾吧。另外前面的飞行器装备那么牛掰，后面却一直被机器狗干趴，真的有点难绷啊。 一开始没注意，其实要是作为独立的一部战争片是不错的，但要是作为《红海2》的话是不合格的，感觉差太多了。当然要是还有续作的话也还是可以期待的。😎,2026-02-18 21:40:31,0
4417805608,蛟龙行动,2025,孤霜,2,4分 太水了…… 开场就绷不住了，你这是致敬钢铁侠还是749呢？ 单体飞翔装备？ 这nm是科幻片吗？ 然后放了个大预告片，开场25分钟才出字幕，正片开始 之后就一直搁那介绍他那破潜艇 一堆专业名词，路人一脸蒙，无聊… 都一个小时了还在介绍潜艇 …… 完了，前一个小时有749的感觉了,2025-01-29 10:50:12,84
4425824917,蛟龙行动,2025,点虫虫,1,第一次直观感受到糟糕的调度与剪辑被放大到IMAX银幕反复强奸自己的感官；潜艇内部的爆破枪战与外部鱼雷对攻本可穿插形成良好的戏剧张力，使不同层级的危机相互嵌套，却被极度退化的空间意识拖累，完全不见危机如何解决/场景如何衔接。有一些被土晕的段落：口琴军歌、闪回、包饺子……林超贤的低级红实在有些过于幽默。,2025-01-27 22:25:48,56
4425762220,蛟龙行动,2025,joyoowang,2,林超贤是cf游戏迷吗，流浪地球2能做出来真是个奇迹,2025-01-27 21:30:24,30
4446835986,蛟龙行动,2025,墨卿風,3,朋友送票 比想象好看 虽然人物塑造约等于没有 但大场面很帅 开头飞行器也很帅 潜艇之间作战很新鲜 不明觉厉 摄影也不错 肉博戏毫无新意 太长 硬上主旋律太尬 吹口琴 唱歌好生硬 好刻板 分不清高级红还是低级黑 黄轩演戏真好！他是片中认识的演员里 唯一一个让我觉得表演方式有变化的 跟他别的角色完全不同 而且人物形象非常鲜明 结尾也有明显变化 其他人就是常规走戏 无功无过 两流量的演技约等于没有 镜头在他们脸上多停留一秒都会露怯 给这么多镜头 属实浪费 很多演员连正脸都看不清 演这种角色 感觉有点亏 还把人家佟莉的戏份删光！要是保留蒋璐霞 至少能多10个亿 这么费钱的片子 票房居然还不到4亿 香港电影到底是怎么了？太套路 都看腻了？,2025-02-12 23:42:49,5
4427200392,蛟龙行动,2025,女神的秋裤,4,林超贤算是咂透了国产军事动作题材，这次蛟龙小队从陆上潜入到深海，配合潜艇作战，不变的是依旧热血刺激的大场面和枪战，贴身肉搏戏份，荷尔蒙爆表。并且结合了单兵飞行器，机器狗，核弹，核潜艇各种高精尖元素，也是让我们窥见近未来战争中的一角。,2025-01-29 17:41:01,310
4425755578,蛟龙行动,2025,M,1,又烂又长,2025-01-27 21:24:03,113
4441430086,蛟龙行动,2025,飄จุ๊บ搖,1,除了《吴京大战妙瓦底》以外这类的电影就别拍了，要么拍了直接卖给广电总局！,2025-02-08 12:25:00,50
4429656394,蛟龙行动,2025,十一伏特,4,很难得的国产潜艇对抗战争大片，在深海之下数百米抵御外敌入侵，保卫国家安全。全片都是IMAX特制拍摄，全画幅1.9:1比例能把画面完全铺满，视听体验非常棒，推荐优先在IMAX影厅观看，才能得到最完整的观感。林超贤导演延续战争动作场面的火爆节奏，鲍德熹摄影指导掌机，香港制作班底如今在内地主旋律大片领域已经是游刃有余。部分情节和前作《红海行动》也有联系，而本部电影单独观看也相对完整成篇。,2025-01-31 08:01:35,10
4431878815,蛟龙行动,2025,疯狂的面条,2,AI剧本机械狗，观感枯燥又聒噪，红海行动的成功看来只是一个意外.,2025-02-01 19:00:13,25
4449295346,蛟龙行动,2025,罗森贝里,0,这些主旋律电影在之前经济已经开始下行的时候还凑合，在现在经济下行到这么差了，还在上映，那我们这些屁民看着不就适得其反了了吗？国家这么牛逼，这么主旋律，那我们为啥开始生活越来越难了，都快活不下去，有些开始铤而走险了，能不闹心嘛？,2025-02-15 10:13:19,6
4430786164,蛟龙行动,2025,三岛,2,"20250126点映 avec.mm 如果直接在正片末尾附上“火热军营，精彩人生""的征兵广告，而不是两男人间别扭的兄弟情，或许能将此片完全带往宣传口（类战狼），这样就彻底同《红海行动》所开创的新主旋律完美闭合（是指又回到了传统主旋律之中）。而要说延续”红海“的类型化基因，林超贤当然是有的，故事大致围绕着两位男星双线并行，且成文/武展开，其深谙类型片的“最后一分钟营救”的叙事模型，无论是[核潜艇/鱼雷]、机器狗这样的现代化战争机器，还是任何动作打斗场面。而镜头设计除了开头那一大段介绍核潜艇空间的长镜头，以及最后三分之一以外，都显得拙劣（尤其是水下核潜艇之间的）。",2025-01-31 23:04:25,10
4426516066,蛟龙行动,2025,夜交藤宾果,2,张涵予吹口琴必将成为2025年度电影镜头,2025-01-28 22:35:10,39
4426932901,蛟龙行动,2025,daangel,3,战斗动作戏，军迷看的很过瘾！但这文戏再不重要，也不至于这个水平。,2025-01-29 14:13:26,6
4542557679,蛟龙行动,2025,小艮,2,难看。无法补救的难看。,2025-05-27 20:38:19,7
4424997645,蛟龙行动,2025,呆橙轩,3,确实够硬，完全操纵感官却不走心的军事片。各种特效的投喂过满，导致角色的情感与情节发展合不上位，以及前线“蛟龙小队”和后方“龙鲸号”有些割裂，所以看完后只觉着眼睛和耳朵有些疲惫。当然可以肯定的是林超贤对此类题材的处理已经驾轻就熟了，节奏把控到位，动作戏情绪值拉满，唯一亮点就是机器狗，未来人机大战可能是条新路子。若图感官一时爽的话可看。,2025-02-01 15:15:08,6
4684582224,蛟龙行动,2025,zoroalice,2,优酷看的特别版，看完满脸问号～,2025-11-07 16:48:13,9
4431662883,蛟龙行动,2025,摄会,1,豆瓣真的很公平，烂就是烂,2025-02-01 16:29:09,26
4434709303,蛟龙行动,2025,超卜力星人,2,一星是黑子，那二星就不算了。希望解救缅甸同胞，少拍一些自嗨电影。,2025-02-03 16:22:37,32
4443821294,蛟龙行动,2025,小重山,5,非常棒！和袋袋一起看的，耽耽去看拿渣了，在冬广场飞扬影城。都说拍片少买票少，但一天也好几场，我那场的黄金几排都坐上人了，而且看得出都是硬核题材爱好者，不是随缘看一部那种。网上说是宣发乱说话拉坏口碑，那实在是可惜这部好片。华北的山体中潜艇母港的展现也很符合既往的想象。,2025-02-10 08:57:48,4
4426798245,蛟龙行动,2025,正义B胜,2,太土了…,2025-01-29 12:14:02,59
4426806921,蛟龙行动,2025,鹊起,2,剧情还行吧，一般般，没有红海行动那么好看。剧情方面我觉得于适兄弟情和最后漫威镜头镜头建议让给同蛟龙小队的蒋璐霞，因为于适确实演的不好哈，王俊凯的戏份演出了全剧的最好镜头，而且特别高光。张涵予老师一如既往的稳定,2025-01-29 12:21:19,154
4426806113,蛟龙行动,2025,羊卷卷,2,剧情一般 看得很难受 整部电影只记住了三字和佟莉的表演 吹口哨那段看得莫名其妙…男主演技有点木木的。,2025-01-29 12:20:39,133
4433506803,蛟龙行动,2025,香径何寂寂,4,潜艇大战，鱼雷，声呐，反击，躲避等等很好看，除此之外主线剧情有点模糊，基地战斗比较混乱。煽情也有点过度导致牺牲太刻意了。,2025-02-03 17:42:43,6
4427228817,蛟龙行动,2025,LZQIMAX,2,乱节奏乱摄影让我睡意频起，不懂导演想要突出的是什么，不如红海行动一半的质感。,2025-01-29 18:00:59,20
4697698548,蛟龙行动,2025,差不多查理,1,导演有能力拍电影吗！？会塑造人物会叙事吗？反派毫无塑造的结果就是，看一堆人莫名其妙的打来打去，毫无意义的打来打去。拍的什马东西！！,2025-11-23 21:14:12,4
4430491607,蛟龙行动,2025,超人叔叔,2,鼓舞气势的转折有点......以及背后书柜里一排.......其实要是能跳脱行动小队认真讲好潜艇对战倒也是个不错选择 现在就感觉浪费了水下庞然大物的这个设定 紧张感甚至不如法国那本狼嚎,2025-01-31 20:33:06,17
4420793198,蛟龙行动,2025,我是一颗跳跳糖,4,林超贤延续了一贯风格，全片打斗、枪战、爆破场面多，动作凌厉狠辣，还有像炸飞、劈头、拦腰这类大尺度镜头，不少。前作里令人印象深刻的女蛟龙，这次戏份寥寥，匆匆落幕，实在可惜。我个人偏爱动作场面丰富的影片，这类电影通常文戏较弱，这部也不在意料之外。片中深海潜艇战里鱼雷声呐的声音，有的听起来比较刺耳。记得上次看黄轩张涵予主演是在同类型片-邱礼涛的《莫斯科行动》。（P.S.张涵予的戏份根本没有和外国人照面的啊，那个什么防泄密的破宣发实在太搞了😅（《蛟龙行动》我春节去电影院看的146分钟，应该算绝版了，现在上线的是重剪的130分钟特别版，看了还不错）,2025-01-30 13:30:57,6
4386936552,蛟龙行动,2025,杜望川,3,说是《红海行动》续作，除了蛟龙里面有几个上部人物(而且最后就死了一个佟莉)，其他并没有什么联系。最大的问题是真实度大幅下降，虽然潜艇很酷炫，潜艇对战很刺激。蛟龙的突入作战部分很明显不如前作。煽情的太刻意了，韩骁这个角色设计的也很奇怪。剧情整体完全就是美式灾难片的套路，只不过这回是美国想搞事，中国负责拯救世界。,2025-11-09 16:10:22,4
4446637216,蛟龙行动,2025,奈律,1,敢拍《妙瓦底行动》吗？敢就改5星,2025-02-12 21:24:02,27
4434502512,蛟龙行动,2025,山归,3,虽然剧情悬浮了点，动机不足了点，关键时刻的转折不给力了点，但春节档垫底，还是委屈它了。,2025-02-03 13:05:43,17
4687068154,蛟龙行动,2025,孔府小鱼,2,从写实战争动作片完全变成俗套的烂大街商业片，乱七八糟加那么多东西，林超贤在犯和《紧急救援》一样剧情矫情、人物逆天的老毛病。,2025-11-10 15:57:18,3
4428804733,蛟龙行动,2025,Maybecraaazy,3,三颗星都给我军的先进装备和画面 这种电影的文戏什么时候能进步一点，别动不动生死存亡的时刻，就突然慢镜头给每人大特写，然后张涵予闭眼叹气摇头三件套，开始吹起口琴啊啊啊啊啊啊啊啊啊啊,2025-01-30 18:08:48,19
4694311552,蛟龙行动,2025,巅峰Futurama迷,3,这片没那么不好。比林的前作好。但是。。。,2025-11-19 20:14:52,3
4427155339,蛟龙行动,2025,千叶柱间,2,为了维和，误打误撞瞎参活，但误获得邪恶阴谋！继续为了拯救全亚洲，前进三！极窄空间动作戏份全程打到底，晃闪blinkblink火火火，小场景装着巨场景的心,2025-01-29 17:09:47,29
4425034864,蛟龙行动,2025,一颗威廉大福,2,笑嘻这届卖不过熊出没的片子出现辣🤣👉🤡尽管不明白博纳在宣传时所谓的“潜艇电影”这个类型划分是怎么定义的，但在亚洲市场上类似题材改良好莱坞A级制作的zz意淫片赛道早已被《铁雨2》打开过局面，借到服役军舰拍片真不如照抄下这部。类型能力和战术调度跟不上就用脑洞和r级镜头凑出了一部军迷频道福音片，懂节奏的林超贤前一个半小时试图教大家开潜艇，之后才让故事进到主线，鉴定为剧情比潜艇机密捂得严实。srds就博纳在用脚投票的资本游戏里被商业霸凌这件事上，怎么不算是国内观众的进步，怎么不算新年的头一等好消息。,2025-01-27 18:27:35,38
4685740409,蛟龙行动,2025,鱼剑,1,难看到令人发指…,2025-11-08 23:32:53,3
4426858144,蛟龙行动,2025,HarperDie,4,看过《红海》《湄公河》的观众对林超贤有个很清晰的风格画像，剪辑利索细节却糙得很，可摄影指导鲍德熹偏就是个细腻缜密的人，在IMAX摄影机的辅助下，充满设计感的镜头很好补齐了林超贤原有的短板，并使之充分在银幕上放大。我想会有观众觉得蛟龙和龙鲸并行叙述的方式，显得贪多嚼不烂。但林超贤在10年代后寻求的创作视角，本就是在规模上的指数化质变，而这一次他终于在主旋律与商业性的平衡度上摸到了门槛。另一方面，黄轩找到了久违的银幕光彩，于适则在动作小生这个赛道成为了领跑者。中国大制作若想突破必须要有这样一遭赴汤蹈火。,2025-01-29 13:04:44,17
4427364959,蛟龙行动,2025,The Great Lee,1,麻木，膨脹，愚蠢。,2025-01-29 19:29:00,62
4340195906,蛟龙行动,2025,焦糖爆爆,3,没想到2025年可以在IMAX看到七八十年代黑白抗日片类似的情节。海底潜艇和鱼雷发射镜头很震撼，加上IMAX的音效座椅都在震。断手特写和尸体碎片有点看头。王俊凯和于适认真演起来也挺像模像样的。,2025-01-30 23:37:46,5
4041849321,蛟龙行动,2025,神奇海螺,3,韩骁哥，你知道的，我从小就没有老公🥺,2025-06-26 10:30:23,4
4628030040,蛟龙行动,2025,阿莱,1,黄轩 认准这条赛道 不准再回去演谈恋爱的剧了 真的0人想看你亲嘴 以及于适是真不行 🙄️,2025-08-29 11:23:01,9
4427057220,蛟龙行动,2025,SingLesinger,3,我推举小凯为新的张惠妹，因为他很会听海。最棒的确实是潜艇的长镜头。整体与其说是战争军事片，不如说是科幻片，开篇的“故事虚构”以及“某时空”啥的字样就奠定基调，有拳拳到肉的打斗，但是小飞侠飞行包，机器狗， 以及像环太平洋一样的科幻感核控制室，都让故事很悬浮。张涵予面对灵魂黑夜突然掏出口琴不仅送走了敌军，也送走了观众，“我是潜艇兵”以及那首绝美军歌更是让人京掉下巴，有一种眼睁睁的看一座城堡倒塌的悲伤和扼腕。,2025-01-29 15:59:41,12
4438837864,蛟龙行动,2025,鲜藕大王,1,这玩意儿是爱国主旋律吧？ 那怎么平时保障有力的精锐队伍，一到实战就手忙脚乱，跟捅了耗子窝似的，干啥啥不行？ 还有，艇都冒火星子要炸了呀，用脑子想办法行不行，吹口琴，要召唤谁？！,2025-02-06 10:46:36,51
4689116737,蛟龙行动,2025,头就这么疼星人,3,想法挺好，投资加一倍也许能拍出想要的效果，这个版本在电视上看都觉得粗糙。角色全都面目模糊，唯一留下点印象的是声纳兵。,2025-11-13 12:11:48,8
4431613791,蛟龙行动,2025,绮梦🎶,3,潜艇加分，文戏减分，没想到文戏这么少煽情还这么尬，虚构敌方缺乏代入感不如直接用米国啊，亮点是潜艇和突突突，整个节奏有点儿仓促导致人物塑造不够，最后非要骁子捅队长一刀才能解开心结有点俗了。,2025-02-01 15:50:22,6
4430259636,蛟龙行动,2025,好怕天热,2,ai写出来的剧本，脸谱化的表演，五毛钱的特效，轰隆隆但淡如水的音效。从电影上来说，就是不合格的作品，更别说军事上的各种不合理。,2025-01-31 17:54:03,24
4687059672,蛟龙行动,2025,ChrisKirk,2,几乎没有什么情节，也没有明确的敌方，像一场大型的海底军事演习。,2025-11-10 15:45:12,2
4426925820,蛟龙行动,2025,Breeze,1,比预期更烂。机位瞎几把摆，我想问问林超贤是谁教你搞这么多仰拍和对角线构图的？什么？摄影指导是鲍德熹？就这玩意你还好意思署名？这光打得和网大有什么区别？还有手持模拟呼吸感的业余程度直接把我逗笑了。剪辑也瞎几把剪，没有一场戏是把逻辑捋清楚的。看这玩意就像是在看一篇小学生作文，你得从一大堆病句和错别字里大概猜出他想讲什么，可问题是小学生作文他可爱啊，你呢？你这玩意真的不是存心喂观众屎？,2025-01-29 14:07:24,28
4431439433,蛟龙行动,2025,鹿熊,3,特种兵真是帅！核潜艇事业的武装力量和人员配备也是真厉害！只是感觉缺少太多内核，只看到了一个个冰冷刺骨的钢铁，在深海火山岩带附近，绝望挣扎出新生的氛围不太浓厚，情绪气氛略显薄弱。,2025-02-01 13:22:39,6
4445292061,蛟龙行动,2025,爱尔兰的天空,1,圆满完成了保密任务,2025-02-11 17:01:17,9
